Holiday,Temperature,Rainfall_last_hour,Snowfall_last_hour,Cloud_Cover,Weather,Weather_Desc,TimeStamp,Date,Traffic_Vol
0.0,288.086,0.0,0.0,92,Rainfall,Soft rain,11-06-2018 20:00,2018-06-11,4172.22
0.0,298.043,0.0,0.0,0,Clear skies,Clear skies,12-06-2018 18:00,2018-06-12,6123.52
0.0,292.961,0.0,0.0,8,Clear skies,Clear skies,12-06-2018 20:00,2018-06-12,4450.42
0.0,292.361,0.0,0.0,9,Clear skies,Clear skies,12-06-2018 21:00,2018-06-12,4707.82
0.0,295.34,0.0,0.0,76,Cloudy skies,Fragmented clouds,13-06-2018 21:00,2018-06-13,4380.22
0.0,293.437,0.0,0.0,56,Cloudy skies,Fragmented clouds,13-06-2018 23:00,2018-06-13,3090.62
0.0,296.164,0.0,0.0,89,Rainfall,Soft rain,14-06-2018 20:00,2018-06-14,4200.82
0.0,300.007,0.0,0.0,0,Clear skies,Clear skies,19-06-2018 18:00,2018-06-19,6505.72
0.0,296.269,0.0,0.0,88,Rainfall,Soft rain,20-06-2018 18:00,2018-06-20,5681.52
0.0,294.514,0.0,0.0,12,Cloudy skies,Scattered clouds,22-06-2018 00:00,2018-06-22,1387.62
0.0,295.944,0.0,0.0,12,Cloudy skies,Scattered clouds,22-06-2018 18:00,2018-06-22,6170.32
0.0,287.841,0.0,0.0,0,Clear skies,Clear skies,24-06-2018 04:00,2018-06-24,1629.42
0.0,290.325,0.0,0.0,0,Clear skies,Clear skies,24-06-2018 06:00,2018-06-24,8011.12
0.0,290.725,0.0,0.0,0,Clear skies,Clear skies,24-06-2018 07:00,2018-06-24,7452.12
0.0,290.625,0.0,0.0,0,Clear skies,Clear skies,24-06-2018 08:00,2018-06-24,7045.22
0.0,298.003,0.0,0.0,36,Cloudy skies,Partly cloudy skies,24-06-2018 10:00,2018-06-24,6570.72
0.0,300.782,0.0,0.0,24,Cloudy skies,Scattered clouds,24-06-2018 11:00,2018-06-24,6860.62
0.0,300.782,0.0,0.0,24,Cloudy skies,Scattered clouds,24-06-2018 13:00,2018-06-24,6928.22
0.0,301.521,0.0,0.0,12,Cloudy skies,Scattered clouds,24-06-2018 14:00,2018-06-24,7245.42
0.0,301.521,0.0,0.0,12,Cloudy skies,Scattered clouds,24-06-2018 15:00,2018-06-24,8000.72
0.0,302.021,0.0,0.0,12,Cloudy skies,Scattered clouds,24-06-2018 16:00,2018-06-24,8730.02
0.0,298.71,0.0,0.0,92,Rainfall,Soft rain,24-06-2018 18:00,2018-06-24,6484.92
0.0,298.11,0.0,0.0,92,Rainfall,Soft rain,24-06-2018 19:00,2018-06-24,4818.32
0.0,298.51,0.0,0.0,92,Rainfall,Soft rain,24-06-2018 20:00,2018-06-24,4367.22
0.0,292.096,0.0,0.0,92,Rainfall,Steady rain,24-06-2018 21:00,2018-06-24,4228.12
0.0,292.096,0.0,0.0,92,Rainfall,Steady rain,24-06-2018 22:00,2018-06-24,3179.02
0.0,292.096,0.0,0.0,92,Rainfall,Steady rain,24-06-2018 23:00,2018-06-24,1997.32
0.0,291.916,0.0,0.0,88,Rainfall,Soft rain,25-06-2018 00:00,2018-06-25,1420.12
0.0,291.816,0.0,0.0,88,Rainfall,Soft rain,25-06-2018 02:00,2018-06-25,853.32
0.0,291.393,0.0,0.0,88,Rainfall,Soft rain,25-06-2018 03:00,2018-06-25,878.02
0.0,300.04,0.0,0.0,1,Clear skies,Clear skies,25-06-2018 13:00,2018-06-25,7080.32
0.0,300.23,0.0,0.0,75,Cloudy skies,Fragmented clouds,25-06-2018 14:00,2018-06-25,7263.62
0.0,300.4,0.0,0.0,40,Cloudy skies,Partly cloudy skies,25-06-2018 15:00,2018-06-25,8380.32
0.0,300.8,0.0,0.0,41,Cloudy skies,Partly cloudy skies,25-06-2018 16:00,2018-06-25,8590.92
0.0,300.52,0.0,0.0,75,Cloudy skies,Fragmented clouds,25-06-2018 17:00,2018-06-25,8224.32
0.0,298.92,0.0,0.0,1,Clear skies,Clear skies,25-06-2018 19:00,2018-06-25,5416.32
0.0,297.96,0.0,0.0,1,Clear skies,Clear skies,25-06-2018 20:00,2018-06-25,4596.02
0.0,295.95,0.0,0.0,2,Clear skies,Clear skies,25-06-2018 21:00,2018-06-25,4567.42
0.0,293.56,0.0,0.0,1,Clear skies,Clear skies,25-06-2018 22:00,2018-06-25,3630.12
0.0,292.71,0.0,0.0,1,Clear skies,Clear skies,25-06-2018 23:00,2018-06-25,2388.62
0.0,291.8,0.0,0.0,1,Clear skies,Clear skies,26-06-2018 00:00,2018-06-26,1543.62
0.0,290.74,0.0,0.0,1,Clear skies,Clear skies,26-06-2018 01:00,2018-06-26,1066.52
0.0,291.35,0.0,0.0,2,Clear skies,Clear skies,26-06-2018 02:00,2018-06-26,924.82
0.0,290.53,0.0,0.0,1,Clear skies,Clear skies,26-06-2018 04:00,2018-06-26,1548.82
0.0,290.12,0.0,0.0,1,Clear skies,Clear skies,26-06-2018 05:00,2018-06-26,3983.72
0.0,289.95,0.0,0.0,1,Clear skies,Clear skies,26-06-2018 06:00,2018-06-26,7692.62
0.0,292.37,0.0,0.0,1,Clear skies,Clear skies,26-06-2018 08:00,2018-06-26,6965.92
0.0,295.5,0.0,0.0,1,Clear skies,Clear skies,26-06-2018 10:00,2018-06-26,6183.32
0.0,297.4,0.0,0.0,1,Airborne particles,Smoky air,26-06-2018 11:00,2018-06-26,6276.92
0.0,299.1,0.0,0.0,1,Clear skies,Clear skies,26-06-2018 13:00,2018-06-26,6033.82
0.0,300.03,0.0,0.0,1,Clear skies,Clear skies,26-06-2018 14:00,2018-06-26,7081.62
0.0,299.7,0.0,0.0,1,Clear skies,Clear skies,26-06-2018 15:00,2018-06-26,8009.82
0.0,300.04,0.0,0.0,40,Cloudy skies,Partly cloudy skies,26-06-2018 16:00,2018-06-26,8221.72
0.0,299.07,0.55,0.0,75,Rainfall,Soft rain,26-06-2018 17:00,2018-06-26,7340.32
0.0,296.63,0.55,0.0,40,Rainfall,Steady rain,26-06-2018 18:00,2018-06-26,6161.22
0.0,296.68,1.02,0.0,40,Rainfall,Steady rain,26-06-2018 19:00,2018-06-26,5119.92
0.0,294.89,0.0,0.0,90,Rainfall,Steady rain,26-06-2018 20:00,2018-06-26,4488.12
0.0,293.1,0.0,0.0,1,Stormy weather,Approaching thunderstorm,26-06-2018 21:00,2018-06-26,4902.82
0.0,291.76,0.0,0.0,2,Rainfall,Soft rain,26-06-2018 22:00,2018-06-26,4372.42
0.0,290.73,0.0,0.0,1,Clear skies,Clear skies,26-06-2018 23:00,2018-06-26,3154.32
0.0,290.24,0.0,0.0,1,Clear skies,Clear skies,27-06-2018 00:00,2018-06-27,2331.42
0.0,289.5,0.0,0.0,1,Clear skies,Clear skies,27-06-2018 01:00,2018-06-27,1508.52
0.0,288.75,0.0,0.0,1,Clear skies,Clear skies,27-06-2018 02:00,2018-06-27,1295.32
0.0,288.98,0.7,0.0,1,Rainfall,Soft rain,27-06-2018 03:00,2018-06-27,1015.82
0.0,288.44,0.0,0.0,2,Light fog,Fine fog,27-06-2018 04:00,2018-06-27,1087.32
0.0,287.26,0.0,0.0,1,Light fog,Fine fog,27-06-2018 05:00,2018-06-27,1531.92
0.0,287.62,0.0,0.0,1,Light fog,Fine fog,27-06-2018 06:00,2018-06-27,2207.92
0.0,289.43,0.0,0.0,1,Light fog,Fine fog,27-06-2018 07:00,2018-06-27,3081.52
0.0,292.38,0.0,0.0,1,Clear skies,Clear skies,27-06-2018 08:00,2018-06-27,3934.32
0.0,294.61,0.0,0.0,1,Clear skies,Clear skies,27-06-2018 09:00,2018-06-27,4950.92
0.0,296.51,0.0,0.0,1,Clear skies,Clear skies,27-06-2018 10:00,2018-06-27,5502.12
0.0,297.77,0.0,0.0,1,Clear skies,Clear skies,27-06-2018 11:00,2018-06-27,5593.12
0.0,299.85,0.0,0.0,1,Clear skies,Clear skies,27-06-2018 12:00,2018-06-27,6135.22
0.0,300.05,0.0,0.0,2,Clear skies,Clear skies,27-06-2018 13:00,2018-06-27,5820.62
0.0,301.06,0.0,0.0,1,Clear skies,Clear skies,27-06-2018 14:00,2018-06-27,5925.92
0.0,301.55,0.0,0.0,41,Cloudy skies,Partly cloudy skies,27-06-2018 15:00,2018-06-27,6000.02
0.0,301.66,0.0,0.0,1,Clear skies,Clear skies,27-06-2018 16:00,2018-06-27,5597.02
0.0,301.44,0.0,0.0,1,Clear skies,Clear skies,27-06-2018 17:00,2018-06-27,5681.52
0.0,299.79,0.0,0.0,1,Clear skies,Clear skies,27-06-2018 18:00,2018-06-27,5230.42
0.0,299.3,0.0,0.0,1,Clear skies,Clear skies,27-06-2018 19:00,2018-06-27,5092.62
0.0,298.33,0.0,0.0,1,Clear skies,Clear skies,27-06-2018 20:00,2018-06-27,4866.42
0.0,295.96,0.0,0.0,2,Clear skies,Clear skies,27-06-2018 22:00,2018-06-27,4779.32
0.0,294.12,2.86,0.0,75,Rainfall,Steady rain,27-06-2018 23:00,2018-06-27,3592.42
0.0,292.95,0.79,0.0,90,Rainfall,Steady rain,28-06-2018 00:00,2018-06-28,2310.62
0.0,292.22,1.49,0.0,90,Rainfall,Steady rain,28-06-2018 01:00,2018-06-28,1490.32
0.0,291.62,8.89,0.0,40,Rainfall,Intense rainfall,28-06-2018 02:00,2018-06-28,1240.72
0.0,291.04,0.0,0.0,90,Light rain,Light rain,28-06-2018 03:00,2018-06-28,878.02
0.0,291.21,0.342857143,0.0,90,Rainfall,Soft rain,28-06-2018 04:00,2018-06-28,857.22
0.0,291.26,0.922857143,0.0,90,Rainfall,Steady rain,28-06-2018 05:00,2018-06-28,1057.42
0.0,291.28,0.787142857,0.0,90,Rainfall,Soft rain,28-06-2018 06:00,2018-06-28,1522.82
0.0,292.05,0.0,0.0,90,Light rain,Mild drizzle,28-06-2018 07:00,2018-06-28,1915.42
0.0,292.64,0.0,0.0,90,Cloudy skies,Full cloud cover,28-06-2018 08:00,2018-06-28,2898.22
0.0,294.06,0.0,0.0,90,Cloudy skies,Full cloud cover,28-06-2018 09:00,2018-06-28,4369.82
0.0,295.37,0.0,0.0,40,Cloudy skies,Partly cloudy skies,28-06-2018 10:00,2018-06-28,5294.12
0.0,296.39,0.0,0.0,40,Cloudy skies,Partly cloudy skies,28-06-2018 11:00,2018-06-28,5377.32
0.0,297.59,0.0,0.0,1,Clear skies,Clear skies,28-06-2018 12:00,2018-06-28,5719.22
0.0,298.33,0.0,0.0,40,Cloudy skies,Partly cloudy skies,28-06-2018 13:00,2018-06-28,5923.32
0.0,299.64,0.0,0.0,75,Cloudy skies,Fragmented clouds,28-06-2018 14:00,2018-06-28,6362.72
0.0,299.38,1.27,0.0,41,Rainfall,Steady rain,28-06-2018 15:00,2018-06-28,6140.42
0.0,296.12,2.231428571,0.0,90,Rainfall,Intense rainfall,28-06-2018 16:00,2018-06-28,6033.82
0.0,293.78,11.69,0.0,90,Rainfall,Intense rainfall,28-06-2018 17:00,2018-06-28,5685.42
0.0,294.54,2.344285714,0.0,40,Rainfall,Steady rain,28-06-2018 18:00,2018-06-28,5121.22
0.0,294.5,0.0,0.0,75,Cloudy skies,Fragmented clouds,28-06-2018 19:00,2018-06-28,4867.72
0.0,294.75,0.0,0.0,75,Cloudy skies,Fragmented clouds,28-06-2018 20:00,2018-06-28,4286.62
0.0,293.73,0.0,0.0,0,Clear skies,Clear skies,28-06-2018 21:00,2018-06-28,3570.32
0.0,292.63,0.0,0.0,40,Cloudy skies,Partly cloudy skies,28-06-2018 22:00,2018-06-28,3054.22
0.0,292.25,0.0,0.0,41,Cloudy skies,Partly cloudy skies,28-06-2018 23:00,2018-06-28,2046.72
0.0,291.33,0.0,0.0,40,Light fog,Fine fog,29-06-2018 00:00,2018-06-29,1310.92
0.0,290.9,0.0,0.0,1,Light fog,Fine fog,29-06-2018 01:00,2018-06-29,944.32
0.0,290.59,0.0,0.0,1,Light fog,Fine fog,29-06-2018 02:00,2018-06-29,858.52
0.0,290.88,0.0,0.0,2,Light fog,Fine fog,29-06-2018 03:00,2018-06-29,854.62
0.0,290.44,0.0,0.0,2,Dense fog,Dense fog,29-06-2018 04:00,2018-06-29,1593.02
0.0,290.22,0.0,0.0,2,Dense fog,Dense fog,29-06-2018 05:00,2018-06-29,4074.72
0.0,290.97,0.0,0.0,1,Dense fog,Dense fog,29-06-2018 06:00,2018-06-29,7836.92
0.0,291.42,0.442857143,0.0,1,Rainfall,Soft rain,29-06-2018 07:00,2018-06-29,8078.72
0.0,293.13,0.3,0.0,1,Rainfall,Soft rain,29-06-2018 08:00,2018-06-29,7355.92
0.0,294.93,1.0,0.0,1,Rainfall,Soft rain,29-06-2018 09:00,2018-06-29,6455.02
0.0,297.3,0.0,0.0,2,Clear skies,Clear skies,29-06-2018 10:00,2018-06-29,6191.12
0.0,298.95,0.0,0.0,1,Clear skies,Clear skies,29-06-2018 11:00,2018-06-29,6340.62
0.0,300.25,0.0,0.0,1,Clear skies,Clear skies,29-06-2018 12:00,2018-06-29,6769.62
0.0,300.49,0.0,0.0,40,Cloudy skies,Partly cloudy skies,29-06-2018 13:00,2018-06-29,6920.42
0.0,300.8,0.0,0.0,1,Clear skies,Clear skies,29-06-2018 14:00,2018-06-29,7842.12
0.0,300.3,0.0,0.0,1,Clear skies,Clear skies,29-06-2018 15:00,2018-06-29,8054.02
0.0,299.74,0.0,0.0,1,Rainfall,Soft rain,29-06-2018 16:00,2018-06-29,8871.72
0.0,299.32,0.0,0.0,1,Airborne particles,Smoky air,29-06-2018 18:00,2018-06-29,6371.82
0.0,296.5,9.414285714,0.0,1,Rainfall,Intense rainfall,29-06-2018 19:00,2018-06-29,4580.42
0.0,293.95,1.341428571,0.0,76,Rainfall,Steady rain,29-06-2018 20:00,2018-06-29,3712.02
0.0,292.39,3.242857143,0.0,2,Rainfall,Steady rain,29-06-2018 21:00,2018-06-29,3349.32
0.0,291.6,0.0,0.0,1,Light fog,Fine fog,29-06-2018 22:00,2018-06-29,2610.92
0.0,291.47,0.321428571,0.0,1,Rainfall,Soft rain,29-06-2018 23:00,2018-06-29,1855.62
0.0,290.79,0.0,0.0,40,Light fog,Fine fog,30-06-2018 00:00,2018-06-30,1300.52
0.0,290.5,0.0,0.0,41,Light fog,Fine fog,30-06-2018 02:00,2018-06-30,845.52
0.0,290.61,0.0,0.0,1,Light fog,Fine fog,30-06-2018 03:00,2018-06-30,969.02
0.0,290.11,0.25,0.0,1,Rainfall,Soft rain,30-06-2018 04:00,2018-06-30,1613.82
0.0,290.16,0.0,0.0,1,Airborne particles,Smoky air,30-06-2018 05:00,2018-06-30,4256.72
0.0,289.97,0.0,0.0,1,Light fog,Fine fog,30-06-2018 06:00,2018-06-30,8038.42
0.0,290.01,0.385714286,0.0,1,Rainfall,Soft rain,30-06-2018 07:00,2018-06-30,8304.92
0.0,291.13,0.0,0.0,1,Light fog,Fine fog,30-06-2018 08:00,2018-06-30,7385.82
0.0,292.26,0.0,0.0,40,Airborne particles,Smoky air,30-06-2018 09:00,2018-06-30,6068.92
0.0,293.58,0.0,0.0,76,Airborne particles,Smoky air,30-06-2018 10:00,2018-06-30,5996.12
0.0,295.18,0.0,0.0,40,Cloudy skies,Partly cloudy skies,30-06-2018 11:00,2018-06-30,6245.72
0.0,296.18,0.0,0.0,76,Cloudy skies,Fragmented clouds,30-06-2018 12:00,2018-06-30,6356.22
0.0,296.02,0.0,0.0,1,Clear skies,Clear skies,30-06-2018 13:00,2018-06-30,6288.62
0.0,296.83,0.0,0.0,1,Clear skies,Clear skies,30-06-2018 14:00,2018-06-30,7192.12
0.0,297.18,0.0,0.0,1,Clear skies,Clear skies,30-06-2018 15:00,2018-06-30,7514.52
0.0,297.42,0.0,0.0,1,Clear skies,Clear skies,30-06-2018 16:00,2018-06-30,8722.22
0.0,297.35,0.0,0.0,1,Clear skies,Clear skies,30-06-2018 17:00,2018-06-30,8364.72
0.0,291.65,0.0,0.0,1,Clear skies,Clear skies,30-06-2018 22:00,2018-06-30,3056.82
0.0,291.4,0.0,0.0,1,Clear skies,Clear skies,30-06-2018 23:00,2018-06-30,2050.62
0.0,289.7,0.0,0.0,1,Clear skies,Clear skies,01-07-2018 0:00,2018-07-01,1382.42
0.0,290.1,0.0,0.0,1,Clear skies,Clear skies,01-07-2018 1:00,2018-07-01,1002.82
0.0,289.99,0.0,0.0,1,Clear skies,Clear skies,01-07-2018 2:00,2018-07-01,874.12
0.0,289.54,0.4,0.0,2,Rainfall,Soft rain,01-07-2018 3:00,2018-07-01,889.72
0.0,289.07,0.0,0.0,1,Clear skies,Clear skies,01-07-2018 4:00,2018-07-01,1641.12
0.0,288.27,0.0,0.0,1,Clear skies,Clear skies,01-07-2018 5:00,2018-07-01,4177.42
0.0,287.58,0.0,0.0,1,Clear skies,Clear skies,01-07-2018 6:00,2018-07-01,7892.82
0.0,288.18,0.0,0.0,75,Cloudy skies,Fragmented clouds,01-07-2018 7:00,2018-07-01,8567.52
0.0,289.08,0.0,0.0,40,Cloudy skies,Partly cloudy skies,01-07-2018 9:00,2018-07-01,6154.72
0.0,289.94,0.0,0.0,40,Cloudy skies,Partly cloudy skies,01-07-2018 10:00,2018-07-01,5980.52
0.0,289.54,0.0,0.0,75,Cloudy skies,Fragmented clouds,01-07-2018 11:00,2018-07-01,6236.62
0.0,291.23,0.0,0.0,1,Clear skies,Clear skies,01-07-2018 12:00,2018-07-01,6435.52
0.0,292.87,0.0,0.0,2,Clear skies,Clear skies,01-07-2018 13:00,2018-07-01,6219.72
0.0,294.61,0.0,0.0,1,Clear skies,Clear skies,01-07-2018 14:00,2018-07-01,6919.12
0.0,294.95,0.0,0.0,1,Clear skies,Clear skies,01-07-2018 15:00,2018-07-01,7730.32
0.0,296.07,0.0,0.0,1,Clear skies,Clear skies,01-07-2018 16:00,2018-07-01,8501.22
0.0,296.06,0.0,0.0,2,Clear skies,Clear skies,01-07-2018 17:00,2018-07-01,8190.52
0.0,295.27,0.0,0.0,2,Clear skies,Clear skies,01-07-2018 18:00,2018-07-01,6405.62
0.0,295.76,0.0,0.0,1,Clear skies,Clear skies,01-07-2018 19:00,2018-07-01,5171.92
0.0,294.26,0.0,0.0,1,Clear skies,Clear skies,01-07-2018 20:00,2018-07-01,4514.12
0.0,291.79,0.0,0.0,1,Clear skies,Clear skies,01-07-2018 21:00,2018-07-01,4053.92
0.0,290.27,0.0,0.0,2,Clear skies,Clear skies,01-07-2018 22:00,2018-07-01,3489.72
0.0,288.5,0.0,0.0,1,Clear skies,Clear skies,01-07-2018 23:00,2018-07-01,4095.52
0.0,287.86,0.0,0.0,1,Clear skies,Clear skies,02-07-2018 0:00,2018-07-02,2068.82
0.0,287.17,0.0,0.0,1,Clear skies,Clear skies,02-07-2018 1:00,2018-07-02,1164.02
0.0,286.32,0.0,0.0,1,Clear skies,Clear skies,02-07-2018 2:00,2018-07-02,904.02
0.0,285.73,0.0,0.0,1,Clear skies,Clear skies,02-07-2018 3:00,2018-07-02,883.22
0.0,285.96,0.0,0.0,1,Light fog,Fine fog,02-07-2018 4:00,2018-07-02,1465.62
0.0,285.73,0.0,0.0,1,Light fog,Fine fog,02-07-2018 5:00,2018-07-02,3935.62
0.0,285.42,0.0,0.0,1,Light fog,Fine fog,02-07-2018 6:00,2018-07-02,7439.12
0.0,287.34,0.0,0.0,1,Clear skies,Clear skies,02-07-2018 7:00,2018-07-02,8134.62
0.0,289.71,0.0,0.0,1,Clear skies,Clear skies,02-07-2018 8:00,2018-07-02,6907.42
0.0,289.79,0.0,0.0,2,Clear skies,Clear skies,02-07-2018 9:00,2018-07-02,6170.32
0.0,294.13,0.0,0.0,1,Clear skies,Clear skies,02-07-2018 10:00,2018-07-02,5958.42
0.0,295.1,0.0,0.0,1,Clear skies,Clear skies,02-07-2018 11:00,2018-07-02,6681.22
0.0,295.7,0.0,0.0,1,Clear skies,Clear skies,02-07-2018 12:00,2018-07-02,7249.32
0.0,296.78,0.0,0.0,41,Cloudy skies,Partly cloudy skies,02-07-2018 13:00,2018-07-02,7184.32
0.0,297.37,0.0,0.0,40,Cloudy skies,Partly cloudy skies,02-07-2018 14:00,2018-07-02,7701.72
0.0,298.29,0.0,0.0,40,Cloudy skies,Partly cloudy skies,02-07-2018 15:00,2018-07-02,7842.12
0.0,298.19,0.0,0.0,2,Clear skies,Clear skies,02-07-2018 16:00,2018-07-02,7918.82
0.0,297.84,0.0,0.0,1,Clear skies,Clear skies,02-07-2018 17:00,2018-07-02,6886.62
0.0,297.76,0.0,0.0,1,Clear skies,Clear skies,02-07-2018 18:00,2018-07-02,5582.72
0.0,296.64,0.0,0.0,1,Clear skies,Clear skies,02-07-2018 19:00,2018-07-02,5015.92
0.0,295.68,0.0,0.0,1,Clear skies,Clear skies,02-07-2018 20:00,2018-07-02,4295.72
0.0,293.52,0.0,0.0,1,Clear skies,Clear skies,02-07-2018 21:00,2018-07-02,4324.32
0.0,291.76,0.0,0.0,2,Clear skies,Clear skies,02-07-2018 22:00,2018-07-02,3712.02
0.0,291.27,0.0,0.0,1,Clear skies,Clear skies,02-07-2018 23:00,2018-07-02,2584.92
1.0,289.9,0.0,0.0,1,Clear skies,Clear skies,03-07-2018 0:00,2018-07-03,1676.22
1.0,288.44,0.0,0.0,1,Clear skies,Clear skies,03-07-2018 1:00,2018-07-03,1219.92
1.0,288.4,0.0,0.0,1,Light fog,Fine fog,03-07-2018 2:00,2018-07-03,1011.92
1.0,287.53,0.0,0.0,1,Light fog,Fine fog,03-07-2018 3:00,2018-07-03,891.02
1.0,287.11,0.0,0.0,1,Clear skies,Clear skies,03-07-2018 4:00,2018-07-03,1026.22
1.0,286.95,0.0,0.0,1,Clear skies,Clear skies,03-07-2018 5:00,2018-07-03,1672.32
1.0,286.0,0.0,0.0,1,Light fog,Fine fog,03-07-2018 6:00,2018-07-03,2948.92
1.0,288.32,0.0,0.0,1,Clear skies,Clear skies,03-07-2018 7:00,2018-07-03,3504.02
1.0,288.75,0.0,0.0,1,Clear skies,Clear skies,03-07-2018 8:00,2018-07-03,3709.42
1.0,292.81,0.0,0.0,1,Clear skies,Clear skies,03-07-2018 9:00,2018-07-03,4620.72
1.0,294.28,0.0,0.0,2,Clear skies,Clear skies,03-07-2018 10:00,2018-07-03,5264.22
1.0,295.96,0.0,0.0,2,Clear skies,Clear skies,03-07-2018 11:00,2018-07-03,5675.02
1.0,297.39,0.0,0.0,1,Clear skies,Clear skies,03-07-2018 12:00,2018-07-03,5977.92
1.0,298.27,0.0,0.0,1,Clear skies,Clear skies,03-07-2018 13:00,2018-07-03,6118.32
1.0,298.88,0.0,0.0,2,Clear skies,Clear skies,03-07-2018 14:00,2018-07-03,5975.32
1.0,299.92,0.0,0.0,1,Clear skies,Clear skies,03-07-2018 15:00,2018-07-03,6065.02
1.0,299.57,0.0,0.0,1,Clear skies,Clear skies,03-07-2018 16:00,2018-07-03,5998.72
1.0,299.75,0.0,0.0,1,Clear skies,Clear skies,03-07-2018 17:00,2018-07-03,5004.22
1.0,298.73,0.0,0.0,1,Airborne particles,Smoky air,03-07-2018 18:00,2018-07-03,5320.12
1.0,298.64,0.0,0.0,2,Airborne particles,Smoky air,03-07-2018 19:00,2018-07-03,4666.22
1.0,297.42,0.0,0.0,1,Clear skies,Clear skies,03-07-2018 20:00,2018-07-03,4012.32
1.0,295.98,0.0,0.0,1,Light fog,Fine fog,03-07-2018 21:00,2018-07-03,3985.02
1.0,294.43,0.0,0.0,1,Light fog,Fine fog,03-07-2018 22:00,2018-07-03,4446.52
1.0,293.79,0.0,0.0,2,Light fog,Fine fog,03-07-2018 23:00,2018-07-03,3090.62
0.0,291.86,0.0,0.0,1,Dense fog,Dense fog,04-07-2018 0:00,2018-07-04,2384.72
0.0,290.98,0.0,0.0,1,Airborne particles,Smoky air,04-07-2018 1:00,2018-07-04,1534.52
0.0,291.3,0.0,0.0,1,Airborne particles,Smoky air,04-07-2018 2:00,2018-07-04,1382.42
0.0,290.99,0.0,0.0,2,Airborne particles,Smoky air,04-07-2018 3:00,2018-07-04,874.12
0.0,290.5,0.0,0.0,1,Airborne particles,Smoky air,04-07-2018 4:00,2018-07-04,926.12
0.0,290.13,0.0,0.0,1,Airborne particles,Smoky air,04-07-2018 5:00,2018-07-04,1385.02
0.0,289.29,0.0,0.0,1,Light fog,Fine fog,04-07-2018 6:00,2018-07-04,1685.32
0.0,290.9,0.0,0.0,1,Airborne particles,Smoky air,04-07-2018 7:00,2018-07-04,2249.52
0.0,292.6,0.0,0.0,1,Airborne particles,Smoky air,04-07-2018 8:00,2018-07-04,2523.82
0.0,294.85,0.0,0.0,2,Airborne particles,Smoky air,04-07-2018 9:00,2018-07-04,3440.32
0.0,297.41,0.0,0.0,1,Airborne particles,Smoky air,04-07-2018 10:00,2018-07-04,4029.22
0.0,298.94,0.0,0.0,2,Airborne particles,Smoky air,04-07-2018 11:00,2018-07-04,4337.32
0.0,299.6,0.0,0.0,1,Airborne particles,Smoky air,04-07-2018 12:00,2018-07-04,4521.92
0.0,300.68,0.0,0.0,40,Airborne particles,Smoky air,04-07-2018 13:00,2018-07-04,4670.12
0.0,301.5,0.0,0.0,40,Airborne particles,Smoky air,04-07-2018 14:00,2018-07-04,4585.62
0.0,302.43,0.0,0.0,40,Airborne particles,Smoky air,04-07-2018 15:00,2018-07-04,4434.82
0.0,302.12,0.0,0.0,75,Airborne particles,Smoky air,04-07-2018 16:00,2018-07-04,4064.32
0.0,302.29,0.0,0.0,40,Airborne particles,Smoky air,04-07-2018 17:00,2018-07-04,4074.72
0.0,301.14,0.0,0.0,2,Airborne particles,Smoky air,04-07-2018 18:00,2018-07-04,4048.72
0.0,300.46,0.0,0.0,1,Airborne particles,Smoky air,04-07-2018 19:00,2018-07-04,3826.42
0.0,298.84,0.0,0.0,2,Airborne particles,Smoky air,04-07-2018 20:00,2018-07-04,3799.12
0.0,298.92,0.0,0.0,2,Airborne particles,Smoky air,04-07-2018 21:00,2018-07-04,3634.02
0.0,296.27,0.0,0.0,1,Airborne particles,Smoky air,04-07-2018 22:00,2018-07-04,3624.92
0.0,295.14,0.0,0.0,1,Airborne particles,Smoky air,04-07-2018 23:00,2018-07-04,4969.12
0.0,294.68,0.0,0.0,1,Airborne particles,Smoky air,05-07-2018 0:00,2018-07-05,2644.72
0.0,294.32,0.0,0.0,1,Light fog,Fine fog,05-07-2018 1:00,2018-07-05,1518.92
0.0,293.53,0.0,0.0,1,Clear skies,Clear skies,05-07-2018 2:00,2018-07-05,1278.42
0.0,293.0,0.385714286,0.0,2,Rainfall,Soft rain,05-07-2018 3:00,2018-07-05,866.32
0.0,291.76,0.0,0.0,2,Clear skies,Clear skies,05-07-2018 4:00,2018-07-05,809.12
0.0,291.81,0.0,0.0,2,Clear skies,Clear skies,05-07-2018 5:00,2018-07-05,1015.82
0.0,291.19,0.0,0.0,1,Clear skies,Clear skies,05-07-2018 6:00,2018-07-05,1460.42
0.0,293.02,0.0,0.0,1,Clear skies,Clear skies,05-07-2018 7:00,2018-07-05,1853.02
0.0,293.92,0.0,0.0,41,Cloudy skies,Partly cloudy skies,05-07-2018 8:00,2018-07-05,2354.82
0.0,296.17,0.0,0.0,40,Cloudy skies,Partly cloudy skies,05-07-2018 9:00,2018-07-05,3362.32
0.0,297.67,0.0,0.0,1,Clear skies,Clear skies,05-07-2018 10:00,2018-07-05,3952.52
0.0,297.68,0.0,0.0,2,Clear skies,Clear skies,05-07-2018 11:00,2018-07-05,4710.42
0.0,298.51,0.0,0.0,1,Clear skies,Clear skies,05-07-2018 12:00,2018-07-05,5467.02
0.0,300.92,0.0,0.0,1,Clear skies,Clear skies,05-07-2018 13:00,2018-07-05,5693.22
0.0,302.03,0.0,0.0,2,Clear skies,Clear skies,05-07-2018 14:00,2018-07-05,5641.22
0.0,302.58,0.0,0.0,1,Clear skies,Clear skies,05-07-2018 15:00,2018-07-05,5428.02
0.0,303.9,0.0,0.0,1,Clear skies,Clear skies,05-07-2018 16:00,2018-07-05,5203.12
0.0,303.58,0.0,0.0,75,Cloudy skies,Fragmented clouds,05-07-2018 17:00,2018-07-05,5225.22
0.0,302.11,0.0,0.0,90,Cloudy skies,Full cloud cover,05-07-2018 18:00,2018-07-05,5282.42
0.0,302.12,0.0,0.0,1,Clear skies,Clear skies,05-07-2018 19:00,2018-07-05,4961.32
0.0,301.35,0.0,0.0,2,Clear skies,Clear skies,05-07-2018 20:00,2018-07-05,5208.32
0.0,300.27,0.0,0.0,2,Clear skies,Clear skies,05-07-2018 21:00,2018-07-05,4308.72
0.0,299.85,0.0,0.0,1,Clear skies,Clear skies,05-07-2018 22:00,2018-07-05,3384.42
0.0,299.46,0.0,0.0,40,Stormy weather,Approaching thunderstorm,05-07-2018 23:00,2018-07-05,2127.32
0.0,298.78,0.0,0.0,76,Stormy weather,Approaching thunderstorm,06-07-2018 0:00,2018-07-06,1375.92
0.0,296.8,1.5,0.0,90,Rainfall,Intense rainfall,06-07-2018 1:00,2018-07-06,941.72
0.0,296.18,7.97,0.0,90,Rainfall,Intense rainfall,06-07-2018 2:00,2018-07-06,840.32
0.0,295.37,23.8,0.0,90,Rainfall,Torrential downpour,06-07-2018 3:00,2018-07-06,871.52
0.0,294.83,11.80857143,0.0,90,Rainfall,Intense rainfall,06-07-2018 4:00,2018-07-06,1409.72
0.0,294.4,7.552857143,0.0,91,Rainfall,Intense rainfall,06-07-2018 5:00,2018-07-06,3678.22
0.0,294.58,15.53857143,0.0,90,Rainfall,Intense rainfall,06-07-2018 6:00,2018-07-06,6260.02
0.0,294.25,3.187142857,0.0,91,Rainfall,Intense rainfall,06-07-2018 7:00,2018-07-06,7181.72
0.0,294.4,0.76,0.0,90,Rainfall,Intense rainfall,06-07-2018 8:00,2018-07-06,6806.02
0.0,295.12,0.25,0.0,75,Rainfall,Intense rainfall,06-07-2018 9:00,2018-07-06,5846.62
0.0,294.34,0.308571429,0.0,90,Rainfall,Soft rain,06-07-2018 10:00,2018-07-06,5386.42
0.0,294.05,2.235714286,0.0,91,Rainfall,Intense rainfall,06-07-2018 11:00,2018-07-06,5626.92
0.0,293.22,1.02,0.0,90,Rainfall,Intense rainfall,06-07-2018 12:00,2018-07-06,6128.72
0.0,291.24,0.38,0.0,75,Rainfall,Steady rain,06-07-2018 13:00,2018-07-06,6028.62
0.0,292.49,0.0,0.0,92,Rainfall,Soft rain,06-07-2018 14:00,2018-07-06,6773.52
0.0,293.72,4.698571429,0.0,90,Rainfall,Intense rainfall,06-07-2018 15:00,2018-07-06,7190.82
0.0,294.96,5.59,0.0,1,Rainfall,Intense rainfall,06-07-2018 16:00,2018-07-06,8237.32
0.0,295.28,0.0,0.0,40,Airborne smoke,Airborne smoke,06-07-2018 17:00,2018-07-06,8039.72
0.0,295.54,0.0,0.0,75,Airborne smoke,Airborne smoke,06-07-2018 18:00,2018-07-06,5968.82
0.0,294.22,0.0,0.0,1,Airborne smoke,Airborne smoke,06-07-2018 19:00,2018-07-06,4373.72
0.0,293.66,0.0,0.0,2,Airborne smoke,Airborne smoke,06-07-2018 20:00,2018-07-06,3757.52
0.0,291.54,0.0,0.0,40,Cloudy skies,Partly cloudy skies,06-07-2018 21:00,2018-07-06,3743.22
0.0,290.03,0.0,0.0,1,Clear skies,Clear skies,06-07-2018 22:00,2018-07-06,2821.52
0.0,289.24,0.0,0.0,1,Clear skies,Clear skies,06-07-2018 23:00,2018-07-06,1866.02
0.0,287.8,0.0,0.0,2,Clear skies,Clear skies,07-07-2018 0:00,2018-07-07,1239.42
0.0,287.53,0.0,0.0,1,Clear skies,Clear skies,07-07-2018 1:00,2018-07-07,936.52
0.0,286.72,0.0,0.0,1,Clear skies,Clear skies,07-07-2018 2:00,2018-07-07,790.92
0.0,286.0,0.6,0.0,2,Rainfall,Soft rain,07-07-2018 3:00,2018-07-07,850.72
0.0,285.05,0.0,0.0,1,Clear skies,Clear skies,07-07-2018 4:00,2018-07-07,1464.32
0.0,284.5,0.0,0.0,2,Clear skies,Clear skies,07-07-2018 5:00,2018-07-07,4264.52
0.0,284.23,0.0,0.0,2,Clear skies,Clear skies,07-07-2018 6:00,2018-07-07,7608.12
0.0,285.68,0.0,0.0,1,Clear skies,Clear skies,07-07-2018 7:00,2018-07-07,7960.42
0.0,285.94,0.0,0.0,1,Clear skies,Clear skies,07-07-2018 8:00,2018-07-07,7372.82
0.0,289.15,0.0,0.0,1,Clear skies,Clear skies,07-07-2018 9:00,2018-07-07,6097.52
0.0,290.29,0.0,0.0,1,Clear skies,Clear skies,07-07-2018 10:00,2018-07-07,5863.52
0.0,290.95,0.0,0.0,41,Cloudy skies,Partly cloudy skies,07-07-2018 11:00,2018-07-07,6244.42
0.0,292.28,0.0,0.0,2,Clear skies,Clear skies,07-07-2018 12:00,2018-07-07,6105.32
0.0,293.28,0.0,0.0,1,Clear skies,Clear skies,07-07-2018 13:00,2018-07-07,6247.02
0.0,294.15,0.0,0.0,75,Cloudy skies,Fragmented clouds,07-07-2018 14:00,2018-07-07,6928.22
0.0,293.82,0.0,0.0,40,Cloudy skies,Partly cloudy skies,07-07-2018 15:00,2018-07-07,7489.82
0.0,294.41,0.0,0.0,40,Cloudy skies,Partly cloudy skies,07-07-2018 16:00,2018-07-07,8704.02
0.0,295.37,0.0,0.0,41,Cloudy skies,Partly cloudy skies,07-07-2018 17:00,2018-07-07,8528.52
0.0,294.75,0.0,0.0,2,Clear skies,Clear skies,07-07-2018 18:00,2018-07-07,6344.52
0.0,294.81,0.0,0.0,1,Clear skies,Clear skies,07-07-2018 19:00,2018-07-07,4659.72
0.0,293.4,0.0,0.0,1,Clear skies,Clear skies,07-07-2018 20:00,2018-07-07,4338.62
0.0,290.33,0.0,0.0,1,Clear skies,Clear skies,07-07-2018 21:00,2018-07-07,4243.72
0.0,287.99,0.0,0.0,1,Clear skies,Clear skies,07-07-2018 22:00,2018-07-07,3403.92
0.0,286.96,0.0,0.0,1,Clear skies,Clear skies,07-07-2018 23:00,2018-07-07,2066.22
0.0,286.87,0.0,0.0,1,Clear skies,Clear skies,08-07-2018 0:00,2018-07-08,1283.62
0.0,285.48,0.0,0.0,2,Clear skies,Clear skies,08-07-2018 1:00,2018-07-08,984.62
0.0,285.42,0.0,0.0,2,Light fog,Fine fog,08-07-2018 2:00,2018-07-08,796.12
0.0,285.58,0.0,0.0,1,Clear skies,Clear skies,08-07-2018 3:00,2018-07-08,883.22
0.0,285.22,0.0,0.0,1,Clear skies,Clear skies,08-07-2018 4:00,2018-07-08,1567.02
0.0,285.36,0.0,0.0,40,Cloudy skies,Partly cloudy skies,08-07-2018 5:00,2018-07-08,4263.22
0.0,284.89,0.0,0.0,41,Cloudy skies,Partly cloudy skies,08-07-2018 6:00,2018-07-08,7848.62
0.0,286.98,0.0,0.0,40,Light fog,Fine fog,08-07-2018 7:00,2018-07-08,8117.72
0.0,289.01,0.0,0.0,1,Clear skies,Clear skies,08-07-2018 8:00,2018-07-08,7485.92
0.0,292.15,0.0,0.0,1,Clear skies,Clear skies,08-07-2018 9:00,2018-07-08,6540.82
0.0,293.74,0.0,0.0,40,Cloudy skies,Partly cloudy skies,08-07-2018 10:00,2018-07-08,6414.72
0.0,293.65,0.0,0.0,41,Cloudy skies,Partly cloudy skies,08-07-2018 11:00,2018-07-08,6932.12
0.0,293.89,0.0,0.0,76,Cloudy skies,Fragmented clouds,08-07-2018 12:00,2018-07-08,6699.42
0.0,295.21,0.0,0.0,76,Cloudy skies,Fragmented clouds,08-07-2018 13:00,2018-07-08,6776.12
0.0,295.35,0.0,0.0,41,Cloudy skies,Partly cloudy skies,08-07-2018 14:00,2018-07-08,7133.62
0.0,295.32,0.0,0.0,75,Cloudy skies,Fragmented clouds,08-07-2018 15:00,2018-07-08,7774.52
0.0,295.74,0.0,0.0,40,Cloudy skies,Partly cloudy skies,08-07-2018 16:00,2018-07-08,8524.62
0.0,295.74,0.0,0.0,1,Clear skies,Clear skies,08-07-2018 17:00,2018-07-08,8440.12
0.0,295.22,0.0,0.0,2,Clear skies,Clear skies,08-07-2018 18:00,2018-07-08,6308.12
0.0,294.84,0.0,0.0,2,Clear skies,Clear skies,08-07-2018 19:00,2018-07-08,4761.12
0.0,294.23,0.0,0.0,2,Clear skies,Clear skies,08-07-2018 20:00,2018-07-08,4436.12
0.0,292.48,0.0,0.0,2,Clear skies,Clear skies,08-07-2018 21:00,2018-07-08,4495.92
0.0,290.13,0.0,0.0,1,Clear skies,Clear skies,08-07-2018 22:00,2018-07-08,3549.52
0.0,288.9,0.0,0.0,1,Clear skies,Clear skies,08-07-2018 23:00,2018-07-08,2083.12
0.0,288.58,0.0,0.0,1,Clear skies,Clear skies,09-07-2018 0:00,2018-07-09,1307.02
0.0,288.68,0.0,0.0,1,Clear skies,Clear skies,09-07-2018 1:00,2018-07-09,952.12
0.0,287.97,0.0,0.0,76,Cloudy skies,Fragmented clouds,09-07-2018 2:00,2018-07-09,865.02
0.0,287.67,0.3,0.0,1,Rainfall,Soft rain,09-07-2018 3:00,2018-07-09,876.72
0.0,287.23,0.0,0.0,91,Cloudy skies,Full cloud cover,09-07-2018 4:00,2018-07-09,1551.42
0.0,287.24,0.0,0.0,90,Cloudy skies,Full cloud cover,09-07-2018 5:00,2018-07-09,4146.22
0.0,287.99,0.0,0.0,75,Cloudy skies,Fragmented clouds,09-07-2018 6:00,2018-07-09,7892.82
0.0,288.68,0.0,0.0,2,Light fog,Fine fog,09-07-2018 7:00,2018-07-09,8499.92
0.0,291.35,0.0,0.0,1,Airborne particles,Smoky air,09-07-2018 8:00,2018-07-09,7506.72
0.0,292.36,0.0,0.0,1,Clear skies,Clear skies,09-07-2018 9:00,2018-07-09,6544.72
0.0,295.62,0.0,0.0,2,Clear skies,Clear skies,09-07-2018 10:00,2018-07-09,6126.12
0.0,296.45,0.0,0.0,1,Clear skies,Clear skies,09-07-2018 11:00,2018-07-09,6496.62
0.0,298.51,0.0,0.0,1,Clear skies,Clear skies,09-07-2018 12:00,2018-07-09,6863.22
0.0,298.32,0.0,0.0,1,Clear skies,Clear skies,09-07-2018 13:00,2018-07-09,7086.82
0.0,299.23,0.0,0.0,1,Clear skies,Clear skies,09-07-2018 14:00,2018-07-09,7432.62
0.0,299.87,0.0,0.0,41,Cloudy skies,Partly cloudy skies,09-07-2018 15:00,2018-07-09,7882.42
0.0,300.67,0.0,0.0,40,Cloudy skies,Partly cloudy skies,09-07-2018 16:00,2018-07-09,8900.32
0.0,300.68,0.0,0.0,40,Cloudy skies,Partly cloudy skies,09-07-2018 17:00,2018-07-09,8462.22
0.0,299.4,0.0,0.0,2,Clear skies,Clear skies,09-07-2018 18:00,2018-07-09,6676.02
0.0,298.58,0.0,0.0,1,Clear skies,Clear skies,09-07-2018 19:00,2018-07-09,5134.22
0.0,297.62,0.0,0.0,75,Cloudy skies,Fragmented clouds,09-07-2018 20:00,2018-07-09,4436.12
0.0,295.92,0.0,0.0,40,Cloudy skies,Partly cloudy skies,09-07-2018 21:00,2018-07-09,4797.52
0.0,294.26,0.0,0.0,2,Airborne particles,Smoky air,09-07-2018 22:00,2018-07-09,3780.92
0.0,293.6,0.0,0.0,1,Clear skies,Clear skies,09-07-2018 23:00,2018-07-09,2345.72
0.0,292.93,0.0,0.0,1,Clear skies,Clear skies,10-07-2018 0:00,2018-07-10,1496.82
0.0,292.44,0.0,0.0,40,Cloudy skies,Partly cloudy skies,10-07-2018 1:00,2018-07-10,1091.22
0.0,291.94,0.0,0.0,76,Cloudy skies,Fragmented clouds,10-07-2018 2:00,2018-07-10,918.32
0.0,292.35,0.0,0.0,40,Cloudy skies,Partly cloudy skies,10-07-2018 3:00,2018-07-10,914.42
0.0,291.03,0.0,0.0,1,Clear skies,Clear skies,10-07-2018 4:00,2018-07-10,1554.02
0.0,291.2,0.0,0.0,2,Clear skies,Clear skies,10-07-2018 5:00,2018-07-10,4108.52
0.0,291.33,0.0,0.0,1,Clear skies,Clear skies,10-07-2018 6:00,2018-07-10,7433.92
0.0,292.36,0.0,0.0,1,Clear skies,Clear skies,10-07-2018 7:00,2018-07-10,8103.42
0.0,294.22,0.0,0.0,1,Clear skies,Clear skies,10-07-2018 8:00,2018-07-10,7112.82
0.0,295.12,0.0,0.0,2,Clear skies,Clear skies,10-07-2018 9:00,2018-07-10,6396.52
0.0,298.13,0.0,0.0,1,Clear skies,Clear skies,10-07-2018 10:00,2018-07-10,6262.62
0.0,299.27,0.0,0.0,1,Clear skies,Clear skies,10-07-2018 11:00,2018-07-10,6686.42
0.0,301.29,0.0,0.0,40,Cloudy skies,Partly cloudy skies,10-07-2018 12:00,2018-07-10,7426.12
0.0,301.37,0.0,0.0,40,Cloudy skies,Partly cloudy skies,10-07-2018 13:00,2018-07-10,7140.12
0.0,301.92,0.0,0.0,75,Cloudy skies,Fragmented clouds,10-07-2018 14:00,2018-07-10,7493.72
0.0,302.58,0.0,0.0,40,Cloudy skies,Partly cloudy skies,10-07-2018 15:00,2018-07-10,7656.22
0.0,302.62,0.0,0.0,1,Clear skies,Clear skies,10-07-2018 16:00,2018-07-10,8264.62
0.0,301.56,0.0,0.0,2,Clear skies,Clear skies,10-07-2018 17:00,2018-07-10,7644.52
0.0,301.46,0.0,0.0,1,Clear skies,Clear skies,10-07-2018 18:00,2018-07-10,6412.12
0.0,301.24,0.0,0.0,1,Clear skies,Clear skies,10-07-2018 19:00,2018-07-10,4932.72
0.0,300.37,0.0,0.0,1,Clear skies,Clear skies,10-07-2018 20:00,2018-07-10,4393.22
0.0,297.73,0.0,0.0,1,Clear skies,Clear skies,10-07-2018 21:00,2018-07-10,4596.02
0.0,297.02,0.0,0.0,75,Cloudy skies,Fragmented clouds,10-07-2018 22:00,2018-07-10,3562.52
0.0,296.08,0.0,0.0,40,Cloudy skies,Partly cloudy skies,10-07-2018 23:00,2018-07-10,2789.02
0.0,296.58,0.0,0.0,40,Cloudy skies,Partly cloudy skies,11-07-2018 0:00,2018-07-11,2083.12
0.0,294.8,0.0,0.0,1,Clear skies,Clear skies,11-07-2018 1:00,2018-07-11,1609.92
0.0,294.82,0.0,0.0,2,Light fog,Fine fog,11-07-2018 2:00,2018-07-11,1221.22
0.0,293.7,0.3,0.0,2,Rainfall,Soft rain,11-07-2018 3:00,2018-07-11,985.92
0.0,293.36,0.0,0.0,1,Clear skies,Clear skies,11-07-2018 4:00,2018-07-11,1015.82
0.0,292.65,0.0,0.0,1,Light fog,Fine fog,11-07-2018 5:00,2018-07-11,1473.42
0.0,292.04,0.0,0.0,1,Light fog,Fine fog,11-07-2018 6:00,2018-07-11,2237.82
0.0,293.35,0.0,0.0,1,Clear skies,Clear skies,11-07-2018 7:00,2018-07-11,2838.42
0.0,294.97,0.0,0.0,1,Clear skies,Clear skies,11-07-2018 8:00,2018-07-11,3639.22
0.0,295.94,0.0,0.0,90,Cloudy skies,Full cloud cover,11-07-2018 9:00,2018-07-11,4524.52
0.0,297.78,0.0,0.0,90,Cloudy skies,Full cloud cover,11-07-2018 10:00,2018-07-11,5155.02
0.0,298.26,0.0,0.0,90,Cloudy skies,Full cloud cover,11-07-2018 11:00,2018-07-11,5615.22
0.0,299.22,0.0,0.0,90,Cloudy skies,Full cloud cover,11-07-2018 12:00,2018-07-11,6071.52
0.0,299.6,0.0,0.0,75,Cloudy skies,Fragmented clouds,11-07-2018 13:00,2018-07-11,6253.52
0.0,299.38,0.0,0.0,90,Cloudy skies,Full cloud cover,11-07-2018 14:00,2018-07-11,6699.42
0.0,300.08,0.0,0.0,91,Cloudy skies,Full cloud cover,11-07-2018 15:00,2018-07-11,5885.62
0.0,300.08,0.0,0.0,90,Rainfall,Soft rain,11-07-2018 16:00,2018-07-11,5970.12
0.0,299.58,0.0,0.0,90,Cloudy skies,Full cloud cover,11-07-2018 17:00,2018-07-11,5645.12
0.0,298.88,0.0,0.0,90,Cloudy skies,Full cloud cover,11-07-2018 18:00,2018-07-11,5589.22
0.0,299.55,0.0,0.0,40,Rainfall,Nearby rain showers,11-07-2018 19:00,2018-07-11,4892.42
0.0,298.37,0.0,0.0,76,Stormy weather,Approaching thunderstorm,11-07-2018 20:00,2018-07-11,4202.12
0.0,297.56,0.0,0.0,41,Cloudy skies,Partly cloudy skies,11-07-2018 21:00,2018-07-11,4094.22
0.0,296.62,0.0,0.0,40,Cloudy skies,Partly cloudy skies,11-07-2018 22:00,2018-07-11,4017.52
0.0,296.58,0.0,0.0,1,Clear skies,Clear skies,11-07-2018 23:00,2018-07-11,3182.92
0.0,296.37,0.0,0.0,75,Cloudy skies,Fragmented clouds,12-07-2018 0:00,2018-07-12,2272.92
0.0,295.45,0.0,0.0,41,Cloudy skies,Partly cloudy skies,12-07-2018 1:00,2018-07-12,1659.32
0.0,294.91,0.0,0.0,1,Clear skies,Clear skies,12-07-2018 2:00,2018-07-12,1417.52
0.0,295.47,0.0,0.0,1,Clear skies,Clear skies,12-07-2018 3:00,2018-07-12,889.72
0.0,294.66,0.0,0.0,1,Clear skies,Clear skies,12-07-2018 4:00,2018-07-12,901.42
0.0,294.39,0.0,0.0,2,Clear skies,Clear skies,12-07-2018 5:00,2018-07-12,1032.72
0.0,294.32,0.0,0.0,2,Light fog,Fine fog,12-07-2018 6:00,2018-07-12,1486.42
0.0,294.71,0.0,0.0,40,Cloudy skies,Partly cloudy skies,12-07-2018 7:00,2018-07-12,2215.72
0.0,296.19,0.0,0.0,90,Cloudy skies,Full cloud cover,12-07-2018 8:00,2018-07-12,3172.52
0.0,296.38,0.0,0.0,90,Cloudy skies,Full cloud cover,12-07-2018 9:00,2018-07-12,3957.72
0.0,298.98,0.0,0.0,90,Cloudy skies,Full cloud cover,12-07-2018 10:00,2018-07-12,4693.52
0.0,301.07,0.0,0.0,91,Cloudy skies,Full cloud cover,12-07-2018 12:00,2018-07-12,6105.32
0.0,301.28,0.0,0.0,90,Cloudy skies,Full cloud cover,12-07-2018 13:00,2018-07-12,5671.12
0.0,301.6,0.0,0.0,40,Cloudy skies,Partly cloudy skies,12-07-2018 14:00,2018-07-12,5831.02
0.0,303.46,0.0,0.0,41,Cloudy skies,Partly cloudy skies,12-07-2018 15:00,2018-07-12,6018.22
0.0,303.98,0.0,0.0,75,Cloudy skies,Fragmented clouds,12-07-2018 16:00,2018-07-12,5698.42
0.0,303.93,0.0,0.0,40,Cloudy skies,Partly cloudy skies,12-07-2018 17:00,2018-07-12,5395.52
0.0,303.66,0.0,0.0,91,Cloudy skies,Full cloud cover,12-07-2018 18:00,2018-07-12,5104.32
0.0,302.92,0.0,0.0,40,Cloudy skies,Partly cloudy skies,12-07-2018 19:00,2018-07-12,4554.42
0.0,303.16,0.0,0.0,1,Clear skies,Clear skies,12-07-2018 20:00,2018-07-12,4146.22
0.0,301.95,0.0,0.0,90,Stormy weather,Approaching thunderstorm,12-07-2018 21:00,2018-07-12,3520.92
0.0,301.52,0.0,0.0,75,Stormy weather,Approaching thunderstorm,12-07-2018 22:00,2018-07-12,2740.92
0.0,294.88,9.91,0.0,90,Rainfall,Intense rainfall,12-07-2018 23:00,2018-07-12,1671.02
0.0,292.72,27.61285714,0.0,90,Rainfall,Torrential downpour,13-07-2018 00:00,2018-07-13,1070.42
0.0,292.72,7.304285714,0.0,75,Rainfall,Intense rainfall,13-07-2018 01:00,2018-07-13,914.42
0.0,292.52,0.51,0.0,1,Rainfall,Soft rain,13-07-2018 02:00,2018-07-13,803.92
0.0,292.75,0.3,0.0,1,Rainfall,Soft rain,13-07-2018 03:00,2018-07-13,876.72
0.0,292.51,0.0,0.0,1,Clear skies,Clear skies,13-07-2018 04:00,2018-07-13,1528.02
0.0,291.62,0.0,0.0,2,Clear skies,Clear skies,13-07-2018 05:00,2018-07-13,4091.62
0.0,291.66,0.0,0.0,40,Light fog,Fine fog,13-07-2018 06:00,2018-07-13,7513.22
0.0,293.19,0.0,0.0,1,Clear skies,Clear skies,13-07-2018 07:00,2018-07-13,8288.02
0.0,293.37,0.0,0.0,40,Rainfall,Soft rain,13-07-2018 08:00,2018-07-13,7405.32
0.0,294.77,0.0,0.0,76,Cloudy skies,Fragmented clouds,13-07-2018 09:00,2018-07-13,6159.92
0.0,296.25,0.0,0.0,40,Cloudy skies,Partly cloudy skies,13-07-2018 10:00,2018-07-13,5728.32
0.0,297.81,0.0,0.0,90,Cloudy skies,Full cloud cover,13-07-2018 11:00,2018-07-13,6042.92
0.0,299.53,0.0,0.0,41,Cloudy skies,Partly cloudy skies,13-07-2018 12:00,2018-07-13,6338.02
0.0,300.41,0.0,0.0,40,Cloudy skies,Partly cloudy skies,13-07-2018 13:00,2018-07-13,6566.82
0.0,302.33,0.0,0.0,41,Cloudy skies,Partly cloudy skies,13-07-2018 14:00,2018-07-13,6933.42
0.0,303.14,0.0,0.0,40,Cloudy skies,Partly cloudy skies,13-07-2018 15:00,2018-07-13,7625.02
0.0,302.87,0.0,0.0,1,Clear skies,Clear skies,13-07-2018 16:00,2018-07-13,8325.72
0.0,302.1,0.0,0.0,1,Clear skies,Clear skies,13-07-2018 17:00,2018-07-13,8087.82
0.0,301.66,0.0,0.0,1,Clear skies,Clear skies,13-07-2018 18:00,2018-07-13,6045.52
0.0,302.12,0.0,0.0,1,Stormy weather,Approaching thunderstorm,13-07-2018 19:00,2018-07-13,4401.02
0.0,299.89,0.0,0.0,91,Rainfall,Soft rain,13-07-2018 20:00,2018-07-13,4005.82
0.0,297.78,0.0,0.0,2,Rainfall,Soft rain,13-07-2018 21:00,2018-07-13,3571.62
0.0,296.27,0.0,0.0,1,Rainfall,Soft rain,13-07-2018 22:00,2018-07-13,2977.52
0.0,295.4,0.0,0.0,1,Clear skies,Clear skies,13-07-2018 23:00,2018-07-13,2019.42
0.0,294.61,0.0,0.0,1,Clear skies,Clear skies,14-07-2018 00:00,2018-07-14,1297.92
0.0,294.21,0.0,0.0,1,Clear skies,Clear skies,14-07-2018 01:00,2018-07-14,1049.62
0.0,293.06,0.0,0.0,2,Clear skies,Clear skies,14-07-2018 02:00,2018-07-14,848.12
0.0,293.31,0.0,0.0,2,Clear skies,Clear skies,14-07-2018 03:00,2018-07-14,871.52
0.0,292.51,0.0,0.0,1,Light fog,Fine fog,14-07-2018 04:00,2018-07-14,1587.82
0.0,293.35,0.0,0.0,1,Clear skies,Clear skies,14-07-2018 05:00,2018-07-14,4238.52
0.0,292.99,0.0,0.0,1,Clear skies,Clear skies,14-07-2018 06:00,2018-07-14,7758.92
0.0,294.37,0.0,0.0,1,Clear skies,Clear skies,14-07-2018 07:00,2018-07-14,7768.02
0.0,296.13,0.0,0.0,1,Airborne particles,Smoky air,14-07-2018 08:00,2018-07-14,7349.42
0.0,295.79,0.0,0.0,1,Clear skies,Clear skies,14-07-2018 09:00,2018-07-14,6274.32
0.0,298.78,0.0,0.0,1,Clear skies,Clear skies,14-07-2018 10:00,2018-07-14,5444.92
0.0,300.19,0.0,0.0,1,Clear skies,Clear skies,14-07-2018 11:00,2018-07-14,5838.82
0.0,299.88,0.0,0.0,40,Cloudy skies,Partly cloudy skies,14-07-2018 12:00,2018-07-14,6263.92
0.0,300.48,0.0,0.0,41,Cloudy skies,Partly cloudy skies,14-07-2018 13:00,2018-07-14,6608.42
0.0,301.59,0.0,0.0,41,Cloudy skies,Partly cloudy skies,14-07-2018 14:00,2018-07-14,6471.92
0.0,302.06,0.0,0.0,41,Cloudy skies,Partly cloudy skies,14-07-2018 15:00,2018-07-14,7409.22
0.0,301.77,0.0,0.0,41,Cloudy skies,Partly cloudy skies,14-07-2018 16:00,2018-07-14,8806.72
0.0,301.69,0.0,0.0,40,Cloudy skies,Partly cloudy skies,14-07-2018 17:00,2018-07-14,8636.42
0.0,300.03,0.0,0.0,1,Clear skies,Clear skies,14-07-2018 18:00,2018-07-14,6235.32
0.0,299.75,0.0,0.0,1,Clear skies,Clear skies,14-07-2018 19:00,2018-07-14,4670.12
0.0,298.13,0.0,0.0,1,Clear skies,Clear skies,14-07-2018 20:00,2018-07-14,4779.32
0.0,296.11,0.0,0.0,1,Clear skies,Clear skies,14-07-2018 21:00,2018-07-14,4033.12
0.0,295.2,0.0,0.0,2,Clear skies,Clear skies,14-07-2018 22:00,2018-07-14,2964.52
0.0,294.4,0.0,0.0,1,Clear skies,Clear skies,14-07-2018 23:00,2018-07-14,2096.12
0.0,292.27,0.0,0.0,1,Clear skies,Clear skies,15-07-2018 00:00,2018-07-15,1321.32
0.0,291.58,0.0,0.0,1,Light fog,Fine fog,15-07-2018 01:00,2018-07-15,1041.82
0.0,291.8,0.0,0.0,1,Clear skies,Clear skies,15-07-2018 02:00,2018-07-15,881.92
0.0,290.53,0.0,0.0,40,Rainfall,Soft rain,15-07-2018 03:00,2018-07-15,924.82
0.0,290.36,0.0,0.0,90,Light rain,Light rain,15-07-2018 04:00,2018-07-15,1660.62
0.0,290.19,0.0,0.0,75,Light rain,Mild drizzle,15-07-2018 05:00,2018-07-15,4294.42
0.0,289.46,0.0,0.0,91,Cloudy skies,Full cloud cover,15-07-2018 06:00,2018-07-15,7943.52
0.0,290.81,0.0,0.0,40,Rainfall,Soft rain,15-07-2018 07:00,2018-07-15,7385.82
0.0,291.34,0.0,0.0,1,Rainfall,Steady rain,15-07-2018 08:00,2018-07-15,7527.52
0.0,291.81,0.0,0.0,40,Rainfall,Steady rain,15-07-2018 09:00,2018-07-15,6219.72
0.0,295.24,0.0,0.0,1,Clear skies,Clear skies,15-07-2018 10:00,2018-07-15,5706.22
0.0,296.6,0.0,0.0,40,Cloudy skies,Partly cloudy skies,15-07-2018 11:00,2018-07-15,6105.32
0.0,298.22,0.0,0.0,2,Clear skies,Clear skies,15-07-2018 12:00,2018-07-15,6425.12
0.0,300.43,0.0,0.0,1,Clear skies,Clear skies,15-07-2018 13:00,2018-07-15,6499.22
0.0,300.13,0.0,0.0,41,Cloudy skies,Partly cloudy skies,15-07-2018 14:00,2018-07-15,6817.72
0.0,300.51,3.164285714,0.0,41,Rainfall,Steady rain,15-07-2018 15:00,2018-07-15,7276.62
0.0,300.21,0.79,0.0,41,Rainfall,Soft rain,15-07-2018 16:00,2018-07-15,8788.52
0.0,300.2,0.335714286,0.0,41,Rainfall,Soft rain,15-07-2018 17:00,2018-07-15,8389.42
0.0,300.43,0.0,0.0,41,Rainfall,Soft rain,15-07-2018 18:00,2018-07-15,6496.62
0.0,300.15,0.0,0.0,1,Clear skies,Clear skies,15-07-2018 19:00,2018-07-15,4863.82
0.0,298.67,0.0,0.0,40,Cloudy skies,Partly cloudy skies,15-07-2018 20:00,2018-07-15,4624.62
0.0,297.74,0.0,0.0,21,Cloudy skies,Scattered clouds,15-07-2018 21:00,2018-07-15,4164.42
0.0,297.01,0.0,0.0,1,Clear skies,Clear skies,15-07-2018 22:00,2018-07-15,3099.72
0.0,296.07,0.0,0.0,2,Clear skies,Clear skies,15-07-2018 23:00,2018-07-15,2037.62
0.0,295.69,0.0,0.0,1,Clear skies,Clear skies,16-07-2018 00:00,2018-07-16,1361.62
0.0,295.02,0.0,0.0,1,Clear skies,Clear skies,16-07-2018 01:00,2018-07-16,1027.52
0.0,294.35,0.0,0.0,1,Clear skies,Clear skies,16-07-2018 02:00,2018-07-16,887.12
0.0,293.95,0.414285714,0.0,75,Rainfall,Soft rain,16-07-2018 03:00,2018-07-16,965.12
0.0,294.41,0.0,0.0,90,Cloudy skies,Full cloud cover,16-07-2018 04:00,2018-07-16,1595.62
0.0,294.39,0.0,0.0,90,Cloudy skies,Full cloud cover,16-07-2018 05:00,2018-07-16,4196.92
0.0,293.45,0.0,0.0,20,Cloudy skies,Scattered clouds,16-07-2018 06:00,2018-07-16,7768.02
0.0,293.77,0.0,0.0,90,Cloudy skies,Full cloud cover,16-07-2018 07:00,2018-07-16,8399.82
0.0,294.51,0.0,0.0,90,Cloudy skies,Full cloud cover,16-07-2018 08:00,2018-07-16,7471.62
0.0,294.65,0.0,0.0,75,Cloudy skies,Fragmented clouds,16-07-2018 09:00,2018-07-16,6492.72
0.0,295.59,0.0,0.0,91,Rainfall,Soft rain,16-07-2018 10:00,2018-07-16,6066.32
0.0,295.84,0.0,0.0,75,Cloudy skies,Fragmented clouds,16-07-2018 11:00,2018-07-16,6490.12
0.0,295.03,0.378571429,0.0,90,Rainfall,Soft rain,16-07-2018 12:00,2018-07-16,7011.42
0.0,294.73,0.51,0.0,90,Rainfall,Soft rain,16-07-2018 13:00,2018-07-16,7097.22
0.0,293.42,0.398571429,0.0,90,Rainfall,Steady rain,16-07-2018 14:00,2018-07-16,7324.72
0.0,293.28,1.15,0.0,90,Rainfall,Steady rain,16-07-2018 15:00,2018-07-16,7595.12
0.0,293.14,1.104285714,0.0,90,Rainfall,Steady rain,16-07-2018 16:00,2018-07-16,8106.02
0.0,293.68,0.908571429,0.0,91,Rainfall,Soft rain,16-07-2018 17:00,2018-07-16,8349.12
0.0,293.41,0.601428571,0.0,90,Rainfall,Steady rain,16-07-2018 18:00,2018-07-16,6588.92
0.0,292.98,0.0,0.0,90,Rainfall,Soft rain,16-07-2018 19:00,2018-07-16,4761.12
0.0,293.86,0.0,0.0,90,Light rain,Light rain,16-07-2018 20:00,2018-07-16,4196.92
0.0,292.72,0.0,0.0,90,Light fog,Fine fog,16-07-2018 21:00,2018-07-16,3970.72
0.0,293.02,0.0,0.0,91,Light fog,Fine fog,16-07-2018 22:00,2018-07-16,3266.12
0.0,293.4,0.25,0.0,90,Rainfall,Soft rain,16-07-2018 23:00,2018-07-16,2097.42
0.0,292.6,0.0,0.0,91,Light fog,Fine fog,17-07-2018 00:00,2018-07-17,1413.62
0.0,292.54,0.0,0.0,91,Cloudy skies,Full cloud cover,17-07-2018 01:00,2018-07-17,1067.82
0.0,292.92,0.0,0.0,90,Light fog,Fine fog,17-07-2018 02:00,2018-07-17,868.92
0.0,292.79,0.3,0.0,90,Rainfall,Soft rain,17-07-2018 03:00,2018-07-17,945.62
0.0,291.84,0.0,0.0,90,Light fog,Fine fog,17-07-2018 04:00,2018-07-17,1543.62
0.0,291.98,0.0,0.0,1,Light fog,Fine fog,17-07-2018 05:00,2018-07-17,3978.52
0.0,291.98,0.0,0.0,75,Light fog,Fine fog,17-07-2018 06:00,2018-07-17,7502.82
0.0,292.54,0.0,0.0,91,Light fog,Fine fog,17-07-2018 07:00,2018-07-17,8303.62
0.0,293.85,0.0,0.0,90,Light fog,Fine fog,17-07-2018 08:00,2018-07-17,7244.12
0.0,294.57,0.0,0.0,90,Light fog,Fine fog,17-07-2018 09:00,2018-07-17,6588.92
0.0,297.21,0.0,0.0,91,Light fog,Fine fog,17-07-2018 10:00,2018-07-17,6445.92
0.0,298.18,0.0,0.0,40,Cloudy skies,Partly cloudy skies,17-07-2018 11:00,2018-07-17,6800.82
0.0,299.58,0.0,0.0,2,Clear skies,Clear skies,17-07-2018 12:00,2018-07-17,7370.22
0.0,301.04,0.0,0.0,75,Cloudy skies,Fragmented clouds,17-07-2018 13:00,2018-07-17,7222.02
0.0,302.56,0.0,0.0,40,Cloudy skies,Partly cloudy skies,17-07-2018 14:00,2018-07-17,7497.62
0.0,302.99,0.0,0.0,75,Cloudy skies,Fragmented clouds,17-07-2018 15:00,2018-07-17,7640.62
0.0,303.04,0.0,0.0,1,Clear skies,Clear skies,17-07-2018 16:00,2018-07-17,8074.82
0.0,303.64,0.0,0.0,2,Clear skies,Clear skies,17-07-2018 17:00,2018-07-17,6939.92
0.0,303.75,0.0,0.0,1,Clear skies,Clear skies,17-07-2018 18:00,2018-07-17,6236.62
0.0,302.93,0.0,0.0,1,Clear skies,Clear skies,17-07-2018 19:00,2018-07-17,5061.42
0.0,301.26,0.0,0.0,1,Clear skies,Clear skies,17-07-2018 20:00,2018-07-17,4532.32
0.0,298.5,0.0,0.0,1,Clear skies,Clear skies,17-07-2018 21:00,2018-07-17,4553.12
0.0,298.06,0.0,0.0,2,Clear skies,Clear skies,17-07-2018 22:00,2018-07-17,4125.42
0.0,298.82,0.0,0.0,75,Stormy weather,Stormy weather,17-07-2018 23:00,2018-07-17,3132.22
0.0,298.31,0.0,0.0,76,Stormy weather,Approaching thunderstorm,18-07-2018 00:00,2018-07-18,2295.02
0.0,294.14,13.68285714,0.0,91,Rainfall,Intense rainfall,18-07-2018 01:00,2018-07-18,1334.32
0.0,293.42,7.278571429,0.0,90,Rainfall,Intense rainfall,18-07-2018 02:00,2018-07-18,1239.42
0.0,293.26,1.14,0.0,20,Rainfall,Intense rainfall,18-07-2018 03:00,2018-07-18,985.92
0.0,293.9,0.4,0.0,75,Rainfall,Steady rain,18-07-2018 04:00,2018-07-18,1062.62
0.0,293.47,0.51,0.0,75,Rainfall,Soft rain,18-07-2018 05:00,2018-07-18,1446.12
0.0,293.87,0.0,0.0,40,Rainfall,Soft rain,18-07-2018 06:00,2018-07-18,2210.52
0.0,294.32,0.0,0.0,2,Clear skies,Clear skies,18-07-2018 07:00,2018-07-18,3084.12
0.0,294.45,0.0,0.0,1,Clear skies,Clear skies,18-07-2018 08:00,2018-07-18,3834.22
0.0,295.77,0.0,0.0,40,Cloudy skies,Partly cloudy skies,18-07-2018 09:00,2018-07-18,4922.32
0.0,298.68,0.0,0.0,1,Clear skies,Clear skies,18-07-2018 10:00,2018-07-18,5465.72
0.0,299.47,0.0,0.0,41,Cloudy skies,Partly cloudy skies,18-07-2018 11:00,2018-07-18,5647.72
0.0,301.17,0.0,0.0,40,Cloudy skies,Partly cloudy skies,18-07-2018 12:00,2018-07-18,6053.32
0.0,301.88,0.0,0.0,76,Cloudy skies,Fragmented clouds,18-07-2018 13:00,2018-07-18,5850.52
0.0,302.22,0.0,0.0,41,Cloudy skies,Partly cloudy skies,18-07-2018 14:00,2018-07-18,6387.42
0.0,302.88,0.0,0.0,2,Clear skies,Clear skies,18-07-2018 15:00,2018-07-18,6206.72
0.0,302.65,0.0,0.0,1,Clear skies,Clear skies,18-07-2018 16:00,2018-07-18,5970.12
0.0,302.85,0.0,0.0,41,Cloudy skies,Partly cloudy skies,18-07-2018 17:00,2018-07-18,5729.62
0.0,301.55,0.0,0.0,1,Clear skies,Clear skies,18-07-2018 18:00,2018-07-18,5387.72
0.0,301.08,0.0,0.0,1,Clear skies,Clear skies,18-07-2018 19:00,2018-07-18,4827.42
0.0,299.03,0.0,0.0,1,Clear skies,Clear skies,18-07-2018 20:00,2018-07-18,4462.12
0.0,297.89,0.0,0.0,1,Clear skies,Clear skies,18-07-2018 21:00,2018-07-18,4761.12
0.0,296.19,0.0,0.0,2,Clear skies,Clear skies,18-07-2018 22:00,2018-07-18,4640.22
0.0,295.79,0.0,0.0,1,Clear skies,Clear skies,18-07-2018 23:00,2018-07-18,3362.32
0.0,294.34,0.0,0.0,2,Clear skies,Clear skies,19-07-2018 00:00,2018-07-19,2388.62
0.0,292.54,0.0,0.0,1,Clear skies,Clear skies,19-07-2018 01:00,2018-07-19,1946.62
0.0,291.67,0.0,0.0,2,Clear skies,Clear skies,19-07-2018 02:00,2018-07-19,1591.72
0.0,291.07,0.0,0.0,1,Clear skies,Clear skies,19-07-2018 03:00,2018-07-19,1009.32
0.0,290.17,0.0,0.0,1,Clear skies,Clear skies,19-07-2018 04:00,2018-07-19,875.42
0.0,290.19,0.0,0.0,1,Clear skies,Clear skies,19-07-2018 05:00,2018-07-19,1076.92
0.0,290.02,0.0,0.0,1,Clear skies,Clear skies,19-07-2018 06:00,2018-07-19,1544.92
0.0,291.38,0.0,0.0,1,Clear skies,Clear skies,19-07-2018 07:00,2018-07-19,1997.32
0.0,293.12,0.0,0.0,1,Clear skies,Clear skies,19-07-2018 08:00,2018-07-19,2760.42
0.0,294.04,0.0,0.0,1,Clear skies,Clear skies,19-07-2018 09:00,2018-07-19,3956.42
0.0,297.13,0.0,0.0,2,Clear skies,Clear skies,19-07-2018 10:00,2018-07-19,4930.12
0.0,298.74,0.0,0.0,1,Clear skies,Clear skies,19-07-2018 11:00,2018-07-19,5490.42
0.0,299.59,0.0,0.0,1,Clear skies,Clear skies,19-07-2018 12:00,2018-07-19,6083.22
0.0,299.82,0.0,0.0,2,Clear skies,Clear skies,19-07-2018 13:00,2018-07-19,6835.92
0.0,300.32,0.0,0.0,2,Clear skies,Clear skies,19-07-2018 14:00,2018-07-19,6596.72
0.0,301.21,0.0,0.0,2,Clear skies,Clear skies,19-07-2018 15:00,2018-07-19,6605.82
0.0,300.93,0.0,0.0,1,Clear skies,Clear skies,19-07-2018 16:00,2018-07-19,6600.62
0.0,300.94,0.0,0.0,2,Clear skies,Clear skies,19-07-2018 17:00,2018-07-19,6032.52
0.0,301.42,0.0,0.0,1,Clear skies,Clear skies,19-07-2018 18:00,2018-07-19,5686.72
0.0,300.7,0.0,0.0,1,Clear skies,Clear skies,19-07-2018 19:00,2018-07-19,5134.22
0.0,299.57,0.0,0.0,1,Clear skies,Clear skies,19-07-2018 20:00,2018-07-19,4934.02
0.0,297.62,0.0,0.0,2,Clear skies,Clear skies,19-07-2018 21:00,2018-07-19,4508.92
0.0,296.14,0.0,0.0,1,Clear skies,Clear skies,19-07-2018 22:00,2018-07-19,3192.02
0.0,295.44,0.0,0.0,1,Clear skies,Clear skies,19-07-2018 23:00,2018-07-19,2265.12
0.0,296.0,0.0,0.0,2,Clear skies,Clear skies,20-07-2018 00:00,2018-07-20,1329.12
0.0,295.37,0.0,0.0,2,Clear skies,Clear skies,20-07-2018 01:00,2018-07-20,1031.42
0.0,295.22,0.0,0.0,2,Clear skies,Clear skies,20-07-2018 02:00,2018-07-20,835.12
0.0,296.06,0.0,0.0,40,Cloudy skies,Partly cloudy skies,20-07-2018 03:00,2018-07-20,911.82
0.0,295.38,0.0,0.0,1,Clear skies,Clear skies,20-07-2018 04:00,2018-07-20,1611.22
0.0,295.32,0.0,0.0,1,Clear skies,Clear skies,20-07-2018 05:00,2018-07-20,4182.62
0.0,294.91,0.0,0.0,1,Clear skies,Clear skies,20-07-2018 06:00,2018-07-20,7649.72
0.0,294.83,0.0,0.0,1,Clear skies,Clear skies,20-07-2018 07:00,2018-07-20,7203.82
0.0,295.49,0.0,0.0,40,Cloudy skies,Partly cloudy skies,20-07-2018 08:00,2018-07-20,7120.62
0.0,295.85,0.0,0.0,40,Cloudy skies,Partly cloudy skies,20-07-2018 09:00,2018-07-20,6399.12
0.0,295.98,0.0,0.0,2,Clear skies,Clear skies,20-07-2018 10:00,2018-07-20,5734.82
0.0,297.01,0.0,0.0,2,Clear skies,Clear skies,20-07-2018 11:00,2018-07-20,6432.92
0.0,297.97,0.0,0.0,1,Clear skies,Clear skies,20-07-2018 12:00,2018-07-20,6360.12
0.0,298.79,0.0,0.0,1,Clear skies,Clear skies,20-07-2018 13:00,2018-07-20,6553.82
0.0,299.54,0.0,0.0,1,Clear skies,Clear skies,20-07-2018 14:00,2018-07-20,7345.52
0.0,299.17,0.0,0.0,75,Cloudy skies,Fragmented clouds,20-07-2018 15:00,2018-07-20,7647.12
0.0,298.73,0.0,0.0,40,Cloudy skies,Partly cloudy skies,20-07-2018 16:00,2018-07-20,8541.52
0.0,298.63,0.0,0.0,1,Clear skies,Clear skies,20-07-2018 17:00,2018-07-20,7959.12
0.0,298.08,0.0,0.0,75,Cloudy skies,Fragmented clouds,20-07-2018 18:00,2018-07-20,6075.42
0.0,296.76,0.0,0.0,40,Cloudy skies,Partly cloudy skies,20-07-2018 19:00,2018-07-20,4914.52
0.0,296.1,0.0,0.0,41,Cloudy skies,Partly cloudy skies,20-07-2018 20:00,2018-07-20,3956.42
0.0,293.55,0.0,0.0,2,Clear skies,Clear skies,20-07-2018 21:00,2018-07-20,3782.22
0.0,292.66,0.0,0.0,1,Clear skies,Clear skies,20-07-2018 22:00,2018-07-20,3288.22
0.0,291.84,0.0,0.0,1,Clear skies,Clear skies,20-07-2018 23:00,2018-07-20,1871.22
0.0,290.65,0.0,0.0,2,Clear skies,Clear skies,21-07-2018 00:00,2018-07-21,1277.12
0.0,290.77,0.0,0.0,2,Clear skies,Clear skies,21-07-2018 01:00,2018-07-21,944.32
0.0,289.64,0.0,0.0,1,Clear skies,Clear skies,21-07-2018 02:00,2018-07-21,772.72
0.0,288.68,0.0,0.0,1,Clear skies,Clear skies,21-07-2018 03:00,2018-07-21,905.32
0.0,288.56,0.0,0.0,1,Clear skies,Clear skies,21-07-2018 04:00,2018-07-21,1557.92
0.0,287.69,0.0,0.0,1,Clear skies,Clear skies,21-07-2018 05:00,2018-07-21,4336.02
0.0,287.94,0.0,0.0,2,Clear skies,Clear skies,21-07-2018 06:00,2018-07-21,7673.12
0.0,289.57,0.0,0.0,2,Clear skies,Clear skies,21-07-2018 07:00,2018-07-21,7097.22
0.0,291.73,0.0,0.0,1,Clear skies,Clear skies,21-07-2018 08:00,2018-07-21,6908.72
0.0,292.64,0.0,0.0,1,Clear skies,Clear skies,21-07-2018 09:00,2018-07-21,6956.82
0.0,295.74,0.0,0.0,1,Clear skies,Clear skies,21-07-2018 10:00,2018-07-21,6105.32
0.0,296.68,0.0,0.0,1,Clear skies,Clear skies,21-07-2018 11:00,2018-07-21,6234.02
0.0,298.01,0.0,0.0,1,Clear skies,Clear skies,21-07-2018 12:00,2018-07-21,6904.82
0.0,299.44,0.0,0.0,40,Cloudy skies,Partly cloudy skies,21-07-2018 13:00,2018-07-21,6663.02
0.0,299.63,0.0,0.0,40,Cloudy skies,Partly cloudy skies,21-07-2018 14:00,2018-07-21,7558.72
0.0,299.48,0.0,0.0,40,Cloudy skies,Partly cloudy skies,21-07-2018 15:00,2018-07-21,8258.12
0.0,299.59,0.0,0.0,40,Cloudy skies,Partly cloudy skies,21-07-2018 16:00,2018-07-21,8316.62
0.0,300.13,0.0,0.0,40,Cloudy skies,Partly cloudy skies,21-07-2018 17:00,2018-07-21,7981.22
0.0,299.76,0.0,0.0,1,Clear skies,Clear skies,21-07-2018 18:00,2018-07-21,6192.42
0.0,298.57,0.0,0.0,40,Airborne particles,Smoky air,21-07-2018 19:00,2018-07-21,4846.92
0.0,298.2,0.0,0.0,1,Clear skies,Clear skies,21-07-2018 20:00,2018-07-21,4789.72
0.0,294.96,0.0,0.0,1,Clear skies,Clear skies,21-07-2018 21:00,2018-07-21,4404.92
0.0,293.94,0.0,0.0,1,Clear skies,Clear skies,21-07-2018 22:00,2018-07-21,3431.22
0.0,292.65,0.0,0.0,2,Clear skies,Clear skies,21-07-2018 23:00,2018-07-21,2066.22
0.0,292.27,0.0,0.0,1,Clear skies,Clear skies,22-07-2018 00:00,2018-07-22,1232.92
0.0,291.11,0.0,0.0,1,Clear skies,Clear skies,22-07-2018 01:00,2018-07-22,984.62
0.0,290.64,0.0,0.0,1,Clear skies,Clear skies,22-07-2018 02:00,2018-07-22,826.02
0.0,291.15,0.0,0.0,1,Clear skies,Clear skies,22-07-2018 03:00,2018-07-22,885.82
0.0,290.81,0.0,0.0,1,Clear skies,Clear skies,22-07-2018 04:00,2018-07-22,1615.12
0.0,291.02,0.0,0.0,1,Clear skies,Clear skies,22-07-2018 05:00,2018-07-22,4356.82
0.0,291.0,0.0,0.0,2,Clear skies,Clear skies,22-07-2018 06:00,2018-07-22,7868.12
0.0,292.37,0.0,0.0,75,Cloudy skies,Fragmented clouds,22-07-2018 07:00,2018-07-22,7489.82
0.0,294.02,0.0,0.0,1,Clear skies,Clear skies,22-07-2018 08:00,2018-07-22,7339.02
0.0,295.41,0.0,0.0,1,Clear skies,Clear skies,22-07-2018 09:00,2018-07-22,6707.22
0.0,297.87,0.0,0.0,1,Clear skies,Clear skies,22-07-2018 10:00,2018-07-22,6273.02
0.0,299.41,0.0,0.0,2,Clear skies,Clear skies,22-07-2018 11:00,2018-07-22,6547.32
0.0,299.83,0.0,0.0,41,Cloudy skies,Partly cloudy skies,22-07-2018 12:00,2018-07-22,6830.72
0.0,300.0,0.0,0.0,1,Clear skies,Clear skies,22-07-2018 13:00,2018-07-22,7014.02
0.0,300.69,0.0,0.0,40,Cloudy skies,Partly cloudy skies,22-07-2018 14:00,2018-07-22,7407.92
0.0,300.68,0.0,0.0,41,Cloudy skies,Partly cloudy skies,22-07-2018 15:00,2018-07-22,7918.82
0.0,300.66,0.0,0.0,75,Cloudy skies,Fragmented clouds,22-07-2018 16:00,2018-07-22,8584.42
0.0,301.01,0.0,0.0,40,Cloudy skies,Partly cloudy skies,22-07-2018 17:00,2018-07-22,8063.12
0.0,300.66,0.0,0.0,2,Clear skies,Clear skies,22-07-2018 18:00,2018-07-22,6343.22
0.0,299.28,0.0,0.0,1,Clear skies,Clear skies,22-07-2018 19:00,2018-07-22,4963.92
0.0,297.97,0.0,0.0,1,Clear skies,Clear skies,22-07-2018 20:00,2018-07-22,4512.82
0.0,295.99,0.0,0.0,2,Clear skies,Clear skies,22-07-2018 21:00,2018-07-22,4235.92
0.0,295.04,0.0,0.0,1,Clear skies,Clear skies,22-07-2018 22:00,2018-07-22,3036.02
0.0,294.26,0.0,0.0,1,Clear skies,Clear skies,22-07-2018 23:00,2018-07-22,1975.22
0.0,293.64,0.0,0.0,1,Clear skies,Clear skies,23-07-2018 00:00,2018-07-23,1370.72
0.0,293.42,0.0,0.0,1,Clear skies,Clear skies,23-07-2018 01:00,2018-07-23,996.32
0.0,292.21,0.0,0.0,1,Clear skies,Clear skies,23-07-2018 02:00,2018-07-23,878.02
0.0,291.64,0.385714286,0.0,1,Rainfall,Soft rain,23-07-2018 03:00,2018-07-23,931.32
0.0,290.85,0.0,0.0,2,Clear skies,Clear skies,23-07-2018 04:00,2018-07-23,1655.42
0.0,290.61,0.0,0.0,1,Clear skies,Clear skies,23-07-2018 05:00,2018-07-23,4187.82
0.0,290.45,0.3,0.0,1,Rainfall,Soft rain,23-07-2018 06:00,2018-07-23,7775.82
0.0,292.71,0.0,0.0,2,Clear skies,Clear skies,23-07-2018 07:00,2018-07-23,7340.32
0.0,293.51,0.0,0.0,1,Clear skies,Clear skies,23-07-2018 08:00,2018-07-23,6721.52
0.0,296.93,0.0,0.0,1,Clear skies,Clear skies,23-07-2018 09:00,2018-07-23,7153.12
0.0,297.84,0.0,0.0,1,Clear skies,Clear skies,23-07-2018 10:00,2018-07-23,6390.02
0.0,298.86,0.0,0.0,2,Clear skies,Clear skies,23-07-2018 11:00,2018-07-23,6617.52
0.0,299.81,0.0,0.0,1,Clear skies,Clear skies,23-07-2018 12:00,2018-07-23,6790.42
0.0,300.77,0.0,0.0,1,Clear skies,Clear skies,23-07-2018 13:00,2018-07-23,6354.92
0.0,300.91,0.0,0.0,2,Clear skies,Clear skies,23-07-2018 14:00,2018-07-23,6317.22
0.0,302.01,0.0,0.0,1,Clear skies,Clear skies,23-07-2018 15:00,2018-07-23,7472.92
0.0,301.57,0.0,0.0,1,Clear skies,Clear skies,23-07-2018 16:00,2018-07-23,8555.82
0.0,301.39,0.0,0.0,1,Clear skies,Clear skies,23-07-2018 17:00,2018-07-23,8008.52
0.0,301.21,0.0,0.0,1,Clear skies,Clear skies,23-07-2018 18:00,2018-07-23,6351.02
0.0,300.39,0.0,0.0,2,Clear skies,Clear skies,23-07-2018 19:00,2018-07-23,5173.22
0.0,299.35,0.0,0.0,1,Clear skies,Clear skies,23-07-2018 20:00,2018-07-23,4572.62
0.0,297.4,0.0,0.0,1,Clear skies,Clear skies,23-07-2018 21:00,2018-07-23,4954.82
0.0,296.49,0.0,0.0,1,Clear skies,Clear skies,23-07-2018 22:00,2018-07-23,4235.92
0.0,296.52,0.0,0.0,1,Clear skies,Clear skies,23-07-2018 23:00,2018-07-23,2382.12
0.0,295.64,0.0,0.0,2,Clear skies,Clear skies,24-07-2018 00:00,2018-07-24,1502.02
0.0,295.86,0.0,0.0,1,Clear skies,Clear skies,24-07-2018 01:00,2018-07-24,1035.32
0.0,295.33,0.0,0.0,90,Stormy weather,Storm with mild rain,24-07-2018 02:00,2018-07-24,957.32
0.0,294.9,5.25,0.0,90,Rainfall,Intense rainfall,24-07-2018 03:00,2018-07-24,944.32
0.0,294.27,2.231428571,0.0,40,Rainfall,Steady rain,24-07-2018 04:00,2018-07-24,1525.42
0.0,294.47,2.29,0.0,40,Rainfall,Steady rain,24-07-2018 05:00,2018-07-24,3899.22
0.0,293.71,2.91,0.0,90,Rainfall,Steady rain,24-07-2018 06:00,2018-07-24,6767.02
0.0,293.77,1.161428571,0.0,76,Rainfall,Steady rain,24-07-2018 07:00,2018-07-24,7836.92
0.0,293.95,0.25,0.0,75,Rainfall,Soft rain,24-07-2018 08:00,2018-07-24,7006.22
0.0,295.46,0.0,0.0,75,Cloudy skies,Fragmented clouds,24-07-2018 09:00,2018-07-24,6500.52
0.0,297.05,0.0,0.0,75,Cloudy skies,Fragmented clouds,24-07-2018 10:00,2018-07-24,6414.72
0.0,299.27,0.0,0.0,1,Clear skies,Clear skies,24-07-2018 11:00,2018-07-24,7063.42
0.0,300.56,0.0,0.0,40,Cloudy skies,Partly cloudy skies,24-07-2018 12:00,2018-07-24,7626.32
0.0,301.61,0.0,0.0,1,Clear skies,Clear skies,24-07-2018 13:00,2018-07-24,7112.82
0.0,302.23,0.0,0.0,91,Cloudy skies,Full cloud cover,24-07-2018 14:00,2018-07-24,7584.72
0.0,302.72,0.0,0.0,75,Cloudy skies,Fragmented clouds,24-07-2018 15:00,2018-07-24,7878.52
0.0,303.27,0.0,0.0,40,Cloudy skies,Partly cloudy skies,24-07-2018 16:00,2018-07-24,8259.42
0.0,302.74,0.0,0.0,40,Cloudy skies,Partly cloudy skies,24-07-2018 17:00,2018-07-24,7367.62
0.0,302.89,0.0,0.0,40,Cloudy skies,Partly cloudy skies,24-07-2018 18:00,2018-07-24,6269.12
0.0,303.09,0.0,0.0,1,Clear skies,Clear skies,24-07-2018 19:00,2018-07-24,5571.02
0.0,301.91,0.0,0.0,2,Clear skies,Clear skies,24-07-2018 20:00,2018-07-24,4814.42
0.0,300.2,0.0,0.0,2,Clear skies,Clear skies,24-07-2018 21:00,2018-07-24,2620.02
0.0,298.25,0.0,0.0,40,Cloudy skies,Partly cloudy skies,24-07-2018 22:00,2018-07-24,503.62
0.0,297.71,0.0,0.0,76,Cloudy skies,Fragmented clouds,24-07-2018 23:00,2018-07-24,564.72
0.0,296.72,0.0,0.0,1,Clear skies,Clear skies,25-07-2018 00:00,2018-07-25,2002.52
0.0,295.45,0.0,0.0,1,Clear skies,Clear skies,25-07-2018 01:00,2018-07-25,1356.42
0.0,294.2,0.0,0.0,1,Clear skies,Clear skies,25-07-2018 02:00,2018-07-25,1222.52
0.0,293.61,0.0,0.0,1,Clear skies,Clear skies,25-07-2018 03:00,2018-07-25,887.12
0.0,292.75,0.0,0.0,1,Light fog,Fine fog,25-07-2018 04:00,2018-07-25,754.52
0.0,292.5,0.0,0.0,1,Dense fog,Dense fog,25-07-2018 05:00,2018-07-25,789.62
0.0,292.62,0.3,0.0,1,Rainfall,Soft rain,25-07-2018 06:00,2018-07-25,742.82
0.0,293.96,0.0,0.0,1,Light fog,Fine fog,25-07-2018 07:00,2018-07-25,668.72
0.0,295.87,0.0,0.0,1,Clear skies,Clear skies,25-07-2018 08:00,2018-07-25,429.52
0.0,296.12,0.0,0.0,1,Clear skies,Clear skies,25-07-2018 09:00,2018-07-25,428.22
0.0,298.49,0.0,0.0,1,Clear skies,Clear skies,25-07-2018 10:00,2018-07-25,3010.02
0.0,299.31,0.0,0.0,1,Clear skies,Clear skies,25-07-2018 11:00,2018-07-25,3960.32
0.0,301.12,0.0,0.0,1,Clear skies,Clear skies,25-07-2018 12:00,2018-07-25,4407.52
0.0,302.52,0.0,0.0,1,Clear skies,Clear skies,25-07-2018 13:00,2018-07-25,4658.42
0.0,302.82,0.0,0.0,76,Cloudy skies,Fragmented clouds,25-07-2018 14:00,2018-07-25,4450.42
0.0,303.52,0.0,0.0,1,Clear skies,Clear skies,25-07-2018 15:00,2018-07-25,4583.02
0.0,302.86,0.0,0.0,1,Clear skies,Clear skies,25-07-2018 16:00,2018-07-25,4551.82
0.0,301.83,0.0,0.0,40,Cloudy skies,Partly cloudy skies,25-07-2018 17:00,2018-07-25,4856.02
0.0,301.34,0.0,0.0,1,Clear skies,Clear skies,25-07-2018 18:00,2018-07-25,4502.42
0.0,300.83,0.0,0.0,2,Clear skies,Clear skies,25-07-2018 19:00,2018-07-25,3674.32
0.0,300.27,0.0,0.0,40,Cloudy skies,Partly cloudy skies,25-07-2018 20:00,2018-07-25,3413.02
0.0,297.66,0.0,0.0,1,Airborne particles,Smoky air,25-07-2018 21:00,2018-07-25,2948.92
0.0,297.48,0.0,0.0,2,Clear skies,Clear skies,25-07-2018 22:00,2018-07-25,3298.62
0.0,295.96,0.0,0.0,1,Clear skies,Clear skies,25-07-2018 23:00,2018-07-25,2354.82
0.0,296.03,0.0,0.0,1,Clear skies,Clear skies,26-07-2018 00:00,2018-07-26,1998.62
0.0,296.32,0.0,0.0,40,Cloudy skies,Partly cloudy skies,26-07-2018 01:00,2018-07-26,1347.32
0.0,296.21,0.0,0.0,40,Cloudy skies,Partly cloudy skies,26-07-2018 02:00,2018-07-26,1230.32
0.0,295.8,0.0,0.0,40,Cloudy skies,Partly cloudy skies,26-07-2018 03:00,2018-07-26,893.62
0.0,295.84,0.0,0.0,41,Cloudy skies,Partly cloudy skies,26-07-2018 04:00,2018-07-26,766.22
0.0,295.58,0.0,0.0,2,Clear skies,Clear skies,26-07-2018 05:00,2018-07-26,844.22
0.0,294.77,0.0,0.0,40,Rainfall,Soft rain,26-07-2018 06:00,2018-07-26,1097.72
0.0,295.0,0.0,0.0,90,Light rain,Mild drizzle,26-07-2018 07:00,2018-07-26,1411.02
0.0,296.03,0.0,0.0,91,Cloudy skies,Full cloud cover,26-07-2018 08:00,2018-07-26,2006.42
0.0,296.15,0.0,0.0,90,Cloudy skies,Full cloud cover,26-07-2018 09:00,2018-07-26,2865.72
0.0,298.41,0.0,0.0,1,Clear skies,Clear skies,26-07-2018 10:00,2018-07-26,3817.32
0.0,298.55,0.0,0.0,40,Cloudy skies,Partly cloudy skies,26-07-2018 11:00,2018-07-26,4667.52
0.0,300.71,0.0,0.0,75,Cloudy skies,Fragmented clouds,26-07-2018 12:00,2018-07-26,5075.72
0.0,301.79,0.0,0.0,2,Clear skies,Clear skies,26-07-2018 13:00,2018-07-26,5296.72
0.0,303.28,0.0,0.0,40,Cloudy skies,Partly cloudy skies,26-07-2018 14:00,2018-07-26,5112.12
0.0,302.9,0.0,0.0,41,Cloudy skies,Partly cloudy skies,26-07-2018 15:00,2018-07-26,5234.32
0.0,303.16,0.0,0.0,1,Clear skies,Clear skies,26-07-2018 16:00,2018-07-26,5209.62
0.0,303.94,0.0,0.0,1,Clear skies,Clear skies,26-07-2018 17:00,2018-07-26,5486.52
0.0,303.38,0.0,0.0,1,Clear skies,Clear skies,26-07-2018 18:00,2018-07-26,5165.42
0.0,302.12,0.0,0.0,1,Clear skies,Clear skies,26-07-2018 19:00,2018-07-26,4414.02
0.0,300.78,0.0,0.0,1,Clear skies,Clear skies,26-07-2018 20:00,2018-07-26,4178.72
0.0,299.44,0.0,0.0,1,Clear skies,Clear skies,26-07-2018 21:00,2018-07-26,3760.12
0.0,298.31,0.0,0.0,2,Clear skies,Clear skies,26-07-2018 22:00,2018-07-26,3216.72
0.0,297.06,0.0,0.0,1,Clear skies,Clear skies,26-07-2018 23:00,2018-07-26,2149.42
0.0,296.17,0.0,0.0,1,Clear skies,Clear skies,27-07-2018 00:00,2018-07-27,1613.82
0.0,296.09,0.0,0.0,2,Clear skies,Clear skies,27-07-2018 01:00,2018-07-27,975.52
0.0,295.23,0.0,0.0,1,Clear skies,Clear skies,27-07-2018 02:00,2018-07-27,822.12
0.0,295.05,0.0,0.0,2,Clear skies,Clear skies,27-07-2018 03:00,2018-07-27,913.12
0.0,295.04,0.0,0.0,2,Clear skies,Clear skies,27-07-2018 04:00,2018-07-27,1569.62
0.0,294.91,0.0,0.0,2,Clear skies,Clear skies,27-07-2018 05:00,2018-07-27,4126.72
0.0,294.77,0.0,0.0,1,Clear skies,Clear skies,27-07-2018 06:00,2018-07-27,7670.52
0.0,295.76,0.0,0.0,1,Clear skies,Clear skies,27-07-2018 07:00,2018-07-27,8055.32
0.0,297.02,0.0,0.0,40,Cloudy skies,Partly cloudy skies,27-07-2018 08:00,2018-07-27,7370.22
0.0,297.83,0.0,0.0,1,Clear skies,Clear skies,27-07-2018 09:00,2018-07-27,6371.82
0.0,299.34,0.0,0.0,40,Cloudy skies,Partly cloudy skies,27-07-2018 10:00,2018-07-27,6226.22
0.0,301.16,0.0,0.0,75,Cloudy skies,Fragmented clouds,27-07-2018 11:00,2018-07-27,6224.92
0.0,302.27,0.0,0.0,40,Cloudy skies,Partly cloudy skies,27-07-2018 12:00,2018-07-27,6546.02
0.0,301.71,0.0,0.0,76,Cloudy skies,Fragmented clouds,27-07-2018 13:00,2018-07-27,6536.92
0.0,302.4,0.0,0.0,40,Cloudy skies,Partly cloudy skies,27-07-2018 14:00,2018-07-27,6847.62
0.0,302.36,0.0,0.0,20,Cloudy skies,Scattered clouds,27-07-2018 15:00,2018-07-27,7205.12
0.0,302.47,0.0,0.0,41,Cloudy skies,Partly cloudy skies,27-07-2018 16:00,2018-07-27,7463.82
0.0,303.18,0.0,0.0,40,Cloudy skies,Partly cloudy skies,27-07-2018 17:00,2018-07-27,7725.12
0.0,302.2,0.0,0.0,40,Cloudy skies,Partly cloudy skies,27-07-2018 18:00,2018-07-27,5920.72
0.0,301.72,0.0,0.0,41,Cloudy skies,Partly cloudy skies,27-07-2018 19:00,2018-07-27,4529.72
0.0,301.02,0.0,0.0,1,Clear skies,Clear skies,27-07-2018 20:00,2018-07-27,3770.52
0.0,300.71,0.0,0.0,1,Clear skies,Clear skies,27-07-2018 21:00,2018-07-27,3583.32
0.0,298.48,0.0,0.0,2,Clear skies,Clear skies,27-07-2018 22:00,2018-07-27,2846.22
0.0,298.7,0.0,0.0,1,Clear skies,Clear skies,27-07-2018 23:00,2018-07-27,1828.32
0.0,297.95,0.0,0.0,1,Clear skies,Clear skies,28-07-2018 00:00,2018-07-28,1269.32
0.0,297.47,0.0,0.0,1,Clear skies,Clear skies,28-07-2018 01:00,2018-07-28,1221.22
0.0,296.85,0.0,0.0,40,Cloudy skies,Partly cloudy skies,28-07-2018 02:00,2018-07-28,832.52
0.0,296.9,0.0,0.0,1,Clear skies,Clear skies,28-07-2018 03:00,2018-07-28,888.42
0.0,296.46,0.0,0.0,1,Clear skies,Clear skies,28-07-2018 04:00,2018-07-28,1547.52
0.0,297.01,0.0,0.0,1,Stormy weather,Approaching thunderstorm,28-07-2018 05:00,2018-07-28,4336.02
0.0,296.84,8.02,0.0,40,Rainfall,Intense rainfall,28-07-2018 06:00,2018-07-28,7055.62
0.0,296.02,20.24,0.0,91,Rainfall,Torrential downpour,28-07-2018 07:00,2018-07-28,6023.42
0.0,295.08,13.40571429,0.0,90,Rainfall,Intense rainfall,28-07-2018 08:00,2018-07-28,6977.62
0.0,295.94,5.662857143,0.0,76,Rainfall,Intense rainfall,28-07-2018 09:00,2018-07-28,6640.92
0.0,296.57,0.0,0.0,1,Clear skies,Clear skies,28-07-2018 10:00,2018-07-28,6000.02
0.0,297.4,0.0,0.0,1,Clear skies,Clear skies,28-07-2018 11:00,2018-07-28,6386.12
0.0,298.33,0.0,0.0,1,Clear skies,Clear skies,28-07-2018 12:00,2018-07-28,6761.82
0.0,300.31,0.0,0.0,76,Cloudy skies,Fragmented clouds,28-07-2018 13:00,2018-07-28,6612.32
0.0,300.68,0.0,0.0,90,Cloudy skies,Full cloud cover,28-07-2018 14:00,2018-07-28,7437.82
0.0,301.72,0.0,0.0,90,Cloudy skies,Full cloud cover,28-07-2018 15:00,2018-07-28,7725.12
0.0,301.29,0.0,0.0,91,Cloudy skies,Full cloud cover,28-07-2018 16:00,2018-07-28,9036.82
0.0,300.59,0.0,0.0,90,Cloudy skies,Full cloud cover,28-07-2018 17:00,2018-07-28,8939.32
0.0,301.29,0.0,0.0,90,Rainfall,Soft rain,28-07-2018 18:00,2018-07-28,6620.12
0.0,300.91,0.0,0.0,40,Cloudy skies,Partly cloudy skies,28-07-2018 19:00,2018-07-28,4579.12
0.0,299.33,0.0,0.0,41,Cloudy skies,Partly cloudy skies,28-07-2018 20:00,2018-07-28,4115.02
0.0,298.52,0.0,0.0,1,Clear skies,Clear skies,28-07-2018 21:00,2018-07-28,3792.62
0.0,296.51,0.0,0.0,1,Clear skies,Clear skies,28-07-2018 22:00,2018-07-28,2744.82
0.0,294.69,0.0,0.0,20,Cloudy skies,Scattered clouds,28-07-2018 23:00,2018-07-28,1947.92
0.0,294.11,0.0,0.0,1,Clear skies,Clear skies,29-07-2018 00:00,2018-07-29,1234.22
0.0,293.72,0.0,0.0,2,Clear skies,Clear skies,29-07-2018 01:00,2018-07-29,961.22
0.0,293.14,0.0,0.0,1,Clear skies,Clear skies,29-07-2018 02:00,2018-07-29,816.92
0.0,292.62,0.0,0.0,2,Clear skies,Clear skies,29-07-2018 03:00,2018-07-29,922.22
0.0,291.97,0.0,0.0,1,Clear skies,Clear skies,29-07-2018 04:00,2018-07-29,1595.62
0.0,291.78,0.0,0.0,1,Clear skies,Clear skies,29-07-2018 05:00,2018-07-29,4267.12
0.0,292.01,0.0,0.0,1,Clear skies,Clear skies,29-07-2018 06:00,2018-07-29,7995.52
0.0,292.14,0.0,0.0,2,Clear skies,Clear skies,29-07-2018 07:00,2018-07-29,7617.22
0.0,293.5,0.0,0.0,1,Clear skies,Clear skies,29-07-2018 08:00,2018-07-29,7311.72
0.0,294.14,0.0,0.0,1,Clear skies,Clear skies,29-07-2018 09:00,2018-07-29,5771.22
0.0,297.25,0.0,0.0,1,Clear skies,Clear skies,29-07-2018 10:00,2018-07-29,5903.82
0.0,297.07,0.0,0.0,2,Clear skies,Clear skies,29-07-2018 11:00,2018-07-29,6026.02
0.0,299.09,0.0,0.0,2,Clear skies,Clear skies,29-07-2018 12:00,2018-07-29,6141.72
0.0,299.52,0.0,0.0,2,Clear skies,Clear skies,29-07-2018 13:00,2018-07-29,6605.82
0.0,299.95,0.0,0.0,40,Cloudy skies,Partly cloudy skies,29-07-2018 14:00,2018-07-29,7011.42
0.0,300.66,0.0,0.0,40,Cloudy skies,Partly cloudy skies,29-07-2018 15:00,2018-07-29,7505.42
0.0,300.77,0.0,0.0,40,Cloudy skies,Partly cloudy skies,29-07-2018 16:00,2018-07-29,8450.52
0.0,300.8,0.0,0.0,1,Clear skies,Clear skies,29-07-2018 18:00,2018-07-29,6312.02
0.0,299.53,0.0,0.0,1,Clear skies,Clear skies,29-07-2018 19:00,2018-07-29,4934.02
0.0,298.51,0.0,0.0,1,Clear skies,Clear skies,29-07-2018 20:00,2018-07-29,4154.02
0.0,296.65,0.0,0.0,2,Clear skies,Clear skies,29-07-2018 21:00,2018-07-29,4294.42
0.0,295.23,0.0,0.0,1,Clear skies,Clear skies,29-07-2018 22:00,2018-07-29,3114.02
0.0,294.26,0.0,0.0,1,Clear skies,Clear skies,29-07-2018 23:00,2018-07-29,1963.52
0.0,294.2,0.0,0.0,2,Clear skies,Clear skies,30-07-2018 00:00,2018-07-30,1325.22
0.0,293.34,0.0,0.0,2,Clear skies,Clear skies,30-07-2018 01:00,2018-07-30,962.52
0.0,292.19,0.0,0.0,2,Clear skies,Clear skies,30-07-2018 02:00,2018-07-30,870.22
0.0,291.78,0.0,0.0,1,Clear skies,Clear skies,30-07-2018 03:00,2018-07-30,891.02
0.0,291.27,0.0,0.0,1,Clear skies,Clear skies,30-07-2018 04:00,2018-07-30,1590.42
0.0,290.65,0.0,0.0,1,Clear skies,Clear skies,30-07-2018 05:00,2018-07-30,4261.92
0.0,291.06,0.0,0.0,1,Clear skies,Clear skies,30-07-2018 06:00,2018-07-30,7775.82
0.0,291.44,0.0,0.0,1,Clear skies,Clear skies,30-07-2018 07:00,2018-07-30,7621.12
0.0,292.59,0.0,0.0,1,Clear skies,Clear skies,30-07-2018 08:00,2018-07-30,7358.52
0.0,295.64,0.0,0.0,1,Clear skies,Clear skies,30-07-2018 09:00,2018-07-30,6807.32
0.0,297.71,0.0,0.0,2,Clear skies,Clear skies,30-07-2018 10:00,2018-07-30,6202.82
0.0,299.82,0.0,0.0,1,Clear skies,Clear skies,30-07-2018 11:00,2018-07-30,6789.12
0.0,299.78,0.0,0.0,1,Clear skies,Clear skies,30-07-2018 12:00,2018-07-30,7029.62
0.0,301.36,0.0,0.0,1,Clear skies,Clear skies,30-07-2018 13:00,2018-07-30,6959.42
0.0,301.95,0.0,0.0,2,Clear skies,Clear skies,30-07-2018 14:00,2018-07-30,7471.62
0.0,302.26,0.0,0.0,1,Clear skies,Clear skies,30-07-2018 15:00,2018-07-30,7930.52
0.0,301.7,0.0,0.0,1,Clear skies,Clear skies,30-07-2018 16:00,2018-07-30,8828.82
0.0,302.13,0.0,0.0,2,Clear skies,Clear skies,30-07-2018 17:00,2018-07-30,8697.52
0.0,301.83,0.0,0.0,1,Clear skies,Clear skies,30-07-2018 18:00,2018-07-30,6842.42
0.0,300.95,0.0,0.0,1,Clear skies,Clear skies,30-07-2018 19:00,2018-07-30,5177.12
0.0,297.0,0.0,0.0,1,Clear skies,Clear skies,30-07-2018 21:00,2018-07-30,4454.32
0.0,295.2,0.0,0.0,41,Cloudy skies,Partly cloudy skies,30-07-2018 22:00,2018-07-30,3524.82
0.0,295.26,0.0,0.0,1,Clear skies,Clear skies,30-07-2018 23:00,2018-07-30,2330.12
0.0,294.71,0.0,0.0,1,Clear skies,Clear skies,31-07-2018 00:00,2018-07-31,1426.62
0.0,293.8,0.0,0.0,2,Clear skies,Clear skies,31-07-2018 01:00,2018-07-31,1112.02
0.0,293.76,0.0,0.0,1,Clear skies,Clear skies,31-07-2018 02:00,2018-07-31,910.52
0.0,292.61,0.0,0.0,1,Clear skies,Clear skies,31-07-2018 03:00,2018-07-31,961.22
0.0,292.27,0.0,0.0,1,Clear skies,Clear skies,31-07-2018 04:00,2018-07-31,1521.52
0.0,291.61,0.0,0.0,1,Clear skies,Clear skies,31-07-2018 05:00,2018-07-31,4056.52
0.0,291.31,0.0,0.0,2,Clear skies,Clear skies,31-07-2018 06:00,2018-07-31,7578.22
0.0,291.69,0.0,0.0,1,Clear skies,Clear skies,31-07-2018 07:00,2018-07-31,8086.52
0.0,293.81,0.0,0.0,1,Clear skies,Clear skies,31-07-2018 08:00,2018-07-31,7172.62
0.0,294.34,0.0,0.0,2,Clear skies,Clear skies,31-07-2018 09:00,2018-07-31,6533.02
0.0,297.27,0.0,0.0,1,Clear skies,Clear skies,31-07-2018 10:00,2018-07-31,6440.72
0.0,298.79,0.0,0.0,1,Clear skies,Clear skies,31-07-2018 11:00,2018-07-31,7085.52
0.0,298.83,0.0,0.0,1,Clear skies,Clear skies,31-07-2018 12:00,2018-07-31,7844.72
0.0,300.34,0.0,0.0,2,Clear skies,Clear skies,31-07-2018 13:00,2018-07-31,7272.72
0.0,300.54,0.0,0.0,1,Clear skies,Clear skies,31-07-2018 14:00,2018-07-31,7899.32
0.0,300.85,0.0,0.0,1,Clear skies,Clear skies,31-07-2018 15:00,2018-07-31,7882.42
0.0,300.8,0.0,0.0,1,Clear skies,Clear skies,31-07-2018 16:00,2018-07-31,8397.22
0.0,300.4,0.0,0.0,2,Clear skies,Clear skies,31-07-2018 17:00,2018-07-31,7625.02
0.0,300.43,0.0,0.0,2,Clear skies,Clear skies,31-07-2018 18:00,2018-07-31,6569.42
0.0,299.77,0.0,0.0,1,Clear skies,Clear skies,31-07-2018 19:00,2018-07-31,5138.12
0.0,297.85,0.0,0.0,2,Clear skies,Clear skies,31-07-2018 20:00,2018-07-31,4394.52
0.0,296.45,0.0,0.0,41,Cloudy skies,Partly cloudy skies,31-07-2018 21:00,2018-07-31,4642.82
0.0,293.48,0.0,0.0,1,Clear skies,Clear skies,31-07-2018 22:00,2018-07-31,4826.12
0.0,293.85,0.0,0.0,1,Clear skies,Clear skies,31-07-2018 23:00,2018-07-31,3507.92
0.0,292.69,0.0,0.0,41,Cloudy skies,Partly cloudy skies,01-08-2018 0:00,2018-08-01,2163.72
0.0,292.47,0.0,0.0,41,Cloudy skies,Partly cloudy skies,01-08-2018 1:00,2018-08-01,1479.92
0.0,291.84,0.0,0.0,75,Cloudy skies,Fragmented clouds,01-08-2018 2:00,2018-08-01,1199.12
0.0,291.43,0.0,0.0,41,Cloudy skies,Partly cloudy skies,01-08-2018 3:00,2018-08-01,944.32
0.0,290.83,0.0,0.0,41,Cloudy skies,Partly cloudy skies,01-08-2018 4:00,2018-08-01,976.82
0.0,289.65,0.0,0.0,1,Clear skies,Clear skies,01-08-2018 5:00,2018-08-01,1431.82
0.0,289.59,0.0,0.0,1,Clear skies,Clear skies,01-08-2018 6:00,2018-08-01,2282.02
0.0,290.18,0.0,0.0,1,Clear skies,Clear skies,01-08-2018 7:00,2018-08-01,2708.42
0.0,293.76,0.0,0.0,1,Clear skies,Clear skies,01-08-2018 8:00,2018-08-01,3492.32
0.0,294.39,0.0,0.0,1,Clear skies,Clear skies,01-08-2018 9:00,2018-08-01,4593.42
0.0,297.41,0.0,0.0,1,Clear skies,Clear skies,01-08-2018 10:00,2018-08-01,5131.62
0.0,298.69,0.0,0.0,2,Clear skies,Clear skies,01-08-2018 11:00,2018-08-01,5210.92
0.0,301.0,0.0,0.0,1,Clear skies,Clear skies,01-08-2018 12:00,2018-08-01,5522.92
0.0,301.48,0.0,0.0,36,Cloudy skies,Partly cloudy skies,01-08-2018 13:00,2018-08-01,4961.32
0.0,302.5,0.0,0.0,36,Cloudy skies,Partly cloudy skies,01-08-2018 14:00,2018-08-01,5138.12
0.0,302.36,0.0,0.0,36,Cloudy skies,Partly cloudy skies,01-08-2018 15:00,2018-08-01,5314.92
0.0,301.82,0.0,0.0,36,Cloudy skies,Partly cloudy skies,01-08-2018 16:00,2018-08-01,5282.42
0.0,302.74,0.0,0.0,36,Cloudy skies,Partly cloudy skies,01-08-2018 17:00,2018-08-01,4996.42
0.0,302.38,0.0,0.0,2,Clear skies,Clear skies,01-08-2018 18:00,2018-08-01,4542.72
0.0,301.37,0.0,0.0,1,Clear skies,Clear skies,01-08-2018 19:00,2018-08-01,3829.02
0.0,299.75,0.0,0.0,1,Clear skies,Clear skies,01-08-2018 20:00,2018-08-01,3757.52
0.0,298.43,0.0,0.0,1,Clear skies,Clear skies,01-08-2018 21:00,2018-08-01,3865.42
0.0,297.39,0.0,0.0,2,Clear skies,Clear skies,01-08-2018 22:00,2018-08-01,3361.02
0.0,297.29,0.0,0.0,2,Clear skies,Clear skies,01-08-2018 23:00,2018-08-01,3120.52
0.0,297.2,0.0,0.0,2,Clear skies,Clear skies,02-08-2018 0:00,2018-08-02,2258.62
0.0,296.53,0.0,0.0,1,Rainfall,Soft rain,02-08-2018 1:00,2018-08-02,1473.42
0.0,295.65,0.0,0.0,1,Clear skies,Clear skies,02-08-2018 2:00,2018-08-02,1260.22
0.0,295.7,0.0,0.0,1,Clear skies,Clear skies,02-08-2018 3:00,2018-08-02,917.02
0.0,294.81,0.0,0.0,2,Stormy weather,Approaching thunderstorm,02-08-2018 4:00,2018-08-02,810.42
0.0,295.2,0.0,0.0,1,Clear skies,Clear skies,02-08-2018 5:00,2018-08-02,1048.32
0.0,294.57,0.0,0.0,2,Clear skies,Clear skies,02-08-2018 6:00,2018-08-02,1431.82
0.0,294.75,0.0,0.0,1,Clear skies,Clear skies,02-08-2018 7:00,2018-08-02,1694.42
0.0,295.51,0.0,0.0,40,Cloudy skies,Partly cloudy skies,02-08-2018 8:00,2018-08-02,2491.32
0.0,297.05,0.0,0.0,1,Clear skies,Clear skies,02-08-2018 9:00,2018-08-02,3627.52
0.0,298.12,0.0,0.0,1,Clear skies,Clear skies,02-08-2018 10:00,2018-08-02,4581.72
0.0,299.15,0.0,0.0,1,Clear skies,Clear skies,02-08-2018 11:00,2018-08-02,5577.52
0.0,300.39,0.0,0.0,90,Cloudy skies,Full cloud cover,02-08-2018 12:00,2018-08-02,5431.92
0.0,300.35,0.0,0.0,2,Clear skies,Clear skies,02-08-2018 13:00,2018-08-02,5502.12
0.0,301.21,0.0,0.0,40,Cloudy skies,Partly cloudy skies,02-08-2018 14:00,2018-08-02,5438.42
0.0,301.66,0.0,0.0,40,Cloudy skies,Partly cloudy skies,02-08-2018 15:00,2018-08-02,5547.62
0.0,301.11,0.0,0.0,41,Cloudy skies,Partly cloudy skies,02-08-2018 16:00,2018-08-02,5550.22
0.0,301.45,0.0,0.0,40,Cloudy skies,Partly cloudy skies,02-08-2018 17:00,2018-08-02,5559.32
0.0,300.59,0.0,0.0,1,Clear skies,Clear skies,02-08-2018 18:00,2018-08-02,4950.92
0.0,298.74,0.0,0.0,2,Clear skies,Clear skies,02-08-2018 19:00,2018-08-02,4445.22
0.0,297.84,0.0,0.0,1,Clear skies,Clear skies,02-08-2018 20:00,2018-08-02,4329.52
0.0,295.38,0.0,0.0,1,Clear skies,Clear skies,02-08-2018 21:00,2018-08-02,3921.32
0.0,294.01,0.0,0.0,1,Clear skies,Clear skies,02-08-2018 22:00,2018-08-02,2854.02
0.0,291.8,0.0,0.0,2,Clear skies,Clear skies,02-08-2018 23:00,2018-08-02,1921.92
0.0,291.51,0.0,0.0,1,Clear skies,Clear skies,03-08-2018 0:00,2018-08-03,1251.12
0.0,290.45,0.0,0.0,1,Clear skies,Clear skies,03-08-2018 1:00,2018-08-03,989.82
0.0,289.61,0.0,0.0,1,Clear skies,Clear skies,03-08-2018 2:00,2018-08-03,831.22
0.0,287.93,0.0,0.0,1,Clear skies,Clear skies,03-08-2018 3:00,2018-08-03,885.82
0.0,287.31,0.0,0.0,1,Clear skies,Clear skies,03-08-2018 4:00,2018-08-03,1555.32
0.0,287.95,0.0,0.0,1,Clear skies,Clear skies,03-08-2018 5:00,2018-08-03,4320.42
0.0,286.88,0.0,0.0,1,Clear skies,Clear skies,03-08-2018 6:00,2018-08-03,7912.32
0.0,288.31,0.0,0.0,1,Clear skies,Clear skies,03-08-2018 7:00,2018-08-03,7485.92
0.0,290.83,0.0,0.0,1,Clear skies,Clear skies,03-08-2018 8:00,2018-08-03,7333.82
0.0,293.58,0.0,0.0,1,Clear skies,Clear skies,03-08-2018 9:00,2018-08-03,6630.52
0.0,295.53,0.0,0.0,1,Clear skies,Clear skies,03-08-2018 10:00,2018-08-03,5985.72
0.0,296.22,0.0,0.0,1,Clear skies,Clear skies,03-08-2018 11:00,2018-08-03,6271.72
0.0,297.22,0.0,0.0,1,Clear skies,Clear skies,03-08-2018 12:00,2018-08-03,6733.22
0.0,297.22,0.0,0.0,1,Clear skies,Clear skies,03-08-2018 13:00,2018-08-03,6640.92
0.0,298.89,0.0,0.0,1,Clear skies,Clear skies,03-08-2018 14:00,2018-08-03,7228.52
0.0,298.38,0.0,0.0,41,Cloudy skies,Partly cloudy skies,03-08-2018 15:00,2018-08-03,7784.92
0.0,299.46,0.0,0.0,41,Cloudy skies,Partly cloudy skies,03-08-2018 16:00,2018-08-03,8581.82
0.0,298.99,0.0,0.0,41,Cloudy skies,Partly cloudy skies,03-08-2018 17:00,2018-08-03,8042.32
0.0,298.63,0.0,0.0,1,Clear skies,Clear skies,03-08-2018 18:00,2018-08-03,6039.02
0.0,297.35,0.0,0.0,40,Cloudy skies,Partly cloudy skies,03-08-2018 19:00,2018-08-03,4824.82
0.0,296.28,0.0,0.0,1,Clear skies,Clear skies,03-08-2018 20:00,2018-08-03,4272.32
0.0,293.8,0.0,0.0,40,Cloudy skies,Partly cloudy skies,03-08-2018 21:00,2018-08-03,3624.92
0.0,292.49,0.0,0.0,41,Cloudy skies,Partly cloudy skies,03-08-2018 22:00,2018-08-03,2750.02
0.0,291.28,0.0,0.0,20,Cloudy skies,Scattered clouds,03-08-2018 23:00,2018-08-03,1842.62
0.0,291.42,0.0,0.0,2,Clear skies,Clear skies,04-08-2018 0:00,2018-08-04,1209.52
0.0,289.74,0.0,0.0,2,Clear skies,Clear skies,04-08-2018 1:00,2018-08-04,922.22
0.0,288.63,1.314285714,0.0,1,Rainfall,Steady rain,04-08-2018 2:00,2018-08-04,806.52
0.0,288.15,0.0,0.0,2,Clear skies,Clear skies,04-08-2018 3:00,2018-08-04,878.02
0.0,286.61,0.0,0.0,2,Clear skies,Clear skies,04-08-2018 4:00,2018-08-04,1602.12
0.0,286.14,0.0,0.0,2,Light fog,Fine fog,04-08-2018 5:00,2018-08-04,4407.52
0.0,285.66,0.0,0.0,1,Light fog,Fine fog,04-08-2018 6:00,2018-08-04,8012.42
0.0,287.79,0.0,0.0,1,Clear skies,Clear skies,04-08-2018 7:00,2018-08-04,6227.52
0.0,288.99,0.0,0.0,1,Clear skies,Clear skies,04-08-2018 8:00,2018-08-04,7245.42
0.0,293.17,0.0,0.0,1,Clear skies,Clear skies,04-08-2018 9:00,2018-08-04,6806.02
0.0,295.84,0.0,0.0,1,Clear skies,Clear skies,04-08-2018 10:00,2018-08-04,6002.62
0.0,297.35,0.0,0.0,1,Clear skies,Clear skies,04-08-2018 11:00,2018-08-04,6696.82
0.0,297.26,0.0,0.0,2,Clear skies,Clear skies,04-08-2018 12:00,2018-08-04,6804.72
0.0,299.13,0.0,0.0,1,Clear skies,Clear skies,04-08-2018 13:00,2018-08-04,6655.22
0.0,299.83,0.0,0.0,75,Cloudy skies,Fragmented clouds,04-08-2018 14:00,2018-08-04,7510.62
0.0,299.95,0.0,0.0,1,Clear skies,Clear skies,04-08-2018 15:00,2018-08-04,7792.72
0.0,300.07,0.0,0.0,40,Cloudy skies,Partly cloudy skies,04-08-2018 16:00,2018-08-04,8580.52
0.0,300.34,0.0,0.0,40,Cloudy skies,Partly cloudy skies,04-08-2018 17:00,2018-08-04,8187.92
0.0,299.88,0.0,0.0,1,Clear skies,Clear skies,04-08-2018 18:00,2018-08-04,6001.32
0.0,298.93,0.0,0.0,1,Clear skies,Clear skies,04-08-2018 19:00,2018-08-04,4888.52
0.0,297.15,0.0,0.0,1,Clear skies,Clear skies,04-08-2018 20:00,2018-08-04,4284.02
0.0,294.46,0.0,0.0,1,Airborne particles,Smoky air,04-08-2018 21:00,2018-08-04,3792.62
0.0,292.03,0.0,0.0,1,Clear skies,Clear skies,04-08-2018 22:00,2018-08-04,3164.72
0.0,290.79,0.0,0.0,1,Clear skies,Clear skies,04-08-2018 23:00,2018-08-04,3445.52
0.0,289.48,0.0,0.0,1,Clear skies,Clear skies,05-08-2018 0:00,2018-08-05,1377.22
0.0,288.8,0.0,0.0,1,Clear skies,Clear skies,05-08-2018 1:00,2018-08-05,991.12
0.0,288.67,0.0,0.0,1,Clear skies,Clear skies,05-08-2018 2:00,2018-08-05,828.62
0.0,288.85,0.0,0.0,2,Clear skies,Clear skies,05-08-2018 3:00,2018-08-05,927.42
0.0,288.24,0.0,0.0,1,Clear skies,Clear skies,05-08-2018 4:00,2018-08-05,1602.12
0.0,288.09,0.0,0.0,2,Clear skies,Clear skies,05-08-2018 5:00,2018-08-05,4360.72
0.0,287.26,0.3,0.0,1,Rainfall,Soft rain,05-08-2018 6:00,2018-08-05,7855.12
0.0,288.88,0.0,0.0,1,Clear skies,Clear skies,05-08-2018 7:00,2018-08-05,7544.42
0.0,290.77,0.0,0.0,1,Clear skies,Clear skies,05-08-2018 8:00,2018-08-05,7471.62
0.0,291.96,0.0,0.0,20,Cloudy skies,Scattered clouds,05-08-2018 9:00,2018-08-05,6816.42
0.0,294.92,0.0,0.0,2,Clear skies,Clear skies,05-08-2018 10:00,2018-08-05,6388.72
0.0,297.48,0.0,0.0,1,Clear skies,Clear skies,05-08-2018 11:00,2018-08-05,6627.92
0.0,297.57,0.0,0.0,40,Cloudy skies,Partly cloudy skies,05-08-2018 12:00,2018-08-05,7003.62
0.0,299.56,0.0,0.0,40,Cloudy skies,Partly cloudy skies,05-08-2018 13:00,2018-08-05,7038.72
0.0,299.47,0.0,0.0,75,Cloudy skies,Fragmented clouds,05-08-2018 14:00,2018-08-05,7521.02
0.0,300.71,0.0,0.0,21,Cloudy skies,Scattered clouds,05-08-2018 15:00,2018-08-05,7710.82
0.0,299.92,0.0,0.0,1,Clear skies,Clear skies,05-08-2018 16:00,2018-08-05,8874.32
0.0,300.83,0.0,0.0,2,Clear skies,Clear skies,05-08-2018 17:00,2018-08-05,8385.52
0.0,299.01,0.0,0.0,1,Clear skies,Clear skies,05-08-2018 19:00,2018-08-05,4939.22
0.0,296.63,0.0,0.0,1,Clear skies,Clear skies,05-08-2018 20:00,2018-08-05,4688.32
0.0,295.95,0.0,0.0,2,Airborne particles,Smoky air,05-08-2018 21:00,2018-08-05,4410.12
0.0,293.49,0.9,0.0,1,Rainfall,Soft rain,05-08-2018 22:00,2018-08-05,3678.22
0.0,292.42,0.385714286,0.0,1,Rainfall,Soft rain,05-08-2018 23:00,2018-08-05,3757.52
0.0,292.22,0.0,0.0,1,Clear skies,Clear skies,06-08-2018 0:00,2018-08-06,1511.12
0.0,291.16,0.0,0.0,1,Clear skies,Clear skies,06-08-2018 1:00,2018-08-06,1019.72
0.0,291.1,0.0,0.0,1,Clear skies,Clear skies,06-08-2018 2:00,2018-08-06,885.82
0.0,290.19,0.0,0.0,1,Clear skies,Clear skies,06-08-2018 3:00,2018-08-06,910.52
0.0,290.4,0.0,0.0,2,Clear skies,Clear skies,06-08-2018 4:00,2018-08-06,1617.72
0.0,289.98,0.0,0.0,75,Cloudy skies,Fragmented clouds,06-08-2018 5:00,2018-08-06,4243.72
0.0,291.19,0.0,0.0,41,Cloudy skies,Partly cloudy skies,06-08-2018 6:00,2018-08-06,7965.62
0.0,290.88,0.0,0.0,41,Cloudy skies,Partly cloudy skies,06-08-2018 7:00,2018-08-06,8260.72
0.0,292.17,0.0,0.0,90,Cloudy skies,Full cloud cover,06-08-2018 8:00,2018-08-06,7335.12
0.0,293.2,0.0,0.0,90,Cloudy skies,Full cloud cover,06-08-2018 9:00,2018-08-06,6772.22
0.0,294.36,0.567142857,0.0,90,Rainfall,Soft rain,06-08-2018 10:00,2018-08-06,6624.02
0.0,294.25,12.75714286,0.0,91,Rainfall,Intense rainfall,06-08-2018 11:00,2018-08-06,6565.52
0.0,294.71,1.02,0.0,90,Rainfall,Steady rain,06-08-2018 12:00,2018-08-06,6934.72
0.0,295.59,0.0,0.0,75,Rainfall,Soft rain,06-08-2018 13:00,2018-08-06,7010.12
0.0,296.39,0.0,0.0,75,Rainfall,Soft rain,06-08-2018 14:00,2018-08-06,7456.02
0.0,295.41,0.51,0.0,90,Rainfall,Steady rain,06-08-2018 15:00,2018-08-06,7669.22
0.0,295.47,0.838571429,0.0,75,Rainfall,Steady rain,06-08-2018 16:00,2018-08-06,8676.72
0.0,295.47,0.61,0.0,91,Rainfall,Steady rain,06-08-2018 17:00,2018-08-06,8171.02
0.0,295.58,0.0,0.0,40,Cloudy skies,Partly cloudy skies,06-08-2018 18:00,2018-08-06,6165.12
0.0,295.59,3.645714286,0.0,90,Rainfall,Steady rain,06-08-2018 19:00,2018-08-06,4934.02
0.0,295.8,6.185714286,0.0,90,Rainfall,Intense rainfall,06-08-2018 20:00,2018-08-06,4286.62
0.0,295.18,4.394285714,0.0,90,Rainfall,Intense rainfall,06-08-2018 21:00,2018-08-06,4376.32
0.0,294.65,1.13,0.0,75,Rainfall,Steady rain,06-08-2018 22:00,2018-08-06,3413.02
0.0,295.13,1.485714286,0.0,76,Rainfall,Steady rain,06-08-2018 23:00,2018-08-06,2118.22
0.0,294.51,2.554285714,0.0,40,Rainfall,Intense rainfall,07-08-2018 0:00,2018-08-07,1368.12
0.0,293.64,3.54,0.0,90,Rainfall,Intense rainfall,07-08-2018 1:00,2018-08-07,1010.62
0.0,293.37,5.931428571,0.0,76,Rainfall,Intense rainfall,07-08-2018 2:00,2018-08-07,891.02
0.0,293.67,0.3,0.0,90,Rainfall,Intense rainfall,07-08-2018 3:00,2018-08-07,887.12
0.0,294.57,0.89,0.0,90,Rainfall,Steady rain,07-08-2018 4:00,2018-08-07,1490.32
0.0,293.73,1.37,0.0,90,Rainfall,Intense rainfall,07-08-2018 5:00,2018-08-07,4034.42
0.0,294.45,0.0,0.0,90,Rainfall,Soft rain,07-08-2018 6:00,2018-08-07,7381.92
0.0,294.33,0.25,0.0,90,Rainfall,Soft rain,07-08-2018 7:00,2018-08-07,8133.32
0.0,294.19,0.0,0.0,90,Cloudy skies,Full cloud cover,07-08-2018 8:00,2018-08-07,7092.02
0.0,294.75,0.0,0.0,40,Cloudy skies,Partly cloudy skies,07-08-2018 9:00,2018-08-07,6499.22
0.0,295.76,0.0,0.0,90,Light fog,Fine fog,07-08-2018 10:00,2018-08-07,6137.82
0.0,296.85,0.0,0.0,90,Cloudy skies,Full cloud cover,07-08-2018 11:00,2018-08-07,6709.82
0.0,297.11,0.0,0.0,75,Cloudy skies,Fragmented clouds,07-08-2018 12:00,2018-08-07,6781.32
0.0,298.05,0.0,0.0,40,Cloudy skies,Partly cloudy skies,07-08-2018 13:00,2018-08-07,6894.42
0.0,299.9,0.0,0.0,75,Cloudy skies,Fragmented clouds,07-08-2018 14:00,2018-08-07,7578.22
0.0,299.59,0.0,0.0,40,Cloudy skies,Partly cloudy skies,07-08-2018 15:00,2018-08-07,7995.52
0.0,300.18,0.0,0.0,75,Cloudy skies,Fragmented clouds,07-08-2018 16:00,2018-08-07,8345.22
0.0,299.88,0.0,0.0,1,Clear skies,Clear skies,07-08-2018 17:00,2018-08-07,7102.42
0.0,300.62,0.0,0.0,1,Clear skies,Clear skies,07-08-2018 18:00,2018-08-07,6006.52
0.0,298.93,0.0,0.0,1,Clear skies,Clear skies,07-08-2018 19:00,2018-08-07,5590.52
0.0,297.11,0.0,0.0,1,Clear skies,Clear skies,07-08-2018 20:00,2018-08-07,4876.82
0.0,295.45,0.0,0.0,1,Clear skies,Clear skies,07-08-2018 21:00,2018-08-07,4923.62
0.0,294.55,0.0,0.0,1,Clear skies,Clear skies,07-08-2018 22:00,2018-08-07,4866.42
0.0,293.28,0.0,0.0,1,Clear skies,Clear skies,07-08-2018 23:00,2018-08-07,3354.52
0.0,293.52,0.0,0.0,1,Light fog,Fine fog,08-08-2018 0:00,2018-08-08,2269.02
0.0,292.92,0.0,0.0,1,Light fog,Fine fog,08-08-2018 1:00,2018-08-08,1635.92
0.0,292.51,0.0,0.0,1,Light fog,Fine fog,08-08-2018 2:00,2018-08-08,1343.42
0.0,291.83,0.0,0.0,1,Dense fog,Dense fog,08-08-2018 3:00,2018-08-08,1006.72
0.0,291.7,0.0,0.0,76,Light fog,Fine fog,08-08-2018 4:00,2018-08-08,1022.32
0.0,292.2,0.0,0.0,40,Light fog,Fine fog,08-08-2018 5:00,2018-08-08,1457.82
0.0,291.8,0.0,0.0,1,Light fog,Fine fog,08-08-2018 6:00,2018-08-08,2271.62
0.0,292.72,0.0,0.0,2,Light fog,Fine fog,08-08-2018 7:00,2018-08-08,2799.42
0.0,292.63,0.0,0.0,90,Cloudy skies,Full cloud cover,08-08-2018 8:00,2018-08-08,3735.42
0.0,293.76,0.0,0.0,75,Cloudy skies,Fragmented clouds,08-08-2018 9:00,2018-08-08,4749.42
0.0,294.51,0.0,0.0,75,Rainfall,Soft rain,08-08-2018 10:00,2018-08-08,5411.12
0.0,294.96,0.0,0.0,2,Rainfall,Soft rain,08-08-2018 11:00,2018-08-08,5723.12
0.0,296.25,0.0,0.0,75,Cloudy skies,Fragmented clouds,08-08-2018 12:00,2018-08-08,6084.52
0.0,297.71,0.0,0.0,40,Cloudy skies,Partly cloudy skies,08-08-2018 13:00,2018-08-08,5992.22
0.0,298.67,0.0,0.0,40,Cloudy skies,Partly cloudy skies,08-08-2018 14:00,2018-08-08,6089.72
0.0,298.88,0.0,0.0,1,Clear skies,Clear skies,08-08-2018 15:00,2018-08-08,6228.82
0.0,299.77,0.0,0.0,40,Cloudy skies,Partly cloudy skies,08-08-2018 16:00,2018-08-08,6253.52
0.0,300.17,0.0,0.0,40,Cloudy skies,Partly cloudy skies,08-08-2018 17:00,2018-08-08,6326.32
0.0,300.17,0.0,0.0,1,Clear skies,Clear skies,08-08-2018 18:00,2018-08-08,5728.32
0.0,299.0,0.0,0.0,2,Clear skies,Clear skies,08-08-2018 19:00,2018-08-08,5316.22
0.0,298.09,0.0,0.0,75,Rainfall,Soft rain,08-08-2018 20:00,2018-08-08,4657.12
0.0,297.34,2.404285714,0.0,91,Rainfall,Steady rain,08-08-2018 21:00,2018-08-08,4863.82
0.0,296.18,1.52,0.0,1,Rainfall,Steady rain,08-08-2018 22:00,2018-08-08,4970.42
0.0,296.04,0.0,0.0,90,Rainfall,Soft rain,08-08-2018 23:00,2018-08-08,3613.22
0.0,296.35,0.0,0.0,91,Rainfall,Soft rain,09-08-2018 0:00,2018-08-09,2324.92
0.0,295.37,0.0,0.0,2,Clear skies,Clear skies,09-08-2018 1:00,2018-08-09,1652.82
0.0,295.52,0.0,0.0,2,Rainfall,Soft rain,09-08-2018 2:00,2018-08-09,1300.52
0.0,294.51,0.0,0.0,1,Rainfall,Soft rain,09-08-2018 3:00,2018-08-09,957.32
0.0,294.57,0.0,0.0,75,Rainfall,Soft rain,09-08-2018 4:00,2018-08-09,891.02
0.0,293.99,0.0,0.0,2,Light fog,Fine fog,09-08-2018 5:00,2018-08-09,1076.92
0.0,293.89,0.0,0.0,75,Light fog,Fine fog,09-08-2018 6:00,2018-08-09,1503.32
0.0,294.47,0.0,0.0,90,Light fog,Fine fog,09-08-2018 7:00,2018-08-09,1842.62
0.0,295.01,0.0,0.0,75,Light fog,Fine fog,09-08-2018 8:00,2018-08-09,2652.52
0.0,296.43,0.0,0.0,41,Cloudy skies,Partly cloudy skies,09-08-2018 9:00,2018-08-09,3953.82
0.0,297.82,0.0,0.0,75,Cloudy skies,Fragmented clouds,09-08-2018 10:00,2018-08-09,4789.72
0.0,298.31,0.0,0.0,90,Cloudy skies,Full cloud cover,09-08-2018 11:00,2018-08-09,5400.72
0.0,299.0,0.0,0.0,90,Rainfall,Soft rain,09-08-2018 12:00,2018-08-09,6410.82
0.0,297.56,7.87,0.0,90,Rainfall,Intense rainfall,09-08-2018 13:00,2018-08-09,6581.12
0.0,295.68,6.484285714,0.0,90,Rainfall,Intense rainfall,09-08-2018 14:00,2018-08-09,5844.02
0.0,294.83,2.724285714,0.0,75,Rainfall,Steady rain,09-08-2018 15:00,2018-08-09,5850.52
0.0,295.57,0.0,0.0,76,Rainfall,Soft rain,09-08-2018 16:00,2018-08-09,5928.52
0.0,297.4,0.0,0.0,40,Cloudy skies,Partly cloudy skies,09-08-2018 17:00,2018-08-09,5948.02
0.0,297.05,0.0,0.0,1,Clear skies,Clear skies,09-08-2018 18:00,2018-08-09,5528.12
0.0,297.09,0.0,0.0,1,Clear skies,Clear skies,09-08-2018 19:00,2018-08-09,4979.52
0.0,296.44,0.0,0.0,1,Clear skies,Clear skies,09-08-2018 20:00,2018-08-09,4638.92
0.0,294.83,0.0,0.0,1,Clear skies,Clear skies,09-08-2018 21:00,2018-08-09,3847.22
0.0,294.09,0.0,0.0,1,Clear skies,Clear skies,09-08-2018 22:00,2018-08-09,3052.92
0.0,293.79,0.0,0.0,1,Clear skies,Clear skies,09-08-2018 23:00,2018-08-09,1840.02
0.0,293.67,0.0,0.0,1,Light fog,Fine fog,10-08-2018 0:00,2018-08-10,1201.72
0.0,292.76,0.0,0.0,1,Dense fog,Dense fog,10-08-2018 1:00,2018-08-10,892.32
0.0,292.7,0.0,0.0,2,Light fog,Fine fog,10-08-2018 3:00,2018-08-10,837.72
0.0,292.05,0.0,0.0,1,Light fog,Fine fog,10-08-2018 4:00,2018-08-10,1550.12
0.0,291.27,0.25,0.0,2,Rainfall,Soft rain,10-08-2018 5:00,2018-08-10,4095.52
0.0,291.14,0.0,0.0,1,Light fog,Fine fog,10-08-2018 6:00,2018-08-10,7706.92
0.0,292.04,0.0,0.0,2,Clear skies,Clear skies,10-08-2018 7:00,2018-08-10,7843.42
0.0,293.81,0.0,0.0,1,Clear skies,Clear skies,10-08-2018 8:00,2018-08-10,7371.52
0.0,293.96,0.0,0.0,1,Clear skies,Clear skies,10-08-2018 9:00,2018-08-10,6468.02
0.0,296.49,0.0,0.0,1,Clear skies,Clear skies,10-08-2018 10:00,2018-08-10,6031.22
0.0,297.79,0.0,0.0,41,Cloudy skies,Partly cloudy skies,10-08-2018 11:00,2018-08-10,6197.62
0.0,298.29,0.0,0.0,40,Cloudy skies,Partly cloudy skies,10-08-2018 12:00,2018-08-10,6617.52
0.0,299.1,0.0,0.0,40,Cloudy skies,Partly cloudy skies,10-08-2018 13:00,2018-08-10,6601.92
0.0,299.17,0.0,0.0,40,Cloudy skies,Partly cloudy skies,10-08-2018 14:00,2018-08-10,7154.42
0.0,299.51,0.0,0.0,1,Clear skies,Clear skies,10-08-2018 15:00,2018-08-10,7918.82
0.0,300.0,0.0,0.0,41,Cloudy skies,Partly cloudy skies,10-08-2018 16:00,2018-08-10,8499.92
0.0,300.26,0.0,0.0,1,Clear skies,Clear skies,10-08-2018 17:00,2018-08-10,7942.22
0.0,299.03,0.0,0.0,1,Clear skies,Clear skies,10-08-2018 18:00,2018-08-10,5100.42
0.0,299.07,0.0,0.0,2,Clear skies,Clear skies,10-08-2018 19:00,2018-08-10,4273.62
0.0,296.49,0.0,0.0,2,Clear skies,Clear skies,10-08-2018 20:00,2018-08-10,4221.62
0.0,294.72,0.0,0.0,1,Clear skies,Clear skies,10-08-2018 21:00,2018-08-10,3931.72
0.0,293.31,0.0,0.0,1,Clear skies,Clear skies,10-08-2018 22:00,2018-08-10,3067.22
0.0,292.27,0.0,0.0,1,Clear skies,Clear skies,10-08-2018 23:00,2018-08-10,1928.42
0.0,291.6,0.0,0.0,1,Clear skies,Clear skies,11-08-2018 0:00,2018-08-11,1209.52
0.0,290.82,0.0,0.0,2,Clear skies,Clear skies,11-08-2018 1:00,2018-08-11,961.22
0.0,290.49,0.0,0.0,1,Clear skies,Clear skies,11-08-2018 2:00,2018-08-11,796.12
0.0,290.31,0.0,0.0,1,Dense fog,Dense fog,11-08-2018 3:00,2018-08-11,891.02
0.0,289.69,0.3,0.0,1,Rainfall,Soft rain,11-08-2018 4:00,2018-08-11,1560.52
0.0,289.2,0.0,0.0,1,Light fog,Fine fog,11-08-2018 5:00,2018-08-11,4299.62
0.0,288.78,0.0,0.0,1,Light fog,Fine fog,11-08-2018 6:00,2018-08-11,7914.92
0.0,290.07,0.0,0.0,1,Clear skies,Clear skies,11-08-2018 7:00,2018-08-11,7842.12
0.0,291.59,0.0,0.0,1,Clear skies,Clear skies,11-08-2018 8:00,2018-08-11,7376.72
0.0,294.27,0.0,0.0,1,Clear skies,Clear skies,11-08-2018 9:00,2018-08-11,6618.82
0.0,296.11,0.0,0.0,1,Clear skies,Clear skies,11-08-2018 10:00,2018-08-11,5918.12
0.0,297.42,0.0,0.0,1,Clear skies,Clear skies,11-08-2018 11:00,2018-08-11,6300.32
0.0,298.0,0.0,0.0,1,Clear skies,Clear skies,11-08-2018 12:00,2018-08-11,6401.72
0.0,299.07,0.0,0.0,1,Clear skies,Clear skies,11-08-2018 13:00,2018-08-11,6366.62
0.0,300.36,0.0,0.0,40,Cloudy skies,Partly cloudy skies,11-08-2018 14:00,2018-08-11,7493.72
0.0,299.76,0.0,0.0,1,Clear skies,Clear skies,11-08-2018 15:00,2018-08-11,7690.02
0.0,300.48,0.51,0.0,40,Rainfall,Soft rain,11-08-2018 16:00,2018-08-11,8862.62
0.0,300.75,0.0,0.0,1,Clear skies,Clear skies,11-08-2018 17:00,2018-08-11,8362.12
0.0,299.59,0.0,0.0,1,Clear skies,Clear skies,11-08-2018 18:00,2018-08-11,6452.42
0.0,298.69,0.0,0.0,1,Clear skies,Clear skies,11-08-2018 19:00,2018-08-11,4781.92
0.0,297.03,0.0,0.0,2,Clear skies,Clear skies,11-08-2018 20:00,2018-08-11,4443.92
0.0,293.99,0.0,0.0,1,Clear skies,Clear skies,11-08-2018 21:00,2018-08-11,4099.42
0.0,292.4,0.0,0.0,1,Clear skies,Clear skies,11-08-2018 22:00,2018-08-11,2959.32
0.0,291.15,0.0,0.0,1,Clear skies,Clear skies,11-08-2018 23:00,2018-08-11,1996.02
0.0,290.5,0.0,0.0,1,Clear skies,Clear skies,12-08-2018 0:00,2018-08-12,1223.82
0.0,290.34,0.0,0.0,1,Clear skies,Clear skies,12-08-2018 1:00,2018-08-12,980.72
0.0,289.55,0.0,0.0,1,Light fog,Fine fog,12-08-2018 2:00,2018-08-12,841.62
0.0,289.29,0.0,0.0,1,Clear skies,Clear skies,12-08-2018 3:00,2018-08-12,915.72
0.0,289.09,0.0,0.0,1,Clear skies,Clear skies,12-08-2018 4:00,2018-08-12,1546.22
0.0,288.63,0.0,0.0,1,Light fog,Fine fog,12-08-2018 5:00,2018-08-12,4293.12
0.0,288.21,0.0,0.0,1,Light fog,Fine fog,12-08-2018 6:00,2018-08-12,8060.52
0.0,289.4,0.0,0.0,2,Clear skies,Clear skies,12-08-2018 7:00,2018-08-12,7775.82
0.0,292.44,0.0,0.0,1,Clear skies,Clear skies,12-08-2018 8:00,2018-08-12,7336.42
0.0,294.87,0.0,0.0,1,Clear skies,Clear skies,12-08-2018 9:00,2018-08-12,7004.92
0.0,297.31,0.0,0.0,2,Clear skies,Clear skies,12-08-2018 10:00,2018-08-12,6321.12
0.0,299.62,0.0,0.0,2,Clear skies,Clear skies,12-08-2018 11:00,2018-08-12,6760.52
0.0,299.91,0.0,0.0,1,Clear skies,Clear skies,12-08-2018 12:00,2018-08-12,7415.72
0.0,301.19,0.0,0.0,1,Clear skies,Clear skies,12-08-2018 13:00,2018-08-12,7038.72
0.0,301.99,0.0,0.0,1,Clear skies,Clear skies,12-08-2018 14:00,2018-08-12,7431.32
0.0,301.98,0.0,0.0,1,Clear skies,Clear skies,12-08-2018 15:00,2018-08-12,7758.92
0.0,302.38,0.0,0.0,2,Clear skies,Clear skies,12-08-2018 16:00,2018-08-12,8752.12
0.0,302.25,0.0,0.0,2,Clear skies,Clear skies,12-08-2018 17:00,2018-08-12,8722.22
0.0,302.41,0.0,0.0,1,Clear skies,Clear skies,12-08-2018 18:00,2018-08-12,6646.12
0.0,301.04,0.0,0.0,1,Clear skies,Clear skies,12-08-2018 19:00,2018-08-12,5197.92
0.0,298.72,0.0,0.0,1,Clear skies,Clear skies,12-08-2018 20:00,2018-08-12,4415.32
0.0,298.04,0.0,0.0,2,Clear skies,Clear skies,12-08-2018 21:00,2018-08-12,4706.52
0.0,297.58,0.0,0.0,1,Clear skies,Clear skies,12-08-2018 22:00,2018-08-12,5032.82
0.0,297.69,0.0,0.0,1,Clear skies,Clear skies,12-08-2018 23:00,2018-08-12,2340.52
0.0,296.85,0.0,0.0,1,Clear skies,Clear skies,13-08-2018 00:00,2018-08-13,1374.62
0.0,297.15,0.0,0.0,1,Rainfall,Soft rain,13-08-2018 01:00,2018-08-13,1010.62
0.0,296.6,0.0,0.0,2,Rainfall,Soft rain,13-08-2018 02:00,2018-08-13,837.72
0.0,296.62,0.0,0.0,40,Rainfall,Soft rain,13-08-2018 03:00,2018-08-13,907.92
0.0,295.29,1.698571429,0.0,91,Rainfall,Steady rain,13-08-2018 04:00,2018-08-13,1547.52
0.0,295.3,0.58,0.0,40,Rainfall,Soft rain,13-08-2018 05:00,2018-08-13,4250.22
0.0,294.19,0.28,0.0,1,Rainfall,Soft rain,13-08-2018 06:00,2018-08-13,7912.32
0.0,295.37,0.0,0.0,40,Cloudy skies,Partly cloudy skies,13-08-2018 07:00,2018-08-13,8102.12
0.0,295.91,0.0,0.0,1,Clear skies,Clear skies,13-08-2018 08:00,2018-08-13,7465.12
0.0,296.34,0.0,0.0,1,Clear skies,Clear skies,13-08-2018 09:00,2018-08-13,6843.72
0.0,298.63,0.0,0.0,2,Clear skies,Clear skies,13-08-2018 10:00,2018-08-13,6804.72
0.0,299.57,0.0,0.0,1,Clear skies,Clear skies,13-08-2018 11:00,2018-08-13,7708.22
0.0,300.27,0.0,0.0,1,Clear skies,Clear skies,13-08-2018 12:00,2018-08-13,7212.92
0.0,300.61,0.0,0.0,2,Clear skies,Clear skies,13-08-2018 13:00,2018-08-13,7293.52
0.0,301.17,0.0,0.0,1,Clear skies,Clear skies,13-08-2018 14:00,2018-08-13,7691.32
0.0,300.78,0.0,0.0,1,Clear skies,Clear skies,13-08-2018 15:00,2018-08-13,7892.82
0.0,301.47,0.0,0.0,1,Clear skies,Clear skies,13-08-2018 16:00,2018-08-13,8674.12
