Holiday,Temperature,Rainfall_last_hour,Snowfall_last_hour,Cloud_Cover,Weather,Weather_Desc,TimeStamp,Date,Traffic_Vol
0.0,289.28,0.0,0.0,40,Cloudy skies,Partly cloudy skies,02-10-2015 9:00,2015-10-02,7639.32
0.0,290.26,0.0,0.0,75,Cloudy skies,Fragmented clouds,02-10-2015 10:00,2015-10-02,6300.32
0.0,290.28,0.0,0.0,90,Cloudy skies,Full cloud cover,02-10-2015 11:00,2015-10-02,6621.42
0.0,290.33,0.0,0.0,90,Cloudy skies,Full cloud cover,02-10-2015 12:00,2015-10-02,6958.12
0.0,292.14,0.0,0.0,75,Cloudy skies,Fragmented clouds,02-10-2015 13:00,2015-10-02,6824.22
0.0,292.72,0.0,0.0,1,Clear skies,Clear skies,02-10-2015 14:00,2015-10-02,7164.82
0.0,293.37,0.0,0.0,1,Clear skies,Clear skies,02-10-2015 15:00,2015-10-02,7680.92
0.0,294.16,0.0,0.0,1,Clear skies,Clear skies,02-10-2015 16:00,2015-10-02,8250.32
0.0,294.84,0.0,0.0,20,Cloudy skies,Scattered clouds,02-10-2015 17:00,2015-10-02,7952.62
0.0,293.7,0.0,0.0,20,Cloudy skies,Scattered clouds,02-10-2015 18:00,2015-10-02,6622.72
0.0,291.67,0.0,0.0,21,Cloudy skies,Scattered clouds,02-10-2015 19:00,2015-10-02,5026.32
0.0,289.98,0.0,0.0,2,Clear skies,Clear skies,02-10-2015 20:00,2015-10-02,4044.82
0.0,289.51,0.0,0.0,2,Clear skies,Clear skies,02-10-2015 21:00,2015-10-02,3493.62
0.0,287.56,0.0,0.0,2,Clear skies,Clear skies,02-10-2015 22:00,2015-10-02,2413.32
0.0,286.05,0.0,0.0,1,Clear skies,Clear skies,02-10-2015 23:00,2015-10-02,1681.42
0.0,284.73,0.0,0.0,1,Clear skies,Clear skies,03-10-2015 0:00,2015-10-03,1076.92
0.0,284.17,0.0,0.0,1,Clear skies,Clear skies,03-10-2015 1:00,2015-10-03,836.42
0.0,282.08,0.0,0.0,1,Clear skies,Clear skies,03-10-2015 2:00,2015-10-03,781.82
0.0,281.99,0.0,0.0,2,Clear skies,Clear skies,03-10-2015 3:00,2015-10-03,901.42
0.0,279.73,0.0,0.0,1,Clear skies,Clear skies,03-10-2015 4:00,2015-10-03,1479.92
0.0,279.52,0.0,0.0,1,Clear skies,Clear skies,03-10-2015 5:00,2015-10-03,3953.82
0.0,279.03,0.0,0.0,2,Clear skies,Clear skies,03-10-2015 6:00,2015-10-03,7804.42
0.0,278.62,0.0,0.0,1,Clear skies,Clear skies,03-10-2015 8:00,2015-10-03,8886.02
0.0,282.68,0.0,0.0,2,Clear skies,Clear skies,03-10-2015 9:00,2015-10-03,7535.32
0.0,292.17,0.0,0.0,1,Clear skies,Clear skies,03-10-2015 12:00,2015-10-03,7056.92
0.0,293.43,0.0,0.0,1,Clear skies,Clear skies,03-10-2015 13:00,2015-10-03,6774.82
0.0,294.81,0.0,0.0,1,Clear skies,Clear skies,03-10-2015 14:00,2015-10-03,7363.72
0.0,295.57,0.0,0.0,1,Clear skies,Clear skies,03-10-2015 15:00,2015-10-03,7818.72
0.0,295.63,0.0,0.0,2,Clear skies,Clear skies,03-10-2015 16:00,2015-10-03,8399.82
0.0,293.76,0.0,0.0,20,Cloudy skies,Scattered clouds,03-10-2015 18:00,2015-10-03,6436.82
0.0,290.95,0.0,0.0,20,Cloudy skies,Scattered clouds,03-10-2015 19:00,2015-10-03,5091.32
0.0,289.19,0.0,0.0,20,Cloudy skies,Scattered clouds,03-10-2015 20:00,2015-10-03,4198.22
0.0,287.8,0.0,0.0,1,Clear skies,Clear skies,03-10-2015 21:00,2015-10-03,3848.52
0.0,286.75,0.0,0.0,1,Clear skies,Clear skies,03-10-2015 22:00,2015-10-03,2735.72
0.0,285.46,0.0,0.0,1,Clear skies,Clear skies,03-10-2015 23:00,2015-10-03,1738.62
0.0,285.25,0.0,0.0,2,Clear skies,Clear skies,04-10-2015 0:00,2015-10-04,1197.82
0.0,284.07,0.0,0.0,1,Clear skies,Clear skies,04-10-2015 1:00,2015-10-04,905.32
0.0,283.67,0.0,0.0,1,Clear skies,Clear skies,04-10-2015 2:00,2015-10-04,824.72
0.0,282.84,0.0,0.0,1,Clear skies,Clear skies,04-10-2015 3:00,2015-10-04,901.42
0.0,281.89,0.0,0.0,1,Clear skies,Clear skies,04-10-2015 4:00,2015-10-04,1513.72
0.0,281.52,0.0,0.0,1,Clear skies,Clear skies,04-10-2015 5:00,2015-10-04,3966.82
0.0,281.64,0.0,0.0,1,Clear skies,Clear skies,04-10-2015 6:00,2015-10-04,7821.32
0.0,280.87,0.0,0.0,2,Clear skies,Clear skies,04-10-2015 7:00,2015-10-04,9516.52
0.0,282.26,0.0,0.0,1,Clear skies,Clear skies,04-10-2015 8:00,2015-10-04,8203.52
0.0,285.78,0.0,0.0,1,Clear skies,Clear skies,04-10-2015 9:00,2015-10-04,7323.42
0.0,289.38,0.0,0.0,1,Clear skies,Clear skies,04-10-2015 10:00,2015-10-04,6405.62
0.0,292.55,0.0,0.0,1,Clear skies,Clear skies,04-10-2015 11:00,2015-10-04,6768.32
0.0,295.97,0.0,0.0,1,Clear skies,Clear skies,04-10-2015 12:00,2015-10-04,7064.72
0.0,296.78,0.0,0.0,1,Clear skies,Clear skies,04-10-2015 13:00,2015-10-04,7160.92
0.0,297.62,0.0,0.0,2,Clear skies,Clear skies,04-10-2015 14:00,2015-10-04,7573.02
0.0,298.37,0.0,0.0,2,Clear skies,Clear skies,04-10-2015 15:00,2015-10-04,7847.32
0.0,298.26,0.0,0.0,21,Cloudy skies,Scattered clouds,04-10-2015 16:00,2015-10-04,8605.22
0.0,298.17,0.0,0.0,20,Cloudy skies,Scattered clouds,04-10-2015 17:00,2015-10-04,8297.12
0.0,296.76,0.0,0.0,40,Cloudy skies,Partly cloudy skies,04-10-2015 18:00,2015-10-04,6803.42
0.0,294.85,0.0,0.0,40,Cloudy skies,Partly cloudy skies,04-10-2015 19:00,2015-10-04,4978.22
0.0,292.73,0.0,0.0,41,Cloudy skies,Partly cloudy skies,04-10-2015 20:00,2015-10-04,4367.22
0.0,292.67,0.0,0.0,75,Cloudy skies,Fragmented clouds,04-10-2015 21:00,2015-10-04,4090.32
0.0,292.26,0.0,0.0,75,Cloudy skies,Fragmented clouds,04-10-2015 22:00,2015-10-04,3010.02
0.0,291.72,0.0,0.0,75,Cloudy skies,Fragmented clouds,04-10-2015 23:00,2015-10-04,1945.32
0.0,290.73,0.0,0.0,75,Cloudy skies,Fragmented clouds,05-10-2015 0:00,2015-10-05,1245.92
0.0,291.06,0.0,0.0,40,Cloudy skies,Partly cloudy skies,05-10-2015 1:00,2015-10-05,926.12
0.0,289.56,0.0,0.0,0,Clear skies,Clear skies,05-10-2015 3:00,2015-10-05,901.42
0.0,283.71,0.0,0.0,76,Cloudy skies,Fragmented clouds,05-10-2015 5:00,2015-10-05,3654.82
0.0,282.34,0.0,0.0,90,Cloudy skies,Full cloud cover,05-10-2015 6:00,2015-10-05,7622.42
0.0,281.89,0.0,0.0,90,Cloudy skies,Full cloud cover,05-10-2015 7:00,2015-10-05,9039.42
0.0,281.17,0.0,0.0,91,Cloudy skies,Full cloud cover,05-10-2015 8:00,2015-10-05,7621.12
0.0,280.52,0.0,0.0,75,Cloudy skies,Fragmented clouds,05-10-2015 9:00,2015-10-05,7449.52
0.0,280.21,0.0,0.0,76,Cloudy skies,Fragmented clouds,05-10-2015 10:00,2015-10-05,6625.32
0.0,280.9,0.0,0.0,90,Cloudy skies,Full cloud cover,05-10-2015 11:00,2015-10-05,7206.42
0.0,281.53,0.0,0.0,91,Cloudy skies,Full cloud cover,05-10-2015 12:00,2015-10-05,8060.52
0.0,282.03,0.0,0.0,75,Cloudy skies,Fragmented clouds,05-10-2015 13:00,2015-10-05,8181.42
0.0,282.18,0.0,0.0,90,Cloudy skies,Full cloud cover,05-10-2015 14:00,2015-10-05,8368.62
0.0,282.41,0.0,0.0,90,Cloudy skies,Full cloud cover,05-10-2015 15:00,2015-10-05,8394.62
0.0,281.93,0.0,0.0,91,Cloudy skies,Full cloud cover,05-10-2015 16:00,2015-10-05,8320.52
0.0,281.52,0.0,0.0,90,Cloudy skies,Full cloud cover,05-10-2015 17:00,2015-10-05,8440.12
0.0,281.87,0.0,0.0,90,Cloudy skies,Full cloud cover,05-10-2015 18:00,2015-10-05,7427.42
0.0,280.35,0.0,0.0,91,Cloudy skies,Full cloud cover,05-10-2015 19:00,2015-10-05,5703.62
0.0,280.08,0.0,0.0,91,Cloudy skies,Full cloud cover,05-10-2015 20:00,2015-10-05,4804.02
0.0,279.85,0.0,0.0,75,Cloudy skies,Fragmented clouds,05-10-2015 21:00,2015-10-05,4290.52
0.0,279.42,0.0,0.0,40,Cloudy skies,Partly cloudy skies,05-10-2015 22:00,2015-10-05,3609.32
0.0,279.56,0.0,0.0,40,Cloudy skies,Partly cloudy skies,05-10-2015 23:00,2015-10-05,2807.22
0.0,279.11,0.0,0.0,90,Cloudy skies,Full cloud cover,06-10-2015 0:00,2015-10-06,2031.12
0.0,279.05,0.0,0.0,90,Cloudy skies,Full cloud cover,06-10-2015 1:00,2015-10-06,1356.42
0.0,278.69,0.0,0.0,90,Cloudy skies,Full cloud cover,06-10-2015 2:00,2015-10-06,1131.52
0.0,277.89,0.0,0.0,76,Cloudy skies,Fragmented clouds,06-10-2015 4:00,2015-10-06,956.02
0.0,276.65,0.0,0.0,20,Cloudy skies,Scattered clouds,06-10-2015 5:00,2015-10-06,1313.52
0.0,276.0,0.0,0.0,2,Clear skies,Clear skies,06-10-2015 6:00,2015-10-06,2187.12
0.0,275.87,0.0,0.0,1,Clear skies,Clear skies,06-10-2015 7:00,2015-10-06,3120.52
0.0,275.59,0.0,0.0,2,Clear skies,Clear skies,06-10-2015 8:00,2015-10-06,4763.72
0.0,275.49,0.0,0.0,41,Cloudy skies,Partly cloudy skies,06-10-2015 9:00,2015-10-06,5955.82
0.0,277.38,0.0,0.0,20,Cloudy skies,Scattered clouds,06-10-2015 10:00,2015-10-06,6743.62
0.0,278.84,0.0,0.0,20,Cloudy skies,Scattered clouds,06-10-2015 11:00,2015-10-06,7172.62
0.0,279.98,0.0,0.0,41,Cloudy skies,Partly cloudy skies,06-10-2015 12:00,2015-10-06,7794.02
0.0,280.82,0.0,0.0,75,Cloudy skies,Fragmented clouds,06-10-2015 13:00,2015-10-06,7016.62
0.0,281.05,0.0,0.0,75,Cloudy skies,Fragmented clouds,06-10-2015 14:00,2015-10-06,6958.12
0.0,280.4,0.0,0.0,75,Cloudy skies,Fragmented clouds,06-10-2015 15:00,2015-10-06,7119.32
0.0,279.66,0.0,0.0,91,Cloudy skies,Full cloud cover,06-10-2015 16:00,2015-10-06,6960.72
0.0,279.61,0.0,0.0,90,Cloudy skies,Full cloud cover,06-10-2015 17:00,2015-10-06,6633.12
0.0,279.09,0.0,0.0,90,Cloudy skies,Full cloud cover,06-10-2015 18:00,2015-10-06,6101.42
0.0,278.46,0.0,0.0,90,Cloudy skies,Full cloud cover,06-10-2015 19:00,2015-10-06,5447.52
0.0,279.16,0.0,0.0,91,Cloudy skies,Full cloud cover,06-10-2015 20:00,2015-10-06,4531.02
0.0,278.13,0.0,0.0,90,Cloudy skies,Full cloud cover,06-10-2015 21:00,2015-10-06,4316.52
0.0,277.3,0.0,0.0,90,Cloudy skies,Full cloud cover,06-10-2015 22:00,2015-10-06,4583.02
0.0,276.74,0.0,0.0,75,Cloudy skies,Fragmented clouds,06-10-2015 23:00,2015-10-06,2950.22
0.0,277.11,0.0,0.0,75,Cloudy skies,Fragmented clouds,07-10-2015 0:00,2015-10-07,2023.32
0.0,276.03,0.0,0.0,90,Cloudy skies,Full cloud cover,07-10-2015 3:00,2015-10-07,840.32
0.0,276.05,0.0,0.0,90,Cloudy skies,Full cloud cover,07-10-2015 4:00,2015-10-07,831.22
0.0,275.81,0.0,0.0,75,Cloudy skies,Fragmented clouds,07-10-2015 5:00,2015-10-07,1245.92
0.0,275.15,0.0,0.0,90,Cloudy skies,Full cloud cover,07-10-2015 6:00,2015-10-07,2388.62
0.0,275.27,0.0,0.0,91,Cloudy skies,Full cloud cover,07-10-2015 7:00,2015-10-07,2423.72
0.0,275.77,0.0,0.0,75,Cloudy skies,Fragmented clouds,07-10-2015 8:00,2015-10-07,3327.22
0.0,275.95,0.0,0.0,75,Cloudy skies,Fragmented clouds,07-10-2015 9:00,2015-10-07,6367.92
0.0,277.14,0.0,0.0,75,Cloudy skies,Fragmented clouds,07-10-2015 10:00,2015-10-07,6442.02
0.0,277.41,0.0,0.0,91,Cloudy skies,Full cloud cover,07-10-2015 11:00,2015-10-07,6318.52
0.0,277.53,0.0,0.0,90,Cloudy skies,Full cloud cover,07-10-2015 12:00,2015-10-07,7107.62
0.0,278.65,0.0,0.0,90,Cloudy skies,Full cloud cover,07-10-2015 13:00,2015-10-07,9055.02
0.0,279.57,0.0,0.0,90,Cloudy skies,Full cloud cover,07-10-2015 14:00,2015-10-07,8990.02
0.0,279.57,0.0,0.0,90,Cloudy skies,Full cloud cover,07-10-2015 15:00,2015-10-07,6184.62
0.0,279.64,0.0,0.0,90,Cloudy skies,Full cloud cover,07-10-2015 16:00,2015-10-07,6052.02
0.0,280.22,0.0,0.0,91,Cloudy skies,Full cloud cover,07-10-2015 17:00,2015-10-07,5413.72
0.0,279.37,0.0,0.0,91,Cloudy skies,Full cloud cover,07-10-2015 18:00,2015-10-07,5642.52
0.0,278.81,0.0,0.0,90,Cloudy skies,Full cloud cover,07-10-2015 19:00,2015-10-07,4819.62
0.0,277.69,0.0,0.0,76,Cloudy skies,Fragmented clouds,07-10-2015 20:00,2015-10-07,4078.62
0.0,275.93,0.0,0.0,90,Cloudy skies,Full cloud cover,07-10-2015 21:00,2015-10-07,3172.52
0.0,275.58,0.0,0.0,75,Cloudy skies,Fragmented clouds,07-10-2015 22:00,2015-10-07,2441.92
0.0,274.82,0.0,0.0,21,Cloudy skies,Scattered clouds,07-10-2015 23:00,2015-10-07,1673.62
1.0,274.08,0.0,0.0,20,Cloudy skies,Scattered clouds,08-10-2015 0:00,2015-10-08,1018.42
1.0,273.62,0.0,0.0,20,Cloudy skies,Scattered clouds,08-10-2015 1:00,2015-10-08,859.82
1.0,272.68,0.0,0.0,1,Clear skies,Clear skies,08-10-2015 2:00,2015-10-08,763.62
1.0,271.65,0.0,0.0,2,Clear skies,Clear skies,08-10-2015 3:00,2015-10-08,828.62
1.0,271.53,0.0,0.0,1,Clear skies,Clear skies,08-10-2015 4:00,2015-10-08,1442.22
1.0,270.53,0.0,0.0,1,Clear skies,Clear skies,08-10-2015 5:00,2015-10-08,3762.72
1.0,270.61,0.0,0.0,20,Cloudy skies,Scattered clouds,08-10-2015 6:00,2015-10-08,7662.72
1.0,270.11,0.0,0.0,20,Cloudy skies,Scattered clouds,08-10-2015 7:00,2015-10-08,9105.72
1.0,271.93,0.0,0.0,20,Cloudy skies,Scattered clouds,08-10-2015 8:00,2015-10-08,8178.82
1.0,274.21,0.0,0.0,21,Cloudy skies,Scattered clouds,08-10-2015 9:00,2015-10-08,6705.92
1.0,276.97,0.0,0.0,20,Cloudy skies,Scattered clouds,08-10-2015 10:00,2015-10-08,6144.32
1.0,280.27,0.0,0.0,20,Cloudy skies,Scattered clouds,08-10-2015 11:00,2015-10-08,6163.82
1.0,280.14,0.0,0.0,1,Clear skies,Clear skies,08-10-2015 12:00,2015-10-08,6466.72
1.0,282.94,0.0,0.0,40,Cloudy skies,Partly cloudy skies,08-10-2015 13:00,2015-10-08,6410.82
1.0,283.14,0.0,0.0,40,Cloudy skies,Partly cloudy skies,08-10-2015 14:00,2015-10-08,7084.22
1.0,283.88,0.0,0.0,1,Clear skies,Clear skies,08-10-2015 15:00,2015-10-08,7573.02
1.0,284.73,0.0,0.0,1,Clear skies,Clear skies,08-10-2015 16:00,2015-10-08,8199.62
1.0,285.28,0.0,0.0,40,Cloudy skies,Partly cloudy skies,08-10-2015 17:00,2015-10-08,7788.82
1.0,285.03,0.0,0.0,40,Cloudy skies,Partly cloudy skies,08-10-2015 18:00,2015-10-08,5959.72
1.0,282.99,0.0,0.0,20,Cloudy skies,Scattered clouds,08-10-2015 19:00,2015-10-08,4417.92
1.0,280.81,0.0,0.0,2,Clear skies,Clear skies,08-10-2015 20:00,2015-10-08,3515.72
1.0,279.45,0.0,0.0,2,Clear skies,Clear skies,08-10-2015 21:00,2015-10-08,3063.32
1.0,279.0,0.0,0.0,1,Clear skies,Clear skies,08-10-2015 22:00,2015-10-08,2244.32
1.0,279.26,0.0,0.0,2,Clear skies,Clear skies,08-10-2015 23:00,2015-10-08,1613.82
0.0,278.48,0.0,0.0,2,Clear skies,Clear skies,09-10-2015 0:00,2015-10-09,1100.32
0.0,277.87,0.0,0.0,1,Clear skies,Clear skies,09-10-2015 1:00,2015-10-09,818.22
0.0,278.47,0.0,0.0,1,Clear skies,Clear skies,09-10-2015 2:00,2015-10-09,746.72
0.0,277.37,0.0,0.0,21,Cloudy skies,Scattered clouds,09-10-2015 4:00,2015-10-09,1461.72
0.0,277.52,0.0,0.0,40,Cloudy skies,Partly cloudy skies,09-10-2015 5:00,2015-10-09,3904.42
0.0,277.5,0.0,0.0,41,Cloudy skies,Partly cloudy skies,09-10-2015 6:00,2015-10-09,7873.32
0.0,278.31,0.0,0.0,75,Cloudy skies,Fragmented clouds,09-10-2015 7:00,2015-10-09,8813.22
0.0,279.08,0.0,0.0,90,Cloudy skies,Full cloud cover,09-10-2015 8:00,2015-10-09,7914.92
0.0,279.85,0.0,0.0,91,Cloudy skies,Full cloud cover,09-10-2015 9:00,2015-10-09,7706.92
0.0,281.47,0.0,0.0,91,Cloudy skies,Full cloud cover,09-10-2015 10:00,2015-10-09,6322.42
0.0,283.21,0.0,0.0,90,Cloudy skies,Full cloud cover,09-10-2015 11:00,2015-10-09,6523.92
0.0,284.78,0.0,0.0,76,Cloudy skies,Fragmented clouds,09-10-2015 12:00,2015-10-09,7012.72
0.0,285.74,0.0,0.0,76,Cloudy skies,Fragmented clouds,09-10-2015 13:00,2015-10-09,6958.12
0.0,286.65,0.0,0.0,91,Cloudy skies,Full cloud cover,09-10-2015 14:00,2015-10-09,7313.02
0.0,287.93,0.0,0.0,100,Rainfall,Soft rain,09-10-2015 15:00,2015-10-09,7930.52
0.0,289.03,0.0,0.0,90,Cloudy skies,Full cloud cover,09-10-2015 16:00,2015-10-09,8681.92
0.0,290.87,0.0,0.0,90,Cloudy skies,Full cloud cover,09-10-2015 17:00,2015-10-09,8392.02
0.0,290.23,0.0,0.0,90,Cloudy skies,Full cloud cover,09-10-2015 18:00,2015-10-09,6226.22
0.0,289.46,0.0,0.0,75,Cloudy skies,Fragmented clouds,09-10-2015 19:00,2015-10-09,4871.62
0.0,287.96,0.0,0.0,90,Cloudy skies,Full cloud cover,09-10-2015 20:00,2015-10-09,4031.82
0.0,286.11,0.0,0.0,91,Cloudy skies,Full cloud cover,09-10-2015 21:00,2015-10-09,3419.52
0.0,283.56,0.0,0.0,90,Cloudy skies,Full cloud cover,09-10-2015 22:00,2015-10-09,2825.42
0.0,283.45,0.0,0.0,90,Cloudy skies,Full cloud cover,09-10-2015 23:00,2015-10-09,1659.32
0.0,282.08,0.0,0.0,90,Cloudy skies,Full cloud cover,10-10-2015 0:00,2015-10-10,1063.92
0.0,282.28,0.0,0.0,91,Cloudy skies,Full cloud cover,10-10-2015 1:00,2015-10-10,859.82
0.0,281.39,0.0,0.0,75,Cloudy skies,Fragmented clouds,10-10-2015 2:00,2015-10-10,762.32
0.0,282.17,0.0,0.0,90,Cloudy skies,Full cloud cover,10-10-2015 3:00,2015-10-10,894.92
0.0,281.65,0.0,0.0,92,Clear skies,Clear skies,10-10-2015 6:00,2015-10-10,8056.62
0.0,281.65,0.0,0.0,99,Rainfall,Soft rain,10-10-2015 7:00,2015-10-10,9259.12
0.0,281.1,0.0,0.0,99,Rainfall,Soft rain,10-10-2015 8:00,2015-10-10,8594.82
0.0,279.71,0.0,0.0,99,Rainfall,Soft rain,10-10-2015 9:00,2015-10-10,7808.32
0.0,280.17,0.0,0.0,99,Clear skies,Clear skies,10-10-2015 10:00,2015-10-10,6447.22
0.0,280.99,0.0,0.0,2,Clear skies,Clear skies,10-10-2015 11:00,2015-10-10,6780.02
0.0,282.49,0.0,0.0,76,Cloudy skies,Fragmented clouds,10-10-2015 12:00,2015-10-10,6964.62
0.0,283.16,0.0,0.0,75,Cloudy skies,Fragmented clouds,10-10-2015 13:00,2015-10-10,7015.32
0.0,282.65,0.0,0.0,90,Cloudy skies,Full cloud cover,10-10-2015 14:00,2015-10-10,7220.72
0.0,282.29,0.0,0.0,90,Cloudy skies,Full cloud cover,10-10-2015 15:00,2015-10-10,7722.52
0.0,282.03,0.0,0.0,82,Clear skies,Clear skies,10-10-2015 16:00,2015-10-10,8602.62
0.0,283.3,0.0,0.0,81,Clear skies,Clear skies,10-10-2015 18:00,2015-10-10,6633.12
0.0,282.7,0.0,0.0,81,Clear skies,Clear skies,10-10-2015 19:00,2015-10-10,4770.22
0.0,282.7,0.0,0.0,81,Clear skies,Clear skies,10-10-2015 20:00,2015-10-10,4338.62
0.0,283.6,0.0,0.0,81,Clear skies,Clear skies,10-10-2015 21:00,2015-10-10,3808.22
0.0,283.6,0.0,0.0,81,Clear skies,Clear skies,10-10-2015 22:00,2015-10-10,2913.82
0.0,282.7,0.0,0.0,82,Clear skies,Clear skies,10-10-2015 23:00,2015-10-10,1771.12
0.0,274.2,0.0,0.0,1,Clear skies,Clear skies,11-10-2015 1:00,2015-10-11,872.82
0.0,275.0,0.0,0.0,76,Cloudy skies,Fragmented clouds,11-10-2015 3:00,2015-10-11,884.52
0.0,274.95,0.0,0.0,76,Cloudy skies,Fragmented clouds,11-10-2015 4:00,2015-10-11,1524.12
0.0,274.11,0.0,0.0,40,Cloudy skies,Partly cloudy skies,11-10-2015 5:00,2015-10-11,4052.62
0.0,273.56,0.0,0.0,1,Clear skies,Clear skies,11-10-2015 6:00,2015-10-11,7973.42
0.0,273.65,0.0,0.0,2,Clear skies,Clear skies,11-10-2015 7:00,2015-10-11,9266.92
0.0,272.72,0.0,0.0,2,Clear skies,Clear skies,11-10-2015 8:00,2015-10-11,8622.12
0.0,276.19,0.0,0.0,20,Cloudy skies,Scattered clouds,11-10-2015 9:00,2015-10-11,7309.12
0.0,275.64,0.0,0.0,2,Clear skies,Clear skies,11-10-2015 10:00,2015-10-11,6448.52
0.0,284.2,0.0,0.0,51,Clear skies,Clear skies,11-10-2015 14:00,2015-10-11,7643.22
0.0,284.8,0.0,0.0,50,Clear skies,Clear skies,11-10-2015 15:00,2015-10-11,7986.42
0.0,283.98,0.0,0.0,75,Cloudy skies,Fragmented clouds,11-10-2015 16:00,2015-10-11,8574.02
0.0,283.62,0.0,0.0,75,Cloudy skies,Fragmented clouds,11-10-2015 17:00,2015-10-11,8151.52
0.0,284.32,0.0,0.0,90,Cloudy skies,Full cloud cover,11-10-2015 18:00,2015-10-11,6860.62
0.0,282.26,0.0,0.0,90,Cloudy skies,Full cloud cover,11-10-2015 19:00,2015-10-11,4984.72
0.0,282.15,0.0,0.0,90,Cloudy skies,Full cloud cover,11-10-2015 20:00,2015-10-11,4377.62
0.0,282.01,0.0,0.0,90,Cloudy skies,Full cloud cover,11-10-2015 21:00,2015-10-11,3908.32
0.0,282.46,0.0,0.0,90,Cloudy skies,Full cloud cover,11-10-2015 22:00,2015-10-11,3141.32
0.0,283.43,0.0,0.0,90,Cloudy skies,Full cloud cover,11-10-2015 23:00,2015-10-11,2094.82
0.0,284.81,0.0,0.0,90,Cloudy skies,Full cloud cover,12-10-2015 0:00,2015-10-12,1244.62
0.0,284.84,0.0,0.0,91,Cloudy skies,Full cloud cover,12-10-2015 1:00,2015-10-12,963.82
0.0,285.11,0.0,0.0,90,Cloudy skies,Full cloud cover,12-10-2015 2:00,2015-10-12,855.92
0.0,283.98,0.0,0.0,72,Light rain,Mild drizzle,12-10-2015 3:00,2015-10-12,911.82
0.0,283.16,0.0,0.0,72,Rainfall,Soft rain,12-10-2015 4:00,2015-10-12,1382.42
0.0,281.17,0.0,0.0,72,Light rain,Mild drizzle,12-10-2015 5:00,2015-10-12,3757.52
0.0,278.83,0.0,0.0,75,Cloudy skies,Fragmented clouds,12-10-2015 6:00,2015-10-12,7682.22
0.0,278.34,0.0,0.0,76,Cloudy skies,Fragmented clouds,12-10-2015 7:00,2015-10-12,9515.22
0.0,278.7,0.0,0.0,90,Cloudy skies,Full cloud cover,12-10-2015 8:00,2015-10-12,8042.32
0.0,278.28,0.0,0.0,91,Cloudy skies,Full cloud cover,12-10-2015 9:00,2015-10-12,7220.72
0.0,279.79,0.0,0.0,75,Cloudy skies,Fragmented clouds,12-10-2015 10:00,2015-10-12,6746.22
0.0,280.55,0.0,0.0,75,Cloudy skies,Fragmented clouds,12-10-2015 11:00,2015-10-12,7115.42
0.0,281.35,0.0,0.0,40,Cloudy skies,Partly cloudy skies,12-10-2015 12:00,2015-10-12,7605.52
0.0,282.34,0.0,0.0,40,Cloudy skies,Partly cloudy skies,12-10-2015 13:00,2015-10-12,7417.02
0.0,281.94,0.0,0.0,75,Cloudy skies,Fragmented clouds,12-10-2015 14:00,2015-10-12,7912.32
0.0,282.55,0.0,0.0,76,Cloudy skies,Fragmented clouds,12-10-2015 15:00,2015-10-12,8074.82
0.0,282.3,0.0,0.0,76,Cloudy skies,Fragmented clouds,12-10-2015 16:00,2015-10-12,8297.12
0.0,281.74,0.0,0.0,41,Cloudy skies,Partly cloudy skies,12-10-2015 17:00,2015-10-12,8263.32
0.0,280.71,0.0,0.0,20,Cloudy skies,Scattered clouds,12-10-2015 18:00,2015-10-12,7263.62
0.0,283.1,0.0,0.0,56,Clear skies,Clear skies,12-10-2015 23:00,2015-10-12,2895.62
0.0,272.68,0.0,0.0,1,Clear skies,Clear skies,13-10-2015 00:00,2015-10-13,2159.82
0.0,272.76,0.0,0.0,1,Clear skies,Clear skies,13-10-2015 01:00,2015-10-13,1424.02
0.0,271.99,0.0,0.0,1,Clear skies,Clear skies,13-10-2015 02:00,2015-10-13,1166.62
0.0,271.29,0.0,0.0,21,Cloudy skies,Scattered clouds,13-10-2015 03:00,2015-10-13,962.52
0.0,270.28,0.0,0.0,1,Clear skies,Clear skies,13-10-2015 04:00,2015-10-13,941.72
0.0,269.37,0.0,0.0,1,Clear skies,Clear skies,13-10-2015 05:00,2015-10-13,1381.12
0.0,269.71,0.0,0.0,1,Clear skies,Clear skies,13-10-2015 06:00,2015-10-13,2270.32
0.0,269.18,0.0,0.0,75,Cloudy skies,Fragmented clouds,13-10-2015 07:00,2015-10-13,3309.02
0.0,269.43,0.0,0.0,40,Cloudy skies,Partly cloudy skies,13-10-2015 08:00,2015-10-13,4952.22
0.0,273.31,0.0,0.0,40,Cloudy skies,Partly cloudy skies,13-10-2015 09:00,2015-10-13,6328.92
0.0,277.18,0.0,0.0,21,Cloudy skies,Scattered clouds,13-10-2015 10:00,2015-10-13,6374.42
0.0,279.72,0.0,0.0,1,Clear skies,Clear skies,13-10-2015 11:00,2015-10-13,6192.42
0.0,281.35,0.0,0.0,1,Clear skies,Clear skies,13-10-2015 12:00,2015-10-13,6439.42
0.0,282.11,0.0,0.0,1,Clear skies,Clear skies,13-10-2015 13:00,2015-10-13,6201.52
0.0,283.95,0.0,0.0,1,Clear skies,Clear skies,13-10-2015 14:00,2015-10-13,6270.42
0.0,284.56,0.0,0.0,1,Clear skies,Clear skies,13-10-2015 15:00,2015-10-13,6249.62
0.0,284.93,0.0,0.0,1,Clear skies,Clear skies,13-10-2015 16:00,2015-10-13,6397.82
0.0,284.94,0.0,0.0,1,Clear skies,Clear skies,13-10-2015 17:00,2015-10-13,6245.72
0.0,283.74,0.0,0.0,2,Clear skies,Clear skies,13-10-2015 18:00,2015-10-13,5918.12
0.0,282.65,0.0,0.0,20,Cloudy skies,Scattered clouds,13-10-2015 19:00,2015-10-13,5194.02
0.0,282.28,0.0,0.0,2,Clear skies,Clear skies,13-10-2015 20:00,2015-10-13,4350.32
0.0,282.44,0.0,0.0,75,Cloudy skies,Fragmented clouds,13-10-2015 21:00,2015-10-13,4026.62
0.0,282.73,0.0,0.0,90,Cloudy skies,Full cloud cover,13-10-2015 22:00,2015-10-13,4165.72
0.0,283.08,0.0,0.0,90,Cloudy skies,Full cloud cover,13-10-2015 23:00,2015-10-13,2937.22
0.0,283.29,0.0,0.0,90,Cloudy skies,Full cloud cover,14-10-2015 00:00,2015-10-14,2129.92
0.0,283.04,0.0,0.0,90,Cloudy skies,Full cloud cover,14-10-2015 01:00,2015-10-14,1560.52
0.0,283.28,0.0,0.0,90,Cloudy skies,Full cloud cover,14-10-2015 02:00,2015-10-14,1271.92
0.0,282.33,0.0,0.0,90,Cloudy skies,Full cloud cover,14-10-2015 03:00,2015-10-14,896.22
0.0,283.08,0.0,0.0,90,Cloudy skies,Full cloud cover,14-10-2015 04:00,2015-10-14,770.12
0.0,283.03,0.0,0.0,90,Cloudy skies,Full cloud cover,14-10-2015 05:00,2015-10-14,1083.42
0.0,283.04,0.0,0.0,90,Cloudy skies,Full cloud cover,14-10-2015 06:00,2015-10-14,1543.62
0.0,282.54,0.0,0.0,90,Cloudy skies,Full cloud cover,14-10-2015 07:00,2015-10-14,1902.42
0.0,282.74,0.0,0.0,58,Light fog,Fine fog,14-10-2015 08:00,2015-10-14,2755.22
0.0,282.93,0.0,0.0,57,Light rain,Mild drizzle,14-10-2015 09:00,2015-10-14,3917.42
0.0,282.93,0.0,0.0,58,Light rain,Mild drizzle,14-10-2015 10:00,2015-10-14,4804.02
0.0,283.12,0.0,0.0,58,Light rain,Mild drizzle,14-10-2015 11:00,2015-10-14,5179.72
0.0,284.33,0.0,0.0,58,Light fog,Fine fog,14-10-2015 12:00,2015-10-14,5717.92
0.0,284.05,0.0,0.0,93,Rainfall,Soft rain,14-10-2015 13:00,2015-10-14,5794.62
0.0,284.99,0.0,0.0,93,Light fog,Fine fog,14-10-2015 14:00,2015-10-14,6092.32
0.0,285.55,0.0,0.0,93,Light fog,Fine fog,14-10-2015 15:00,2015-10-14,6074.12
0.0,284.98,0.0,0.0,93,Light fog,Fine fog,14-10-2015 16:00,2015-10-14,5931.12
0.0,284.74,0.0,0.0,93,Rainfall,Soft rain,14-10-2015 17:00,2015-10-14,5977.92
0.0,285.2,0.0,0.0,93,Light fog,Fine fog,14-10-2015 18:00,2015-10-14,5730.92
0.0,284.27,0.0,0.0,93,Light fog,Fine fog,14-10-2015 19:00,2015-10-14,4917.12
0.0,284.43,0.0,0.0,93,Light fog,Fine fog,14-10-2015 20:00,2015-10-14,3964.22
0.0,284.38,0.0,0.0,93,Light fog,Fine fog,14-10-2015 21:00,2015-10-14,3600.22
0.0,283.84,0.0,0.0,94,Light fog,Fine fog,14-10-2015 22:00,2015-10-14,2785.12
0.0,282.35,0.0,0.0,93,Light fog,Fine fog,14-10-2015 23:00,2015-10-14,1728.22
0.0,282.11,0.0,0.0,93,Light fog,Fine fog,15-10-2015 00:00,2015-10-15,1135.42
0.0,282.07,0.0,0.0,85,Dense fog,Dense fog,15-10-2015 01:00,2015-10-15,823.42
0.0,282.32,0.0,0.0,85,Dense fog,Dense fog,15-10-2015 02:00,2015-10-15,736.32
0.0,281.99,0.0,0.0,85,Light fog,Fine fog,15-10-2015 03:00,2015-10-15,862.42
0.0,281.22,0.0,0.0,85,Light fog,Fine fog,15-10-2015 04:00,2015-10-15,1476.02
0.0,281.62,0.0,0.0,85,Light fog,Fine fog,15-10-2015 05:00,2015-10-15,3816.02
0.0,281.09,0.0,0.0,85,Light fog,Fine fog,15-10-2015 06:00,2015-10-15,7851.22
0.0,280.99,0.0,0.0,100,Light fog,Fine fog,15-10-2015 07:00,2015-10-15,9265.62
0.0,280.02,0.0,0.0,100,Light fog,Fine fog,15-10-2015 08:00,2015-10-15,8367.32
0.0,280.55,0.0,0.0,100,Light fog,Fine fog,15-10-2015 09:00,2015-10-15,7041.32
0.0,280.77,0.0,0.0,101,Light fog,Fine fog,15-10-2015 10:00,2015-10-15,6236.62
0.0,280.42,0.0,0.0,90,Cloudy skies,Full cloud cover,15-10-2015 11:00,2015-10-15,6312.02
0.0,282.12,0.0,0.0,100,Clear skies,Clear skies,15-10-2015 12:00,2015-10-15,6691.62
0.0,284.91,0.0,0.0,40,Cloudy skies,Partly cloudy skies,15-10-2015 13:00,2015-10-15,6755.32
0.0,286.58,0.0,0.0,2,Clear skies,Clear skies,15-10-2015 14:00,2015-10-15,7229.82
0.0,287.27,0.0,0.0,1,Clear skies,Clear skies,15-10-2015 15:00,2015-10-15,7678.32
0.0,288.3,0.0,0.0,21,Cloudy skies,Scattered clouds,15-10-2015 16:00,2015-10-15,8542.82
0.0,287.77,0.0,0.0,20,Cloudy skies,Scattered clouds,15-10-2015 17:00,2015-10-15,8168.42
0.0,287.18,0.0,0.0,20,Cloudy skies,Scattered clouds,15-10-2015 18:00,2015-10-15,6315.92
0.0,286.1,0.0,0.0,75,Cloudy skies,Fragmented clouds,15-10-2015 19:00,2015-10-15,4629.82
0.0,285.18,0.0,0.0,75,Cloudy skies,Fragmented clouds,15-10-2015 20:00,2015-10-15,3905.72
0.0,285.49,0.0,0.0,90,Cloudy skies,Full cloud cover,15-10-2015 21:00,2015-10-15,3120.52
0.0,284.14,0.0,0.0,20,Cloudy skies,Scattered clouds,15-10-2015 22:00,2015-10-15,2214.42
0.0,282.83,0.0,0.0,75,Cloudy skies,Fragmented clouds,15-10-2015 23:00,2015-10-15,1632.02
0.0,281.41,0.0,0.0,20,Cloudy skies,Scattered clouds,16-10-2015 00:00,2015-10-16,1080.82
0.0,280.07,0.0,0.0,2,Clear skies,Clear skies,16-10-2015 01:00,2015-10-16,844.22
0.0,279.93,0.0,0.0,2,Clear skies,Clear skies,16-10-2015 02:00,2015-10-16,759.72
0.0,278.81,0.0,0.0,1,Clear skies,Clear skies,16-10-2015 03:00,2015-10-16,888.42
0.0,277.41,0.0,0.0,1,Clear skies,Clear skies,16-10-2015 04:00,2015-10-16,1420.12
0.0,277.51,0.0,0.0,1,Clear skies,Clear skies,16-10-2015 05:00,2015-10-16,4026.62
0.0,276.91,0.0,0.0,1,Clear skies,Clear skies,16-10-2015 06:00,2015-10-16,7944.82
0.0,275.31,0.0,0.0,21,Cloudy skies,Scattered clouds,16-10-2015 07:00,2015-10-16,9595.82
0.0,275.49,0.0,0.0,21,Cloudy skies,Scattered clouds,16-10-2015 08:00,2015-10-16,8750.82
0.0,278.91,0.0,0.0,20,Cloudy skies,Scattered clouds,16-10-2015 09:00,2015-10-16,7254.52
0.0,281.71,0.0,0.0,21,Cloudy skies,Scattered clouds,16-10-2015 10:00,2015-10-16,6331.52
0.0,284.35,0.0,0.0,20,Cloudy skies,Scattered clouds,16-10-2015 11:00,2015-10-16,6644.82
0.0,286.51,0.0,0.0,40,Cloudy skies,Partly cloudy skies,16-10-2015 12:00,2015-10-16,6938.62
0.0,287.21,0.0,0.0,1,Clear skies,Clear skies,16-10-2015 13:00,2015-10-16,7004.92
0.0,288.85,0.0,0.0,76,Cloudy skies,Fragmented clouds,16-10-2015 14:00,2015-10-16,7489.82
0.0,289.35,0.0,0.0,75,Cloudy skies,Fragmented clouds,16-10-2015 15:00,2015-10-16,7977.32
0.0,289.19,0.0,0.0,75,Cloudy skies,Fragmented clouds,16-10-2015 16:00,2015-10-16,8875.62
0.0,289.36,0.0,0.0,75,Cloudy skies,Fragmented clouds,16-10-2015 17:00,2015-10-16,8788.52
0.0,288.26,0.0,0.0,91,Cloudy skies,Full cloud cover,16-10-2015 18:00,2015-10-16,7103.72
0.0,287.58,0.0,0.0,68,Rainfall,Soft rain,16-10-2015 19:00,2015-10-16,4726.02
0.0,287.44,0.0,0.0,90,Cloudy skies,Full cloud cover,16-10-2015 20:00,2015-10-16,4040.92
0.0,287.3,0.0,0.0,90,Cloudy skies,Full cloud cover,16-10-2015 21:00,2015-10-16,3461.12
0.0,287.69,0.0,0.0,90,Cloudy skies,Full cloud cover,16-10-2015 22:00,2015-10-16,2718.82
0.0,287.39,0.0,0.0,90,Cloudy skies,Full cloud cover,16-10-2015 23:00,2015-10-16,1846.52
0.0,287.29,0.0,0.0,75,Cloudy skies,Fragmented clouds,17-10-2015 00:00,2015-10-17,1140.62
0.0,287.33,0.0,0.0,76,Cloudy skies,Fragmented clouds,17-10-2015 01:00,2015-10-17,861.12
0.0,287.03,0.0,0.0,90,Cloudy skies,Full cloud cover,17-10-2015 02:00,2015-10-17,772.72
0.0,287.87,0.0,0.0,90,Cloudy skies,Full cloud cover,17-10-2015 03:00,2015-10-17,887.12
0.0,287.56,0.0,0.0,75,Cloudy skies,Fragmented clouds,17-10-2015 04:00,2015-10-17,1434.42
0.0,286.41,0.0,0.0,90,Cloudy skies,Full cloud cover,17-10-2015 05:00,2015-10-17,3978.52
0.0,285.39,0.0,0.0,90,Cloudy skies,Full cloud cover,17-10-2015 06:00,2015-10-17,7755.02
0.0,285.42,0.0,0.0,76,Cloudy skies,Fragmented clouds,17-10-2015 07:00,2015-10-17,7654.92
0.0,285.85,0.0,0.0,75,Cloudy skies,Fragmented clouds,17-10-2015 08:00,2015-10-17,8583.12
0.0,286.42,0.0,0.0,101,Rainfall,Nearby rain showers,17-10-2015 09:00,2015-10-17,7443.02
0.0,287.19,0.0,0.0,76,Cloudy skies,Fragmented clouds,17-10-2015 10:00,2015-10-17,6503.12
0.0,289.01,0.0,0.0,75,Cloudy skies,Fragmented clouds,17-10-2015 11:00,2015-10-17,6465.42
0.0,289.11,0.0,0.0,1,Clear skies,Clear skies,17-10-2015 12:00,2015-10-17,6897.02
0.0,291.32,0.0,0.0,1,Clear skies,Clear skies,17-10-2015 13:00,2015-10-17,6726.72
0.0,292.26,0.0,0.0,1,Clear skies,Clear skies,17-10-2015 14:00,2015-10-17,5997.42
0.0,293.01,0.0,0.0,2,Clear skies,Clear skies,17-10-2015 15:00,2015-10-17,6549.92
0.0,292.81,0.0,0.0,1,Clear skies,Clear skies,17-10-2015 16:00,2015-10-17,9169.42
0.0,293.35,0.0,0.0,2,Clear skies,Clear skies,17-10-2015 17:00,2015-10-17,8464.82
0.0,291.12,0.0,0.0,40,Cloudy skies,Partly cloudy skies,17-10-2015 18:00,2015-10-17,6715.02
0.0,288.85,0.0,0.0,40,Cloudy skies,Partly cloudy skies,17-10-2015 19:00,2015-10-17,4887.22
0.0,287.32,0.0,0.0,41,Cloudy skies,Partly cloudy skies,17-10-2015 20:00,2015-10-17,4228.12
0.0,286.19,0.0,0.0,41,Cloudy skies,Partly cloudy skies,17-10-2015 21:00,2015-10-17,4022.72
0.0,284.72,0.0,0.0,20,Cloudy skies,Scattered clouds,17-10-2015 22:00,2015-10-17,2932.02
0.0,284.1,0.0,0.0,20,Cloudy skies,Scattered clouds,17-10-2015 23:00,2015-10-17,1929.72
0.0,284.42,0.0,0.0,20,Cloudy skies,Scattered clouds,18-10-2015 00:00,2015-10-18,1273.22
0.0,283.6,0.0,0.0,40,Cloudy skies,Partly cloudy skies,18-10-2015 01:00,2015-10-18,905.32
0.0,283.32,0.0,0.0,99,Light fog,Fine fog,18-10-2015 02:00,2015-10-18,818.22
0.0,282.98,0.0,0.0,99,Light fog,Fine fog,18-10-2015 03:00,2015-10-18,945.62
0.0,283.46,0.0,0.0,90,Cloudy skies,Full cloud cover,18-10-2015 04:00,2015-10-18,1459.12
0.0,283.48,0.0,0.0,99,Light fog,Fine fog,18-10-2015 05:00,2015-10-18,3760.12
0.0,285.08,0.0,0.0,75,Cloudy skies,Fragmented clouds,18-10-2015 06:00,2015-10-18,7385.82
0.0,285.19,0.0,0.0,91,Cloudy skies,Full cloud cover,18-10-2015 07:00,2015-10-18,8792.42
0.0,285.5,0.0,0.0,90,Cloudy skies,Full cloud cover,18-10-2015 08:00,2015-10-18,7621.12
0.0,287.7,0.0,0.0,100,Rainfall,Soft rain,18-10-2015 09:00,2015-10-18,7257.12
0.0,288.95,0.0,0.0,90,Cloudy skies,Full cloud cover,18-10-2015 10:00,2015-10-18,6431.62
0.0,290.19,0.0,0.0,91,Cloudy skies,Full cloud cover,18-10-2015 11:00,2015-10-18,7062.12
0.0,288.87,0.0,0.0,100,Rainfall,Soft rain,18-10-2015 12:00,2015-10-18,7120.62
0.0,286.81,0.0,0.0,91,Cloudy skies,Full cloud cover,18-10-2015 13:00,2015-10-18,7296.12
0.0,286.46,0.0,0.0,90,Cloudy skies,Full cloud cover,18-10-2015 14:00,2015-10-18,7838.22
0.0,287.74,0.0,0.0,90,Cloudy skies,Full cloud cover,18-10-2015 15:00,2015-10-18,8072.22
0.0,288.18,0.0,0.0,90,Cloudy skies,Full cloud cover,18-10-2015 16:00,2015-10-18,8619.52
0.0,287.64,0.0,0.0,90,Cloudy skies,Full cloud cover,18-10-2015 17:00,2015-10-18,8169.72
0.0,286.51,0.0,0.0,90,Cloudy skies,Full cloud cover,18-10-2015 18:00,2015-10-18,6301.62
0.0,285.47,0.0,0.0,100,Light rain,Mild drizzle,18-10-2015 19:00,2015-10-18,4883.32
0.0,283.64,0.0,0.0,100,Rainfall,Soft rain,18-10-2015 20:00,2015-10-18,4226.82
0.0,283.11,0.0,0.0,100,Light rain,Mild drizzle,18-10-2015 21:00,2015-10-18,3864.12
0.0,282.5,0.0,0.0,91,Cloudy skies,Full cloud cover,18-10-2015 22:00,2015-10-18,3033.42
0.0,282.65,0.0,0.0,91,Cloudy skies,Full cloud cover,18-10-2015 23:00,2015-10-18,1955.72
0.0,281.38,0.0,0.0,91,Cloudy skies,Full cloud cover,19-10-2015 00:00,2015-10-19,1336.92
0.0,281.57,0.0,0.0,88,Light fog,Fine fog,19-10-2015 01:00,2015-10-19,996.32
0.0,280.84,0.0,0.0,87,Light rain,Mild drizzle,19-10-2015 02:00,2015-10-19,887.12
0.0,280.82,0.0,0.0,87,Light fog,Fine fog,19-10-2015 03:00,2015-10-19,937.82
0.0,280.79,0.0,0.0,87,Light rain,Mild drizzle,19-10-2015 04:00,2015-10-19,1364.22
0.0,279.84,0.0,0.0,88,Light fog,Fine fog,19-10-2015 05:00,2015-10-19,3507.92
0.0,280.05,0.0,0.0,87,Light rain,Mild drizzle,19-10-2015 06:00,2015-10-19,7136.22
0.0,279.65,0.0,0.0,92,Light fog,Fine fog,19-10-2015 07:00,2015-10-19,7938.32
0.0,280.22,0.0,0.0,91,Light rain,Mild drizzle,19-10-2015 08:00,2015-10-19,7228.52
0.0,280.25,0.0,0.0,91,Rainfall,Soft rain,19-10-2015 09:00,2015-10-19,6409.52
0.0,280.32,0.0,0.0,91,Light fog,Fine fog,19-10-2015 10:00,2015-10-19,6048.12
0.0,280.54,0.0,0.0,91,Cloudy skies,Full cloud cover,19-10-2015 11:00,2015-10-19,5992.22
0.0,281.5,0.0,0.0,90,Cloudy skies,Full cloud cover,19-10-2015 12:00,2015-10-19,6262.62
0.0,281.91,0.0,0.0,90,Cloudy skies,Full cloud cover,19-10-2015 13:00,2015-10-19,6803.42
0.0,282.23,0.0,0.0,92,Light fog,Fine fog,19-10-2015 14:00,2015-10-19,7731.62
0.0,282.84,0.0,0.0,92,Light fog,Fine fog,19-10-2015 15:00,2015-10-19,8024.12
0.0,283.17,0.0,0.0,93,Rainfall,Steady rain,19-10-2015 16:00,2015-10-19,6854.12
0.0,282.91,0.0,0.0,92,Rainfall,Soft rain,19-10-2015 17:00,2015-10-19,6425.12
0.0,283.11,0.0,0.0,90,Cloudy skies,Full cloud cover,19-10-2015 18:00,2015-10-19,6243.12
0.0,282.29,0.0,0.0,75,Cloudy skies,Fragmented clouds,19-10-2015 19:00,2015-10-19,5369.52
0.0,281.56,0.0,0.0,91,Cloudy skies,Full cloud cover,19-10-2015 20:00,2015-10-19,4204.72
0.0,280.96,0.0,0.0,92,Light fog,Fine fog,19-10-2015 21:00,2015-10-19,4246.32
0.0,280.83,0.0,0.0,92,Light rain,Light rain,19-10-2015 22:00,2015-10-19,4428.32
0.0,280.4,0.0,0.0,92,Light fog,Fine fog,19-10-2015 23:00,2015-10-19,3088.02
0.0,280.56,0.0,0.0,93,Rainfall,Soft rain,20-10-2015 00:00,2015-10-20,2079.22
0.0,281.18,0.0,0.0,96,Light rain,Light rain,20-10-2015 01:00,2015-10-20,1427.92
0.0,281.38,0.0,0.0,96,Light rain,Mild drizzle,20-10-2015 02:00,2015-10-20,1190.02
0.0,280.72,0.0,0.0,96,Light rain,Mild drizzle,20-10-2015 03:00,2015-10-20,991.12
0.0,281.01,0.0,0.0,96,Light fog,Fine fog,20-10-2015 04:00,2015-10-20,941.72
0.0,281.86,0.0,0.0,96,Rainfall,Soft rain,20-10-2015 05:00,2015-10-20,1407.12
0.0,281.53,0.0,0.0,96,Rainfall,Soft rain,20-10-2015 06:00,2015-10-20,2132.52
0.0,281.68,0.0,0.0,100,Rainfall,Soft rain,20-10-2015 07:00,2015-10-20,2798.12
0.0,281.49,0.0,0.0,100,Rainfall,Soft rain,20-10-2015 08:00,2015-10-20,4044.82
0.0,282.1,0.0,0.0,100,Rainfall,Soft rain,20-10-2015 09:00,2015-10-20,5252.52
0.0,282.52,0.0,0.0,100,Rainfall,Soft rain,20-10-2015 10:00,2015-10-20,5390.32
0.0,282.85,0.0,0.0,101,Rainfall,Soft rain,20-10-2015 11:00,2015-10-20,6068.92
0.0,283.31,0.0,0.0,100,Rainfall,Intense rainfall,20-10-2015 12:00,2015-10-20,6416.02
0.0,283.91,0.0,0.0,48,Rainfall,Soft rain,20-10-2015 13:00,2015-10-20,6283.42
0.0,284.39,0.0,0.0,90,Cloudy skies,Full cloud cover,20-10-2015 14:00,2015-10-20,6210.62
0.0,284.3,0.0,0.0,75,Cloudy skies,Fragmented clouds,20-10-2015 15:00,2015-10-20,6456.32
0.0,285.12,0.0,0.0,90,Cloudy skies,Full cloud cover,20-10-2015 16:00,2015-10-20,6682.52
0.0,284.23,0.0,0.0,75,Cloudy skies,Fragmented clouds,20-10-2015 17:00,2015-10-20,7093.32
0.0,283.24,0.0,0.0,40,Cloudy skies,Partly cloudy skies,20-10-2015 18:00,2015-10-20,6063.72
0.0,281.9,0.0,0.0,41,Cloudy skies,Partly cloudy skies,20-10-2015 19:00,2015-10-20,5161.52
0.0,280.67,0.0,0.0,20,Cloudy skies,Scattered clouds,20-10-2015 20:00,2015-10-20,4469.92
0.0,279.92,0.0,0.0,20,Cloudy skies,Scattered clouds,20-10-2015 21:00,2015-10-20,4238.52
0.0,279.45,0.0,0.0,49,Light fog,Fine fog,20-10-2015 22:00,2015-10-20,4148.82
0.0,278.92,0.0,0.0,48,Dense fog,Dense fog,20-10-2015 23:00,2015-10-20,3466.32
0.0,278.64,0.0,0.0,48,Light fog,Fine fog,21-10-2015 00:00,2015-10-21,2214.42
0.0,276.63,0.0,0.0,60,Dense fog,Dense fog,21-10-2015 08:00,2015-10-21,2926.82
0.0,284.79,0.0,0.0,75,Cloudy skies,Fragmented clouds,21-10-2015 17:00,2015-10-21,6525.22
0.0,283.1,0.0,0.0,75,Cloudy skies,Fragmented clouds,21-10-2015 18:00,2015-10-21,6059.82
0.0,281.92,0.0,0.0,91,Cloudy skies,Full cloud cover,21-10-2015 22:00,2015-10-21,2484.82
0.0,282.26,0.0,0.0,90,Cloudy skies,Full cloud cover,21-10-2015 23:00,2015-10-21,1668.42
0.0,281.89,0.0,0.0,75,Cloudy skies,Fragmented clouds,22-10-2015 00:00,2015-10-22,1066.52
0.0,281.51,0.0,0.0,76,Cloudy skies,Fragmented clouds,22-10-2015 01:00,2015-10-22,822.12
0.0,281.07,0.0,0.0,40,Cloudy skies,Partly cloudy skies,22-10-2015 02:00,2015-10-22,766.22
0.0,281.44,0.0,0.0,76,Cloudy skies,Fragmented clouds,22-10-2015 03:00,2015-10-22,848.12
0.0,280.17,0.0,0.0,8,Light fog,Fine fog,22-10-2015 04:00,2015-10-22,1468.22
0.0,279.28,0.0,0.0,8,Light fog,Fine fog,22-10-2015 05:00,2015-10-22,3827.72
0.0,280.05,0.0,0.0,8,Light fog,Fine fog,22-10-2015 06:00,2015-10-22,7515.82
0.0,282.9,0.0,0.0,38,Clear skies,Clear skies,22-10-2015 10:00,2015-10-22,6041.62
0.0,286.47,0.0,0.0,40,Cloudy skies,Partly cloudy skies,22-10-2015 11:00,2015-10-22,6110.52
0.0,289.41,0.0,0.0,75,Cloudy skies,Fragmented clouds,22-10-2015 12:00,2015-10-22,6456.32
0.0,291.29,0.0,0.0,21,Cloudy skies,Scattered clouds,22-10-2015 13:00,2015-10-22,6338.02
0.0,292.31,0.0,0.0,75,Cloudy skies,Fragmented clouds,22-10-2015 14:00,2015-10-22,6933.42
0.0,294.56,0.0,0.0,75,Cloudy skies,Fragmented clouds,22-10-2015 15:00,2015-10-22,7392.32
0.0,294.33,0.0,0.0,41,Cloudy skies,Partly cloudy skies,22-10-2015 16:00,2015-10-22,8359.52
0.0,293.6,0.0,0.0,40,Cloudy skies,Partly cloudy skies,22-10-2015 17:00,2015-10-22,7935.72
0.0,291.97,0.0,0.0,20,Cloudy skies,Scattered clouds,22-10-2015 18:00,2015-10-22,5974.02
0.0,289.37,0.0,0.0,20,Cloudy skies,Scattered clouds,22-10-2015 19:00,2015-10-22,4445.22
0.0,287.48,0.0,0.0,2,Clear skies,Clear skies,22-10-2015 20:00,2015-10-22,3592.42
0.0,286.2,0.0,0.0,1,Clear skies,Clear skies,22-10-2015 21:00,2015-10-22,2998.32
0.0,285.85,0.0,0.0,75,Cloudy skies,Fragmented clouds,22-10-2015 22:00,2015-10-22,2219.62
0.0,286.13,0.0,0.0,90,Cloudy skies,Full cloud cover,22-10-2015 23:00,2015-10-22,1672.32
0.0,285.77,0.0,0.0,90,Cloudy skies,Full cloud cover,23-10-2015 00:00,2015-10-23,1092.52
0.0,285.38,0.0,0.0,90,Cloudy skies,Full cloud cover,23-10-2015 01:00,2015-10-23,872.82
0.0,284.28,0.0,0.0,75,Cloudy skies,Fragmented clouds,23-10-2015 02:00,2015-10-23,751.92
0.0,284.45,0.0,0.0,75,Cloudy skies,Fragmented clouds,23-10-2015 03:00,2015-10-23,875.42
0.0,283.35,0.0,0.0,20,Cloudy skies,Scattered clouds,23-10-2015 04:00,2015-10-23,1478.62
0.0,282.52,0.0,0.0,20,Cloudy skies,Scattered clouds,23-10-2015 05:00,2015-10-23,3890.12
0.0,282.53,0.0,0.0,75,Cloudy skies,Fragmented clouds,23-10-2015 06:00,2015-10-23,7193.42
0.0,282.85,0.0,0.0,40,Cloudy skies,Partly cloudy skies,23-10-2015 07:00,2015-10-23,8330.92
0.0,281.95,0.0,0.0,20,Cloudy skies,Scattered clouds,23-10-2015 08:00,2015-10-23,7950.02
0.0,283.17,0.0,0.0,75,Cloudy skies,Fragmented clouds,23-10-2015 09:00,2015-10-23,7557.42
0.0,285.13,0.0,0.0,90,Cloudy skies,Full cloud cover,23-10-2015 10:00,2015-10-23,6154.72
0.0,286.1,0.0,0.0,76,Cloudy skies,Fragmented clouds,23-10-2015 11:00,2015-10-23,6565.52
0.0,287.53,0.0,0.0,90,Cloudy skies,Full cloud cover,23-10-2015 12:00,2015-10-23,6695.52
0.0,287.45,0.0,0.0,99,Rainfall,Steady rain,23-10-2015 13:00,2015-10-23,6856.72
0.0,288.17,0.0,0.0,90,Cloudy skies,Full cloud cover,23-10-2015 14:00,2015-10-23,7010.12
0.0,288.94,0.0,0.0,99,Stormy weather,Approaching thunderstorm,23-10-2015 15:00,2015-10-23,7730.32
0.0,289.22,0.0,0.0,90,Cloudy skies,Full cloud cover,23-10-2015 16:00,2015-10-23,8349.12
0.0,289.33,0.0,0.0,91,Cloudy skies,Full cloud cover,23-10-2015 17:00,2015-10-23,8021.52
0.0,289.16,0.0,0.0,91,Cloudy skies,Full cloud cover,23-10-2015 18:00,2015-10-23,6474.52
0.0,288.39,0.0,0.0,90,Cloudy skies,Full cloud cover,23-10-2015 19:00,2015-10-23,4553.12
0.0,287.71,0.0,0.0,90,Cloudy skies,Full cloud cover,23-10-2015 20:00,2015-10-23,4273.62
0.0,286.79,0.0,0.0,91,Cloudy skies,Full cloud cover,23-10-2015 21:00,2015-10-23,3605.42
0.0,285.8,0.0,0.0,90,Cloudy skies,Full cloud cover,23-10-2015 22:00,2015-10-23,2525.12
0.0,286.41,0.0,0.0,90,Cloudy skies,Full cloud cover,23-10-2015 23:00,2015-10-23,1758.12
0.0,285.67,0.0,0.0,99,Light rain,Mild drizzle,24-10-2015 00:00,2015-10-24,1178.32
0.0,285.91,0.0,0.0,90,Cloudy skies,Full cloud cover,24-10-2015 01:00,2015-10-24,809.12
0.0,286.1,0.0,0.0,100,Airborne particles,Smoky air,24-10-2015 02:00,2015-10-24,767.52
0.0,286.89,0.0,0.0,100,Light fog,Fine fog,24-10-2015 03:00,2015-10-24,956.02
0.0,286.44,0.0,0.0,101,Light fog,Fine fog,24-10-2015 04:00,2015-10-24,1452.62
0.0,286.67,0.0,0.0,91,Light fog,Fine fog,24-10-2015 05:00,2015-10-24,3860.22
0.0,286.03,0.0,0.0,90,Light fog,Fine fog,24-10-2015 06:00,2015-10-24,7690.02
0.0,285.9,0.0,0.0,90,Rainfall,Soft rain,24-10-2015 07:00,2015-10-24,7861.62
0.0,286.35,0.0,0.0,91,Light rain,Mild drizzle,24-10-2015 08:00,2015-10-24,7719.92
0.0,286.93,0.0,0.0,90,Light rain,Mild drizzle,24-10-2015 09:00,2015-10-24,7566.52
0.0,287.04,0.0,0.0,90,Light fog,Fine fog,24-10-2015 10:00,2015-10-24,6325.02
0.0,287.42,0.0,0.0,90,Light fog,Fine fog,24-10-2015 11:00,2015-10-24,6566.82
0.0,289.26,0.0,0.0,90,Light fog,Fine fog,24-10-2015 12:00,2015-10-24,6897.02
0.0,289.48,0.0,0.0,90,Airborne particles,Smoky air,24-10-2015 13:00,2015-10-24,6960.72
0.0,289.98,0.0,0.0,91,Light fog,Fine fog,24-10-2015 14:00,2015-10-24,7206.42
0.0,290.44,0.0,0.0,90,Light fog,Fine fog,24-10-2015 15:00,2015-10-24,7787.52
0.0,290.41,0.0,0.0,90,Light fog,Fine fog,24-10-2015 16:00,2015-10-24,7974.72
0.0,290.12,0.0,0.0,90,Airborne particles,Smoky air,24-10-2015 17:00,2015-10-24,8030.62
0.0,290.01,0.0,0.0,90,Airborne particles,Smoky air,24-10-2015 18:00,2015-10-24,6162.52
0.0,290.06,0.0,0.0,91,Light fog,Fine fog,24-10-2015 19:00,2015-10-24,4480.32
0.0,289.04,0.0,0.0,75,Airborne particles,Smoky air,24-10-2015 20:00,2015-10-24,4170.92
0.0,287.86,0.0,0.0,20,Light fog,Fine fog,24-10-2015 21:00,2015-10-24,3675.62
0.0,287.61,0.0,0.0,75,Light fog,Fine fog,24-10-2015 22:00,2015-10-24,2640.82
0.0,288.02,0.0,0.0,90,Light fog,Fine fog,24-10-2015 23:00,2015-10-24,1763.32
0.0,288.51,0.0,0.0,91,Light fog,Fine fog,25-10-2015 00:00,2015-10-25,1175.72
0.0,287.59,0.0,0.0,75,Light fog,Fine fog,25-10-2015 01:00,2015-10-25,879.32
0.0,287.73,0.0,0.0,90,Light fog,Fine fog,25-10-2015 02:00,2015-10-25,783.12
0.0,286.84,0.0,0.0,90,Light fog,Fine fog,25-10-2015 03:00,2015-10-25,905.32
0.0,285.92,0.0,0.0,90,Light fog,Fine fog,25-10-2015 04:00,2015-10-25,1473.42
0.0,285.83,0.0,0.0,90,Light fog,Fine fog,25-10-2015 05:00,2015-10-25,3852.42
0.0,285.83,0.0,0.0,75,Light fog,Fine fog,25-10-2015 06:00,2015-10-25,6865.82
0.0,285.9,0.0,0.0,90,Light fog,Fine fog,25-10-2015 07:00,2015-10-25,8271.12
0.0,285.42,0.0,0.0,90,Light fog,Fine fog,25-10-2015 08:00,2015-10-25,7327.32
0.0,286.63,0.0,0.0,90,Light fog,Fine fog,25-10-2015 10:00,2015-10-25,6195.02
0.0,287.76,0.0,0.0,90,Light fog,Fine fog,25-10-2015 11:00,2015-10-25,6568.12
0.0,288.5,0.0,0.0,90,Light fog,Fine fog,25-10-2015 12:00,2015-10-25,6764.42
0.0,287.79,0.0,0.0,90,Cloudy skies,Full cloud cover,25-10-2015 13:00,2015-10-25,7007.52
0.0,286.61,0.0,0.0,90,Rainfall,Soft rain,25-10-2015 14:00,2015-10-25,7511.92
0.0,286.3,0.0,0.0,90,Light rain,Mild drizzle,25-10-2015 15:00,2015-10-25,8077.42
0.0,286.19,0.0,0.0,90,Rainfall,Soft rain,25-10-2015 16:00,2015-10-25,8834.02
0.0,284.87,0.0,0.0,91,Rainfall,Steady rain,25-10-2015 17:00,2015-10-25,8856.12
0.0,284.49,0.0,0.0,90,Light rain,Mild drizzle,25-10-2015 18:00,2015-10-25,7376.72
0.0,284.69,0.0,0.0,90,Light rain,Mild drizzle,25-10-2015 19:00,2015-10-25,4976.92
0.0,283.54,0.0,0.0,90,Rainfall,Soft rain,25-10-2015 20:00,2015-10-25,4142.32
0.0,284.02,0.0,0.0,90,Rainfall,Steady rain,25-10-2015 21:00,2015-10-25,3793.92
0.0,283.42,0.0,0.0,90,Cloudy skies,Full cloud cover,25-10-2015 22:00,2015-10-25,2998.32
0.0,283.13,0.0,0.0,90,Cloudy skies,Full cloud cover,25-10-2015 23:00,2015-10-25,2092.22
0.0,282.05,0.0,0.0,90,Rainfall,Soft rain,26-10-2015 00:00,2015-10-26,1291.42
0.0,281.14,0.0,0.0,90,Light rain,Light rain,26-10-2015 01:00,2015-10-26,992.42
0.0,280.17,0.0,0.0,91,Rainfall,Soft rain,26-10-2015 02:00,2015-10-26,842.92
0.0,280.54,0.0,0.0,90,Rainfall,Soft rain,26-10-2015 03:00,2015-10-26,913.12
0.0,279.53,0.0,0.0,91,Rainfall,Soft rain,26-10-2015 04:00,2015-10-26,1339.52
0.0,278.57,0.0,0.0,91,Rainfall,Intense rainfall,26-10-2015 05:00,2015-10-26,3587.22
0.0,278.67,0.0,0.0,90,Rainfall,Intense rainfall,26-10-2015 06:00,2015-10-26,7484.62
0.0,277.73,0.0,0.0,90,Rainfall,Soft rain,26-10-2015 07:00,2015-10-26,8876.92
0.0,276.93,0.0,0.0,90,Rainfall,Soft rain,26-10-2015 08:00,2015-10-26,8042.32
0.0,276.36,0.0,0.0,90,Rainfall,Soft rain,26-10-2015 09:00,2015-10-26,7225.92
0.0,275.62,0.0,0.0,90,Rainfall,Soft rain,26-10-2015 10:00,2015-10-26,6527.82
0.0,275.53,0.0,0.0,90,Rainfall,Soft rain,26-10-2015 11:00,2015-10-26,7374.12
0.0,275.1,0.0,0.0,90,Light fog,Fine fog,26-10-2015 12:00,2015-10-26,8148.92
0.0,275.11,0.0,0.0,90,Snowfall,Deep snow,26-10-2015 13:00,2015-10-26,8067.02
0.0,276.18,0.0,0.0,91,Snowfall,Deep snow,26-10-2015 14:00,2015-10-26,8065.72
0.0,276.55,0.0,0.0,90,Snowfall,Deep snow,26-10-2015 15:00,2015-10-26,8297.12
0.0,276.86,0.0,0.0,91,Cloudy skies,Full cloud cover,26-10-2015 16:00,2015-10-26,8672.82
0.0,276.9,0.0,0.0,90,Cloudy skies,Full cloud cover,26-10-2015 17:00,2015-10-26,8165.82
0.0,276.91,0.0,0.0,90,Cloudy skies,Full cloud cover,26-10-2015 18:00,2015-10-26,7362.42
0.0,277.43,0.0,0.0,91,Cloudy skies,Full cloud cover,26-10-2015 19:00,2015-10-26,5814.12
0.0,276.43,0.0,0.0,90,Cloudy skies,Full cloud cover,26-10-2015 20:00,2015-10-26,4646.72
0.0,276.39,0.0,0.0,75,Cloudy skies,Fragmented clouds,26-10-2015 21:00,2015-10-26,4352.92
0.0,277.28,0.0,0.0,90,Cloudy skies,Full cloud cover,26-10-2015 22:00,2015-10-26,4025.32
0.0,276.38,0.0,0.0,90,Cloudy skies,Full cloud cover,26-10-2015 23:00,2015-10-26,2893.02
0.0,276.31,0.0,0.0,90,Cloudy skies,Full cloud cover,27-10-2015 00:00,2015-10-27,1928.42
0.0,276.36,0.0,0.0,91,Cloudy skies,Full cloud cover,27-10-2015 01:00,2015-10-27,1492.92
0.0,275.63,0.0,0.0,21,Cloudy skies,Scattered clouds,27-10-2015 02:00,2015-10-27,1258.92
0.0,274.78,0.0,0.0,20,Cloudy skies,Scattered clouds,27-10-2015 03:00,2015-10-27,962.52
0.0,274.61,0.0,0.0,1,Clear skies,Clear skies,27-10-2015 04:00,2015-10-27,1036.62
0.0,274.41,0.0,0.0,1,Clear skies,Clear skies,27-10-2015 05:00,2015-10-27,1366.82
0.0,273.73,0.0,0.0,1,Clear skies,Clear skies,27-10-2015 06:00,2015-10-27,2267.72
0.0,274.25,0.0,0.0,20,Cloudy skies,Scattered clouds,27-10-2015 07:00,2015-10-27,3272.62
0.0,275.38,0.0,0.0,75,Cloudy skies,Fragmented clouds,27-10-2015 08:00,2015-10-27,4568.72
0.0,275.89,0.0,0.0,90,Cloudy skies,Full cloud cover,27-10-2015 09:00,2015-10-27,5729.62
0.0,276.44,0.0,0.0,0,Clear skies,Clear skies,27-10-2015 10:00,2015-10-27,6300.32
0.0,276.31,0.0,0.0,90,Cloudy skies,Full cloud cover,27-10-2015 11:00,2015-10-27,8234.72
0.0,277.28,0.0,0.0,90,Cloudy skies,Full cloud cover,27-10-2015 12:00,2015-10-27,8191.82
0.0,277.5,0.0,0.0,91,Cloudy skies,Full cloud cover,27-10-2015 13:00,2015-10-27,7327.32
0.0,276.86,0.0,0.0,90,Cloudy skies,Full cloud cover,27-10-2015 14:00,2015-10-27,6508.32
0.0,277.41,0.0,0.0,90,Cloudy skies,Full cloud cover,27-10-2015 15:00,2015-10-27,6154.72
0.0,277.7,0.0,0.0,90,Cloudy skies,Full cloud cover,27-10-2015 16:00,2015-10-27,6150.82
0.0,277.01,0.0,0.0,90,Cloudy skies,Full cloud cover,27-10-2015 17:00,2015-10-27,6035.12
0.0,276.54,0.0,0.0,90,Cloudy skies,Full cloud cover,27-10-2015 18:00,2015-10-27,5888.22
0.0,276.76,0.0,0.0,90,Cloudy skies,Full cloud cover,27-10-2015 19:00,2015-10-27,4939.22
0.0,276.4,0.0,0.0,91,Cloudy skies,Full cloud cover,27-10-2015 20:00,2015-10-27,4429.62
0.0,274.96,0.0,0.0,90,Cloudy skies,Full cloud cover,27-10-2015 21:00,2015-10-27,4233.32
0.0,274.65,0.0,0.0,21,Cloudy skies,Scattered clouds,27-10-2015 22:00,2015-10-27,4251.52
0.0,274.12,0.0,0.0,20,Cloudy skies,Scattered clouds,27-10-2015 23:00,2015-10-27,3335.02
0.0,273.92,0.0,0.0,21,Cloudy skies,Scattered clouds,28-10-2015 00:00,2015-10-28,2461.42
0.0,273.84,0.0,0.0,90,Cloudy skies,Full cloud cover,28-10-2015 01:00,2015-10-28,1460.42
0.0,273.73,0.0,0.0,90,Cloudy skies,Full cloud cover,28-10-2015 02:00,2015-10-28,1008.02
0.0,273.83,0.0,0.0,91,Cloudy skies,Full cloud cover,28-10-2015 03:00,2015-10-28,998.92
0.0,273.62,0.0,0.0,90,Cloudy skies,Full cloud cover,28-10-2015 04:00,2015-10-28,858.52
0.0,273.65,0.0,0.0,76,Cloudy skies,Fragmented clouds,28-10-2015 05:00,2015-10-28,1013.22
0.0,272.76,0.0,0.0,75,Cloudy skies,Fragmented clouds,28-10-2015 06:00,2015-10-28,1403.22
0.0,271.46,0.0,0.0,20,Cloudy skies,Scattered clouds,28-10-2015 07:00,2015-10-28,1659.32
0.0,271.48,0.0,0.0,1,Clear skies,Clear skies,28-10-2015 08:00,2015-10-28,2564.12
0.0,273.0,0.0,0.0,1,Clear skies,Clear skies,28-10-2015 09:00,2015-10-28,3596.32
0.0,274.56,0.0,0.0,1,Clear skies,Clear skies,28-10-2015 10:00,2015-10-28,4624.62
0.0,276.61,0.0,0.0,1,Clear skies,Clear skies,28-10-2015 11:00,2015-10-28,5078.32
0.0,277.94,0.0,0.0,20,Cloudy skies,Scattered clouds,28-10-2015 12:00,2015-10-28,5807.62
0.0,279.24,0.0,0.0,40,Cloudy skies,Partly cloudy skies,28-10-2015 13:00,2015-10-28,5482.62
0.0,279.07,0.0,0.0,41,Cloudy skies,Partly cloudy skies,28-10-2015 14:00,2015-10-28,5610.02
0.0,279.61,0.0,0.0,75,Cloudy skies,Fragmented clouds,28-10-2015 15:00,2015-10-28,6010.42
0.0,278.91,0.0,0.0,76,Cloudy skies,Fragmented clouds,28-10-2015 16:00,2015-10-28,6300.32
0.0,278.77,0.0,0.0,75,Cloudy skies,Fragmented clouds,28-10-2015 17:00,2015-10-28,5985.72
0.0,277.17,0.0,0.0,76,Cloudy skies,Fragmented clouds,28-10-2015 18:00,2015-10-28,5550.22
0.0,275.96,0.0,0.0,75,Cloudy skies,Fragmented clouds,28-10-2015 19:00,2015-10-28,4545.32
0.0,275.19,0.0,0.0,75,Cloudy skies,Fragmented clouds,28-10-2015 20:00,2015-10-28,4034.42
0.0,274.17,0.0,0.0,75,Cloudy skies,Fragmented clouds,28-10-2015 21:00,2015-10-28,3301.22
0.0,273.07,0.0,0.0,75,Cloudy skies,Fragmented clouds,28-10-2015 22:00,2015-10-28,2464.02
0.0,272.41,0.0,0.0,75,Cloudy skies,Fragmented clouds,28-10-2015 23:00,2015-10-28,1812.72
0.0,272.58,0.0,0.0,40,Cloudy skies,Partly cloudy skies,29-10-2015 00:00,2015-10-29,1115.92
0.0,271.61,0.0,0.0,76,Airborne particles,Smoky air,29-10-2015 01:00,2015-10-29,859.82
0.0,271.86,0.0,0.0,75,Light fog,Fine fog,29-10-2015 02:00,2015-10-29,771.42
0.0,272.46,0.0,0.0,75,Cloudy skies,Fragmented clouds,29-10-2015 03:00,2015-10-29,837.72
0.0,272.94,0.0,0.0,90,Cloudy skies,Full cloud cover,29-10-2015 04:00,2015-10-29,1469.52
0.0,272.08,0.0,0.0,91,Cloudy skies,Full cloud cover,29-10-2015 05:00,2015-10-29,3687.32
0.0,272.33,0.0,0.0,41,Cloudy skies,Partly cloudy skies,29-10-2015 06:00,2015-10-29,7574.32
0.0,271.76,0.0,0.0,41,Cloudy skies,Partly cloudy skies,29-10-2015 07:00,2015-10-29,9058.92
0.0,271.9,0.0,0.0,41,Cloudy skies,Partly cloudy skies,29-10-2015 08:00,2015-10-29,8472.62
0.0,273.86,0.0,0.0,75,Cloudy skies,Fragmented clouds,29-10-2015 09:00,2015-10-29,7248.02
0.0,275.7,0.0,0.0,90,Cloudy skies,Full cloud cover,29-10-2015 10:00,2015-10-29,6222.32
0.0,277.03,0.0,0.0,91,Cloudy skies,Full cloud cover,29-10-2015 11:00,2015-10-29,6373.12
0.0,277.98,0.0,0.0,90,Snowfall,Deep snow,29-10-2015 12:00,2015-10-29,6626.62
0.0,278.8,0.0,0.0,91,Cloudy skies,Full cloud cover,29-10-2015 13:00,2015-10-29,6711.12
0.0,279.9,0.0,0.0,90,Cloudy skies,Full cloud cover,29-10-2015 14:00,2015-10-29,7102.42
0.0,279.99,0.0,0.0,90,Cloudy skies,Full cloud cover,29-10-2015 15:00,2015-10-29,7716.02
0.0,280.61,0.0,0.0,40,Cloudy skies,Partly cloudy skies,29-10-2015 16:00,2015-10-29,8377.72
0.0,280.72,0.0,0.0,40,Cloudy skies,Partly cloudy skies,29-10-2015 17:00,2015-10-29,8208.72
0.0,278.89,0.0,0.0,41,Cloudy skies,Partly cloudy skies,29-10-2015 18:00,2015-10-29,6172.92
0.0,278.25,0.0,0.0,40,Cloudy skies,Partly cloudy skies,29-10-2015 19:00,2015-10-29,4438.72
0.0,277.07,0.0,0.0,40,Cloudy skies,Partly cloudy skies,29-10-2015 20:00,2015-10-29,3852.42
0.0,276.91,0.0,0.0,75,Cloudy skies,Fragmented clouds,29-10-2015 21:00,2015-10-29,3177.72
0.0,277.06,0.0,0.0,76,Cloudy skies,Fragmented clouds,29-10-2015 22:00,2015-10-29,2287.22
0.0,275.32,0.0,0.0,20,Cloudy skies,Scattered clouds,29-10-2015 23:00,2015-10-29,1625.52
0.0,275.65,0.0,0.0,20,Cloudy skies,Scattered clouds,30-10-2015 00:00,2015-10-30,1203.02
0.0,274.74,0.0,0.0,20,Cloudy skies,Scattered clouds,30-10-2015 01:00,2015-10-30,930.02
0.0,274.27,0.0,0.0,20,Cloudy skies,Scattered clouds,30-10-2015 02:00,2015-10-30,809.12
0.0,274.2,0.0,0.0,2,Clear skies,Clear skies,30-10-2015 03:00,2015-10-30,885.82
0.0,273.35,0.0,0.0,75,Cloudy skies,Fragmented clouds,30-10-2015 04:00,2015-10-30,1416.22
0.0,274.0,0.0,0.0,20,Cloudy skies,Scattered clouds,30-10-2015 05:00,2015-10-30,3699.02
0.0,273.69,0.0,0.0,21,Cloudy skies,Scattered clouds,30-10-2015 06:00,2015-10-30,7543.12
0.0,273.58,0.0,0.0,40,Cloudy skies,Partly cloudy skies,30-10-2015 07:00,2015-10-30,9169.42
0.0,274.91,0.0,0.0,75,Cloudy skies,Fragmented clouds,30-10-2015 08:00,2015-10-30,8184.02
0.0,275.02,0.0,0.0,75,Cloudy skies,Fragmented clouds,30-10-2015 09:00,2015-10-30,7285.72
0.0,276.46,0.0,0.0,75,Cloudy skies,Fragmented clouds,30-10-2015 10:00,2015-10-30,6438.12
0.0,278.19,0.0,0.0,90,Cloudy skies,Full cloud cover,30-10-2015 11:00,2015-10-30,6852.82
0.0,279.37,0.0,0.0,91,Cloudy skies,Full cloud cover,30-10-2015 12:00,2015-10-30,7089.42
0.0,279.62,0.0,0.0,91,Cloudy skies,Full cloud cover,30-10-2015 13:00,2015-10-30,7090.72
0.0,279.48,0.0,0.0,90,Cloudy skies,Full cloud cover,30-10-2015 14:00,2015-10-30,7433.92
0.0,280.49,0.0,0.0,90,Cloudy skies,Full cloud cover,30-10-2015 15:00,2015-10-30,8009.82
0.0,281.0,0.0,0.0,90,Cloudy skies,Full cloud cover,30-10-2015 16:00,2015-10-30,8510.32
0.0,281.2,0.0,0.0,90,Cloudy skies,Full cloud cover,30-10-2015 17:00,2015-10-30,8212.62
0.0,280.28,0.0,0.0,75,Cloudy skies,Fragmented clouds,30-10-2015 18:00,2015-10-30,6377.02
0.0,279.38,0.0,0.0,75,Cloudy skies,Fragmented clouds,30-10-2015 19:00,2015-10-30,4641.52
0.0,279.4,0.0,0.0,91,Cloudy skies,Full cloud cover,30-10-2015 20:00,2015-10-30,4109.82
0.0,277.23,0.0,0.0,75,Cloudy skies,Fragmented clouds,30-10-2015 21:00,2015-10-30,3779.62
0.0,276.13,0.0,0.0,40,Cloudy skies,Partly cloudy skies,30-10-2015 22:00,2015-10-30,2995.72
0.0,275.51,0.0,0.0,40,Cloudy skies,Partly cloudy skies,30-10-2015 23:00,2015-10-30,2148.12
0.0,274.47,0.0,0.0,40,Cloudy skies,Partly cloudy skies,31-10-2015 00:00,2015-10-31,1134.12
0.0,273.69,0.0,0.0,1,Clear skies,Clear skies,31-10-2015 01:00,2015-10-31,876.72
0.0,272.71,0.0,0.0,2,Clear skies,Clear skies,31-10-2015 02:00,2015-10-31,766.22
0.0,272.81,0.0,0.0,1,Clear skies,Clear skies,31-10-2015 03:00,2015-10-31,865.02
0.0,273.29,0.0,0.0,1,Clear skies,Clear skies,31-10-2015 04:00,2015-10-31,1425.32
0.0,271.83,0.0,0.0,1,Clear skies,Clear skies,31-10-2015 05:00,2015-10-31,3818.62
0.0,271.74,0.0,0.0,1,Clear skies,Clear skies,31-10-2015 06:00,2015-10-31,7680.92
0.0,271.32,0.0,0.0,1,Clear skies,Clear skies,31-10-2015 07:00,2015-10-31,9399.52
0.0,271.67,0.0,0.0,20,Cloudy skies,Scattered clouds,31-10-2015 08:00,2015-10-31,8321.82
0.0,273.31,0.0,0.0,20,Cloudy skies,Scattered clouds,31-10-2015 09:00,2015-10-31,7324.72
0.0,277.01,0.0,0.0,20,Cloudy skies,Scattered clouds,31-10-2015 10:00,2015-10-31,6364.02
0.0,278.37,0.0,0.0,20,Cloudy skies,Scattered clouds,31-10-2015 11:00,2015-10-31,6670.82
0.0,280.44,0.0,0.0,20,Cloudy skies,Scattered clouds,31-10-2015 12:00,2015-10-31,6984.12
0.0,281.08,0.0,0.0,41,Cloudy skies,Partly cloudy skies,31-10-2015 13:00,2015-10-31,6986.72
0.0,281.72,0.0,0.0,21,Cloudy skies,Scattered clouds,31-10-2015 14:00,2015-10-31,7287.02
0.0,282.3,0.0,0.0,20,Cloudy skies,Scattered clouds,31-10-2015 15:00,2015-10-31,8137.22
0.0,283.2,0.0,0.0,40,Cloudy skies,Partly cloudy skies,31-10-2015 16:00,2015-10-31,8389.42
0.0,282.48,0.0,0.0,20,Cloudy skies,Scattered clouds,31-10-2015 17:00,2015-10-31,7994.22
0.0,281.0,0.0,0.0,20,Cloudy skies,Scattered clouds,31-10-2015 18:00,2015-10-31,5682.82
0.0,278.58,0.0,0.0,20,Cloudy skies,Scattered clouds,31-10-2015 19:00,2015-10-31,3953.82
0.0,276.96,0.0,0.0,20,Cloudy skies,Scattered clouds,31-10-2015 20:00,2015-10-31,3926.52
0.0,275.55,0.0,0.0,1,Clear skies,Clear skies,31-10-2015 21:00,2015-10-31,3723.72
0.0,274.45,0.0,0.0,1,Clear skies,Clear skies,31-10-2015 22:00,2015-10-31,2926.82
0.0,273.45,0.0,0.0,2,Clear skies,Clear skies,31-10-2015 23:00,2015-10-31,2337.92
0.0,272.73,0.0,0.0,2,Clear skies,Clear skies,01-11-2015 0:00,2015-11-01,1360.32
0.0,271.61,0.0,0.0,1,Clear skies,Clear skies,01-11-2015 1:00,2015-11-01,1015.82
0.0,270.85,0.0,0.0,1,Clear skies,Clear skies,01-11-2015 2:00,2015-11-01,848.12
0.0,270.38,0.0,0.0,1,Clear skies,Clear skies,01-11-2015 3:00,2015-11-01,926.12
0.0,270.34,0.0,0.0,1,Clear skies,Clear skies,01-11-2015 4:00,2015-11-01,1431.82
0.0,269.36,0.0,0.0,1,Clear skies,Clear skies,01-11-2015 5:00,2015-11-01,3770.52
0.0,268.91,0.0,0.0,1,Clear skies,Clear skies,01-11-2015 6:00,2015-11-01,7696.52
0.0,269.64,0.0,0.0,2,Clear skies,Clear skies,01-11-2015 7:00,2015-11-01,9335.82
0.0,269.25,0.0,0.0,21,Cloudy skies,Scattered clouds,01-11-2015 8:00,2015-11-01,8080.02
0.0,271.5,0.0,0.0,1,Clear skies,Clear skies,01-11-2015 9:00,2015-11-01,7352.02
0.0,273.55,0.0,0.0,2,Clear skies,Clear skies,01-11-2015 10:00,2015-11-01,6601.92
0.0,276.3,0.0,0.0,20,Cloudy skies,Scattered clouds,01-11-2015 11:00,2015-11-01,7024.42
0.0,278.8,0.0,0.0,20,Cloudy skies,Scattered clouds,01-11-2015 12:00,2015-11-01,7293.52
0.0,280.95,0.0,0.0,20,Cloudy skies,Scattered clouds,01-11-2015 13:00,2015-11-01,7166.12
0.0,282.67,0.0,0.0,2,Clear skies,Clear skies,01-11-2015 14:00,2015-11-01,7570.42
0.0,283.83,0.0,0.0,1,Clear skies,Clear skies,01-11-2015 15:00,2015-11-01,7849.92
0.0,283.93,0.0,0.0,2,Clear skies,Clear skies,01-11-2015 16:00,2015-11-01,8633.82
0.0,284.04,0.0,0.0,20,Cloudy skies,Scattered clouds,01-11-2015 17:00,2015-11-01,8620.82
0.0,282.1,0.0,0.0,20,Cloudy skies,Scattered clouds,01-11-2015 18:00,2015-11-01,6748.82
0.0,279.94,0.0,0.0,41,Cloudy skies,Partly cloudy skies,01-11-2015 19:00,2015-11-01,4970.42
0.0,279.28,0.0,0.0,40,Cloudy skies,Partly cloudy skies,01-11-2015 20:00,2015-11-01,4468.62
0.0,278.91,0.0,0.0,91,Cloudy skies,Full cloud cover,01-11-2015 21:00,2015-11-01,3973.32
0.0,279.46,0.0,0.0,91,Cloudy skies,Full cloud cover,01-11-2015 22:00,2015-11-01,2800.72
0.0,279.71,0.0,0.0,90,Light rain,Mild drizzle,01-11-2015 23:00,2015-11-01,2010.32
0.0,279.75,0.0,0.0,90,Cloudy skies,Full cloud cover,02-11-2015 0:00,2015-11-02,1223.82
0.0,278.49,0.0,0.0,75,Airborne particles,Smoky air,02-11-2015 1:00,2015-11-02,1004.12
0.0,277.71,0.0,0.0,40,Cloudy skies,Partly cloudy skies,02-11-2015 2:00,2015-11-02,857.22
0.0,278.05,0.0,0.0,76,Cloudy skies,Fragmented clouds,02-11-2015 3:00,2015-11-02,905.32
0.0,278.1,0.0,0.0,75,Cloudy skies,Fragmented clouds,02-11-2015 4:00,2015-11-02,1343.42
0.0,278.71,0.0,0.0,90,Cloudy skies,Full cloud cover,02-11-2015 5:00,2015-11-02,3513.12
0.0,278.83,0.0,0.0,91,Cloudy skies,Full cloud cover,02-11-2015 6:00,2015-11-02,7228.52
0.0,279.02,0.0,0.0,90,Cloudy skies,Full cloud cover,02-11-2015 7:00,2015-11-02,8889.92
0.0,278.18,0.0,0.0,75,Cloudy skies,Fragmented clouds,02-11-2015 8:00,2015-11-02,7861.62
0.0,278.12,0.0,0.0,40,Cloudy skies,Partly cloudy skies,02-11-2015 9:00,2015-11-02,7238.92
0.0,278.57,0.0,0.0,91,Cloudy skies,Full cloud cover,02-11-2015 10:00,2015-11-02,6559.02
0.0,279.18,0.0,0.0,90,Cloudy skies,Full cloud cover,02-11-2015 11:00,2015-11-02,7349.42
0.0,279.48,0.0,0.0,75,Cloudy skies,Fragmented clouds,02-11-2015 12:00,2015-11-02,7445.62
0.0,279.99,0.0,0.0,76,Cloudy skies,Fragmented clouds,02-11-2015 13:00,2015-11-02,7504.12
0.0,280.34,0.0,0.0,1,Clear skies,Clear skies,02-11-2015 14:00,2015-11-02,7788.82
0.0,280.6,0.0,0.0,41,Cloudy skies,Partly cloudy skies,02-11-2015 15:00,2015-11-02,8341.32
0.0,279.96,0.0,0.0,40,Cloudy skies,Partly cloudy skies,02-11-2015 16:00,2015-11-02,8648.12
0.0,279.7,0.0,0.0,40,Cloudy skies,Partly cloudy skies,02-11-2015 17:00,2015-11-02,8035.82
0.0,277.46,0.0,0.0,40,Cloudy skies,Partly cloudy skies,02-11-2015 18:00,2015-11-02,6906.12
0.0,276.19,0.0,0.0,40,Cloudy skies,Partly cloudy skies,02-11-2015 19:00,2015-11-02,5209.62
0.0,275.38,0.0,0.0,20,Cloudy skies,Scattered clouds,02-11-2015 20:00,2015-11-02,4200.82
0.0,273.51,0.0,0.0,20,Cloudy skies,Scattered clouds,02-11-2015 21:00,2015-11-02,4226.82
0.0,273.77,0.0,0.0,1,Clear skies,Clear skies,02-11-2015 22:00,2015-11-02,3965.52
0.0,272.36,0.0,0.0,2,Clear skies,Clear skies,02-11-2015 23:00,2015-11-02,2629.12
0.0,272.61,0.0,0.0,21,Cloudy skies,Scattered clouds,03-11-2015 0:00,2015-11-03,1936.22
0.0,272.7,0.0,0.0,75,Cloudy skies,Fragmented clouds,03-11-2015 1:00,2015-11-03,1360.32
0.0,271.8,0.0,0.0,75,Cloudy skies,Fragmented clouds,03-11-2015 2:00,2015-11-03,1158.82
0.0,270.61,0.0,0.0,20,Cloudy skies,Scattered clouds,03-11-2015 3:00,2015-11-03,876.72
0.0,270.6,0.0,0.0,21,Cloudy skies,Scattered clouds,03-11-2015 4:00,2015-11-03,919.62
0.0,269.66,0.0,0.0,1,Clear skies,Clear skies,03-11-2015 5:00,2015-11-03,1335.62
0.0,269.99,0.0,0.0,20,Cloudy skies,Scattered clouds,03-11-2015 6:00,2015-11-03,2022.02
0.0,270.14,0.0,0.0,21,Cloudy skies,Scattered clouds,03-11-2015 7:00,2015-11-03,3094.52
0.0,269.79,0.0,0.0,40,Cloudy skies,Partly cloudy skies,03-11-2015 8:00,2015-11-03,4638.92
0.0,271.57,0.0,0.0,75,Cloudy skies,Fragmented clouds,03-11-2015 9:00,2015-11-03,6126.12
0.0,272.95,0.0,0.0,75,Cloudy skies,Fragmented clouds,03-11-2015 10:00,2015-11-03,6369.22
0.0,274.43,0.0,0.0,75,Cloudy skies,Fragmented clouds,03-11-2015 11:00,2015-11-03,5974.02
0.0,275.75,0.0,0.0,76,Cloudy skies,Fragmented clouds,03-11-2015 12:00,2015-11-03,6704.62
0.0,276.13,0.0,0.0,75,Cloudy skies,Fragmented clouds,03-11-2015 13:00,2015-11-03,6201.52
0.0,276.23,0.0,0.0,40,Cloudy skies,Partly cloudy skies,03-11-2015 14:00,2015-11-03,6146.92
0.0,276.4,0.0,0.0,40,Cloudy skies,Partly cloudy skies,03-11-2015 15:00,2015-11-03,6039.02
0.0,277.19,0.0,0.0,75,Cloudy skies,Fragmented clouds,03-11-2015 16:00,2015-11-03,6158.62
0.0,277.31,0.0,0.0,75,Cloudy skies,Fragmented clouds,03-11-2015 17:00,2015-11-03,5792.02
0.0,276.79,0.0,0.0,75,Cloudy skies,Fragmented clouds,03-11-2015 18:00,2015-11-03,5626.92
0.0,276.83,0.0,0.0,90,Cloudy skies,Full cloud cover,03-11-2015 19:00,2015-11-03,4848.22
0.0,276.13,0.0,0.0,90,Cloudy skies,Full cloud cover,03-11-2015 20:00,2015-11-03,4029.22
0.0,276.43,0.0,0.0,90,Cloudy skies,Full cloud cover,03-11-2015 21:00,2015-11-03,3782.22
0.0,275.97,0.0,0.0,90,Cloudy skies,Full cloud cover,03-11-2015 22:00,2015-11-03,3747.12
0.0,275.88,0.0,0.0,91,Cloudy skies,Full cloud cover,03-11-2015 23:00,2015-11-03,2960.62
0.0,275.87,0.0,0.0,90,Cloudy skies,Full cloud cover,04-11-2015 0:00,2015-11-04,3192.02
0.0,276.5,0.0,0.0,90,Cloudy skies,Full cloud cover,04-11-2015 1:00,2015-11-04,1374.62
0.0,275.72,0.0,0.0,90,Cloudy skies,Full cloud cover,04-11-2015 2:00,2015-11-04,878.02
0.0,275.67,0.0,0.0,90,Cloudy skies,Full cloud cover,04-11-2015 3:00,2015-11-04,709.02
0.0,275.93,0.0,0.0,91,Cloudy skies,Full cloud cover,04-11-2015 5:00,2015-11-04,1057.42
0.0,275.48,0.0,0.0,90,Cloudy skies,Full cloud cover,04-11-2015 6:00,2015-11-04,1351.22
0.0,275.68,0.0,0.0,90,Cloudy skies,Full cloud cover,04-11-2015 7:00,2015-11-04,1938.82
0.0,275.59,0.0,0.0,90,Rainfall,Soft rain,04-11-2015 8:00,2015-11-04,3115.32
0.0,276.14,0.0,0.0,91,Cloudy skies,Full cloud cover,04-11-2015 9:00,2015-11-04,4212.52
0.0,276.8,0.0,0.0,90,Cloudy skies,Full cloud cover,04-11-2015 10:00,2015-11-04,5008.12
0.0,277.35,0.0,0.0,91,Cloudy skies,Full cloud cover,04-11-2015 11:00,2015-11-04,5316.22
0.0,277.36,0.0,0.0,91,Cloudy skies,Full cloud cover,04-11-2015 12:00,2015-11-04,5706.22
0.0,277.41,0.0,0.0,90,Cloudy skies,Full cloud cover,04-11-2015 13:00,2015-11-04,5680.22
0.0,278.73,0.0,0.0,90,Cloudy skies,Full cloud cover,04-11-2015 14:00,2015-11-04,5888.22
0.0,278.94,0.0,0.0,91,Cloudy skies,Full cloud cover,04-11-2015 15:00,2015-11-04,5756.92
0.0,278.64,0.0,0.0,90,Cloudy skies,Full cloud cover,04-11-2015 16:00,2015-11-04,5646.42
0.0,278.99,0.0,0.0,90,Cloudy skies,Full cloud cover,04-11-2015 17:00,2015-11-04,5129.02
0.0,277.92,0.0,0.0,91,Cloudy skies,Full cloud cover,04-11-2015 18:00,2015-11-04,5170.62
0.0,278.01,0.0,0.0,90,Cloudy skies,Full cloud cover,04-11-2015 19:00,2015-11-04,4107.22
0.0,277.3,0.0,0.0,90,Cloudy skies,Full cloud cover,04-11-2015 20:00,2015-11-04,3608.02
0.0,277.86,0.0,0.0,90,Cloudy skies,Full cloud cover,04-11-2015 21:00,2015-11-04,2963.22
0.0,277.4,0.0,0.0,90,Cloudy skies,Full cloud cover,04-11-2015 22:00,2015-11-04,2305.42
0.0,276.74,0.0,0.0,90,Rainfall,Soft rain,04-11-2015 23:00,2015-11-04,1717.82
0.0,276.67,0.0,0.0,91,Cloudy skies,Full cloud cover,05-11-2015 0:00,2015-11-05,2662.92
0.0,276.27,0.0,0.0,75,Cloudy skies,Fragmented clouds,05-11-2015 1:00,2015-11-05,2107.82
0.0,275.47,0.0,0.0,41,Cloudy skies,Partly cloudy skies,05-11-2015 2:00,2015-11-05,814.32
0.0,275.16,0.0,0.0,20,Cloudy skies,Scattered clouds,05-11-2015 3:00,2015-11-05,963.82
0.0,273.55,0.0,0.0,75,Light fog,Fine fog,05-11-2015 4:00,2015-11-05,1401.92
0.0,273.26,0.0,0.0,20,Cloudy skies,Scattered clouds,05-11-2015 5:00,2015-11-05,3753.62
0.0,272.68,0.0,0.0,20,Cloudy skies,Scattered clouds,05-11-2015 6:00,2015-11-05,7783.62
0.0,273.02,0.0,0.0,1,Clear skies,Clear skies,05-11-2015 7:00,2015-11-05,9363.12
0.0,273.49,0.0,0.0,90,Cloudy skies,Full cloud cover,05-11-2015 8:00,2015-11-05,8206.12
0.0,274.56,0.0,0.0,90,Cloudy skies,Full cloud cover,05-11-2015 9:00,2015-11-05,6926.92
0.0,276.69,0.0,0.0,90,Cloudy skies,Full cloud cover,05-11-2015 10:00,2015-11-05,6158.62
0.0,278.25,0.0,0.0,90,Cloudy skies,Full cloud cover,05-11-2015 11:00,2015-11-05,6374.42
0.0,278.23,0.0,0.0,90,Cloudy skies,Full cloud cover,05-11-2015 12:00,2015-11-05,6547.32
0.0,278.57,0.0,0.0,90,Cloudy skies,Full cloud cover,05-11-2015 13:00,2015-11-05,6473.22
0.0,279.01,0.0,0.0,46,Clear skies,Clear skies,05-11-2015 14:00,2015-11-05,6885.32
0.0,280.86,0.0,0.0,46,Clear skies,Clear skies,05-11-2015 16:00,2015-11-05,8388.12
0.0,280.66,0.0,0.0,47,Clear skies,Clear skies,05-11-2015 17:00,2015-11-05,8394.62
0.0,279.76,0.0,0.0,46,Clear skies,Clear skies,05-11-2015 18:00,2015-11-05,5963.62
0.0,280.76,0.0,0.0,46,Clear skies,Clear skies,05-11-2015 20:00,2015-11-05,3566.42
0.0,281.46,0.0,0.0,46,Clear skies,Clear skies,05-11-2015 21:00,2015-11-05,2973.62
0.0,280.66,0.0,0.0,46,Clear skies,Clear skies,05-11-2015 22:00,2015-11-05,2317.12
0.0,281.26,0.0,0.0,46,Clear skies,Clear skies,05-11-2015 23:00,2015-11-05,1650.22
0.0,280.66,0.0,0.0,46,Clear skies,Clear skies,06-11-2015 0:00,2015-11-06,1117.22
0.0,274.91,0.0,0.0,98,Clear skies,Clear skies,06-11-2015 1:00,2015-11-06,828.62
0.0,275.21,0.0,0.0,98,Clear skies,Clear skies,06-11-2015 2:00,2015-11-06,759.72
0.0,275.41,0.0,0.0,98,Clear skies,Clear skies,06-11-2015 3:00,2015-11-06,891.02
0.0,274.91,0.0,0.0,98,Clear skies,Clear skies,06-11-2015 4:00,2015-11-06,1451.32
0.0,274.91,0.0,0.0,98,Clear skies,Clear skies,06-11-2015 5:00,2015-11-06,3761.42
0.0,274.71,0.0,0.0,98,Clear skies,Clear skies,06-11-2015 6:00,2015-11-06,7358.52
0.0,275.31,0.0,0.0,99,Clear skies,Clear skies,06-11-2015 7:00,2015-11-06,8458.32
0.0,275.61,0.0,0.0,99,Clear skies,Clear skies,06-11-2015 8:00,2015-11-06,8467.42
0.0,275.31,0.0,0.0,99,Clear skies,Clear skies,06-11-2015 9:00,2015-11-06,7864.22
0.0,275.71,0.0,0.0,100,Clear skies,Clear skies,06-11-2015 10:00,2015-11-06,6422.52
0.0,277.62,0.0,0.0,90,Light fog,Fine fog,06-11-2015 12:00,2015-11-06,6495.32
0.0,278.44,0.0,0.0,90,Cloudy skies,Full cloud cover,06-11-2015 13:00,2015-11-06,6952.92
0.0,279.19,0.0,0.0,90,Cloudy skies,Full cloud cover,06-11-2015 14:00,2015-11-06,7567.82
0.0,279.08,0.0,0.0,90,Cloudy skies,Full cloud cover,06-11-2015 15:00,2015-11-06,8185.32
0.0,279.59,0.0,0.0,90,Light fog,Fine fog,06-11-2015 16:00,2015-11-06,8490.82
0.0,278.85,0.0,0.0,90,Light fog,Fine fog,06-11-2015 17:00,2015-11-06,7508.02
0.0,278.84,0.0,0.0,90,Airborne particles,Smoky air,06-11-2015 18:00,2015-11-06,5520.32
0.0,279.67,0.0,0.0,90,Airborne particles,Smoky air,06-11-2015 19:00,2015-11-06,4112.42
0.0,279.22,0.0,0.0,90,Airborne particles,Smoky air,06-11-2015 20:00,2015-11-06,3613.22
0.0,279.84,0.0,0.0,90,Airborne particles,Smoky air,06-11-2015 21:00,2015-11-06,3127.02
0.0,279.36,0.0,0.0,90,Airborne particles,Smoky air,06-11-2015 22:00,2015-11-06,2597.92
0.0,278.6,0.0,0.0,90,Airborne particles,Smoky air,06-11-2015 23:00,2015-11-06,2340.52
0.0,278.23,0.0,0.0,90,Airborne particles,Smoky air,07-11-2015 0:00,2015-11-07,1451.32
0.0,278.18,0.0,0.0,91,Rainfall,Soft rain,07-11-2015 1:00,2015-11-07,1483.82
0.0,277.56,0.0,0.0,90,Rainfall,Soft rain,07-11-2015 2:00,2015-11-07,1296.62
0.0,277.63,0.0,0.0,90,Rainfall,Soft rain,07-11-2015 3:00,2015-11-07,1047.02
0.0,278.05,0.0,0.0,91,Rainfall,Soft rain,07-11-2015 4:00,2015-11-07,1446.12
0.0,277.67,0.0,0.0,90,Rainfall,Soft rain,07-11-2015 5:00,2015-11-07,3830.32
0.0,277.61,0.0,0.0,90,Rainfall,Soft rain,07-11-2015 6:00,2015-11-07,7951.32
0.0,278.31,0.0,0.0,90,Light rain,Mild drizzle,07-11-2015 7:00,2015-11-07,9634.82
0.0,278.18,0.0,0.0,90,Light fog,Fine fog,07-11-2015 8:00,2015-11-07,8564.92
0.0,279.15,0.0,0.0,90,Cloudy skies,Full cloud cover,07-11-2015 9:00,2015-11-07,7220.72
0.0,279.32,0.0,0.0,90,Cloudy skies,Full cloud cover,07-11-2015 10:00,2015-11-07,6356.22
0.0,278.71,0.0,0.0,90,Cloudy skies,Full cloud cover,07-11-2015 11:00,2015-11-07,6629.22
0.0,279.44,0.0,0.0,90,Cloudy skies,Full cloud cover,07-11-2015 12:00,2015-11-07,6937.32
0.0,279.69,0.0,0.0,91,Cloudy skies,Full cloud cover,07-11-2015 13:00,2015-11-07,6776.12
0.0,278.93,0.0,0.0,90,Rainfall,Soft rain,07-11-2015 14:00,2015-11-07,7397.52
0.0,279.07,0.0,0.0,91,Rainfall,Soft rain,07-11-2015 15:00,2015-11-07,7804.42
0.0,278.41,0.0,0.0,90,Rainfall,Soft rain,07-11-2015 16:00,2015-11-07,8577.92
0.0,278.16,0.0,0.0,90,Light fog,Fine fog,07-11-2015 17:00,2015-11-07,8294.52
0.0,277.81,0.0,0.0,90,Light fog,Fine fog,07-11-2015 18:00,2015-11-07,6770.92
0.0,277.38,0.0,0.0,90,Cloudy skies,Full cloud cover,07-11-2015 19:00,2015-11-07,4226.82
0.0,277.48,0.0,0.0,91,Cloudy skies,Full cloud cover,07-11-2015 20:00,2015-11-07,3803.02
0.0,277.68,0.0,0.0,90,Cloudy skies,Full cloud cover,07-11-2015 21:00,2015-11-07,3480.62
0.0,277.93,0.0,0.0,91,Rainfall,Soft rain,07-11-2015 22:00,2015-11-07,2427.62
0.0,277.66,0.0,0.0,90,Cloudy skies,Full cloud cover,07-11-2015 23:00,2015-11-07,2009.02
0.0,277.79,0.0,0.0,91,Cloudy skies,Full cloud cover,08-11-2015 0:00,2015-11-08,1446.12
0.0,277.44,0.0,0.0,90,Cloudy skies,Full cloud cover,08-11-2015 1:00,2015-11-08,889.72
0.0,277.11,0.0,0.0,90,Cloudy skies,Full cloud cover,08-11-2015 2:00,2015-11-08,794.82
0.0,277.32,0.0,0.0,90,Cloudy skies,Full cloud cover,08-11-2015 3:00,2015-11-08,943.02
0.0,276.82,0.0,0.0,91,Cloudy skies,Full cloud cover,08-11-2015 4:00,2015-11-08,1459.12
0.0,276.99,0.0,0.0,90,Cloudy skies,Full cloud cover,08-11-2015 5:00,2015-11-08,3909.62
0.0,276.69,0.0,0.0,91,Cloudy skies,Full cloud cover,08-11-2015 6:00,2015-11-08,7718.62
0.0,277.28,0.0,0.0,90,Cloudy skies,Full cloud cover,08-11-2015 7:00,2015-11-08,9305.92
0.0,277.54,0.0,0.0,90,Cloudy skies,Full cloud cover,08-11-2015 8:00,2015-11-08,8583.12
0.0,278.29,0.0,0.0,90,Cloudy skies,Full cloud cover,08-11-2015 9:00,2015-11-08,7517.12
0.0,278.71,0.0,0.0,91,Cloudy skies,Full cloud cover,08-11-2015 10:00,2015-11-08,6497.92
0.0,279.31,0.0,0.0,91,Cloudy skies,Full cloud cover,08-11-2015 11:00,2015-11-08,7011.42
0.0,280.66,0.0,0.0,90,Cloudy skies,Full cloud cover,08-11-2015 12:00,2015-11-08,7249.32
0.0,280.97,0.0,0.0,75,Cloudy skies,Fragmented clouds,08-11-2015 13:00,2015-11-08,6981.52
0.0,280.83,0.0,0.0,90,Cloudy skies,Full cloud cover,08-11-2015 14:00,2015-11-08,7459.92
0.0,281.07,0.0,0.0,90,Cloudy skies,Full cloud cover,08-11-2015 15:00,2015-11-08,8056.62
0.0,281.3,0.0,0.0,90,Cloudy skies,Full cloud cover,08-11-2015 16:00,2015-11-08,8953.62
0.0,280.59,0.0,0.0,90,Cloudy skies,Full cloud cover,08-11-2015 17:00,2015-11-08,8486.92
0.0,279.31,0.0,0.0,90,Cloudy skies,Full cloud cover,08-11-2015 18:00,2015-11-08,6518.72
0.0,277.99,0.0,0.0,41,Cloudy skies,Partly cloudy skies,08-11-2015 19:00,2015-11-08,4744.22
0.0,277.9,0.0,0.0,75,Cloudy skies,Fragmented clouds,08-11-2015 20:00,2015-11-08,4625.92
0.0,276.92,0.0,0.0,75,Cloudy skies,Fragmented clouds,08-11-2015 21:00,2015-11-08,4051.32
0.0,276.35,0.0,0.0,40,Cloudy skies,Partly cloudy skies,08-11-2015 22:00,2015-11-08,2952.82
0.0,276.5,0.0,0.0,90,Cloudy skies,Full cloud cover,08-11-2015 23:00,2015-11-08,1957.02
0.0,277.0,0.0,0.0,75,Cloudy skies,Fragmented clouds,09-11-2015 0:00,2015-11-09,1270.62
0.0,276.41,0.0,0.0,40,Cloudy skies,Partly cloudy skies,09-11-2015 1:00,2015-11-09,979.42
0.0,276.49,0.0,0.0,40,Cloudy skies,Partly cloudy skies,09-11-2015 2:00,2015-11-09,867.62
0.0,275.7,0.0,0.0,40,Cloudy skies,Partly cloudy skies,09-11-2015 3:00,2015-11-09,900.12
0.0,276.14,0.0,0.0,20,Cloudy skies,Scattered clouds,09-11-2015 4:00,2015-11-09,1313.52
0.0,276.05,0.0,0.0,20,Cloudy skies,Scattered clouds,09-11-2015 5:00,2015-11-09,3639.22
0.0,276.2,0.0,0.0,1,Clear skies,Clear skies,09-11-2015 6:00,2015-11-09,7618.52
0.0,276.1,0.0,0.0,1,Clear skies,Clear skies,09-11-2015 7:00,2015-11-09,9374.82
0.0,276.89,0.0,0.0,1,Clear skies,Clear skies,09-11-2015 8:00,2015-11-09,8108.62
0.0,277.17,0.0,0.0,2,Clear skies,Clear skies,09-11-2015 9:00,2015-11-09,7231.12
0.0,279.66,0.0,0.0,1,Clear skies,Clear skies,09-11-2015 10:00,2015-11-09,6556.42
0.0,283.06,0.0,0.0,76,Cloudy skies,Fragmented clouds,09-11-2015 11:00,2015-11-09,7322.12
0.0,282.79,0.0,0.0,1,Clear skies,Clear skies,09-11-2015 12:00,2015-11-09,7558.72
0.0,284.81,0.0,0.0,40,Cloudy skies,Partly cloudy skies,09-11-2015 13:00,2015-11-09,7612.02
0.0,284.67,0.0,0.0,40,Cloudy skies,Partly cloudy skies,09-11-2015 14:00,2015-11-09,7990.32
0.0,285.14,0.0,0.0,76,Cloudy skies,Fragmented clouds,09-11-2015 15:00,2015-11-09,8169.72
0.0,285.11,0.0,0.0,40,Cloudy skies,Partly cloudy skies,09-11-2015 16:00,2015-11-09,8819.72
0.0,282.96,0.0,0.0,41,Cloudy skies,Partly cloudy skies,09-11-2015 17:00,2015-11-09,8421.92
0.0,280.1,0.0,0.0,21,Cloudy skies,Scattered clouds,09-11-2015 18:00,2015-11-09,7355.92
0.0,278.84,0.0,0.0,20,Cloudy skies,Scattered clouds,09-11-2015 19:00,2015-11-09,5027.62
0.0,278.49,0.0,0.0,2,Clear skies,Clear skies,09-11-2015 20:00,2015-11-09,4572.62
0.0,278.38,0.0,0.0,1,Clear skies,Clear skies,09-11-2015 21:00,2015-11-09,4254.12
0.0,277.76,0.0,0.0,20,Cloudy skies,Scattered clouds,09-11-2015 22:00,2015-11-09,3667.82
0.0,277.55,0.0,0.0,20,Cloudy skies,Scattered clouds,09-11-2015 23:00,2015-11-09,2647.32
0.0,277.04,0.0,0.0,1,Clear skies,Clear skies,10-11-2015 0:00,2015-11-10,1842.62
0.0,276.08,0.0,0.0,1,Clear skies,Clear skies,10-11-2015 1:00,2015-11-10,1382.42
0.0,276.03,0.0,0.0,2,Clear skies,Clear skies,10-11-2015 2:00,2015-11-10,1125.02
0.0,275.83,0.0,0.0,21,Cloudy skies,Scattered clouds,10-11-2015 3:00,2015-11-10,907.92
0.0,275.49,0.0,0.0,21,Cloudy skies,Scattered clouds,10-11-2015 4:00,2015-11-10,936.52
0.0,275.75,0.0,0.0,75,Cloudy skies,Fragmented clouds,10-11-2015 5:00,2015-11-10,1331.72
0.0,276.1,0.0,0.0,40,Light fog,Fine fog,10-11-2015 6:00,2015-11-10,2116.92
0.0,275.83,0.0,0.0,41,Cloudy skies,Partly cloudy skies,10-11-2015 7:00,2015-11-10,2935.92
0.0,277.09,0.0,0.0,20,Cloudy skies,Scattered clouds,10-11-2015 8:00,2015-11-10,4260.62
0.0,278.16,0.0,0.0,20,Cloudy skies,Scattered clouds,10-11-2015 9:00,2015-11-10,5006.82
0.0,280.65,0.0,0.0,20,Cloudy skies,Scattered clouds,10-11-2015 10:00,2015-11-10,5408.52
0.0,282.65,0.0,0.0,20,Cloudy skies,Scattered clouds,10-11-2015 11:00,2015-11-10,6063.72
0.0,284.05,0.0,0.0,21,Cloudy skies,Scattered clouds,10-11-2015 12:00,2015-11-10,6611.02
0.0,284.39,0.0,0.0,76,Cloudy skies,Fragmented clouds,10-11-2015 13:00,2015-11-10,6098.82
0.0,284.93,0.0,0.0,76,Cloudy skies,Fragmented clouds,10-11-2015 14:00,2015-11-10,6105.32
0.0,284.08,0.0,0.0,1,Clear skies,Clear skies,10-11-2015 15:00,2015-11-10,6326.32
0.0,283.1,0.0,0.0,1,Clear skies,Clear skies,10-11-2015 16:00,2015-11-10,6300.32
0.0,282.46,0.0,0.0,91,Cloudy skies,Full cloud cover,10-11-2015 17:00,2015-11-10,6510.92
0.0,281.31,0.0,0.0,90,Cloudy skies,Full cloud cover,10-11-2015 18:00,2015-11-10,5652.92
0.0,280.94,0.0,0.0,90,Cloudy skies,Full cloud cover,10-11-2015 19:00,2015-11-10,4492.02
0.0,281.08,0.0,0.0,90,Cloudy skies,Full cloud cover,10-11-2015 20:00,2015-11-10,4206.02
0.0,280.68,0.0,0.0,90,Cloudy skies,Full cloud cover,10-11-2015 21:00,2015-11-10,4128.02
0.0,280.53,0.0,0.0,90,Cloudy skies,Full cloud cover,10-11-2015 22:00,2015-11-10,4694.82
0.0,280.83,0.0,0.0,90,Cloudy skies,Full cloud cover,10-11-2015 23:00,2015-11-10,3331.12
0.0,280.37,0.0,0.0,90,Airborne particles,Smoky air,11-11-2015 0:00,2015-11-11,2215.72
0.0,280.57,0.0,0.0,90,Light rain,Mild drizzle,11-11-2015 1:00,2015-11-11,1619.02
0.0,280.81,0.0,0.0,90,Light fog,Fine fog,11-11-2015 2:00,2015-11-11,1234.22
0.0,281.16,0.0,0.0,90,Rainfall,Soft rain,11-11-2015 3:00,2015-11-11,854.62
0.0,280.5,0.0,0.0,91,Stormy weather,Storm with mild rain,11-11-2015 4:00,2015-11-11,824.72
0.0,280.5,0.0,0.0,90,Light fog,Fine fog,11-11-2015 5:00,2015-11-11,1030.12
0.0,280.49,0.0,0.0,90,Stormy weather,Storm with mild rain,11-11-2015 6:00,2015-11-11,1455.22
0.0,280.25,0.0,0.0,91,Light rain,Mild drizzle,11-11-2015 7:00,2015-11-11,1879.02
0.0,280.31,0.0,0.0,90,Light fog,Fine fog,11-11-2015 8:00,2015-11-11,2764.32
0.0,281.33,0.0,0.0,91,Light fog,Fine fog,11-11-2015 9:00,2015-11-11,3921.32
0.0,282.02,0.0,0.0,90,Light fog,Fine fog,11-11-2015 10:00,2015-11-11,5577.52
0.0,282.15,0.0,0.0,90,Light fog,Fine fog,11-11-2015 11:00,2015-11-11,5733.52
0.0,283.92,0.0,0.0,91,Light fog,Fine fog,11-11-2015 12:00,2015-11-11,5248.62
0.0,285.44,0.0,0.0,75,Light fog,Fine fog,11-11-2015 13:00,2015-11-11,5277.22
0.0,287.8,0.0,0.0,20,Airborne particles,Smoky air,11-11-2015 14:00,2015-11-11,5184.92
0.0,289.91,0.0,0.0,20,Airborne particles,Smoky air,11-11-2015 15:00,2015-11-11,5642.52
0.0,291.64,0.0,0.0,20,Light fog,Fine fog,11-11-2015 16:00,2015-11-11,5840.12
0.0,290.68,0.0,0.0,20,Light fog,Fine fog,11-11-2015 17:00,2015-11-11,5156.32
0.0,289.09,0.0,0.0,20,Stormy weather,Approaching thunderstorm,11-11-2015 18:00,2015-11-11,4836.52
0.0,290.05,0.0,0.0,40,Light fog,Fine fog,11-11-2015 19:00,2015-11-11,3881.02
0.0,292.07,0.0,0.0,90,Cloudy skies,Full cloud cover,11-11-2015 20:00,2015-11-11,3244.02
0.0,291.38,0.0,0.0,87,Clear skies,Clear skies,11-11-2015 21:00,2015-11-11,2924.22
0.0,289.12,0.0,0.0,87,Clear skies,Clear skies,11-11-2015 23:00,2015-11-11,4142.32
1.0,288.62,0.0,0.0,87,Clear skies,Clear skies,12-11-2015 0:00,2015-11-12,1723.02
1.0,283.04,0.0,0.0,98,Clear skies,Clear skies,12-11-2015 1:00,2015-11-12,885.82
1.0,283.14,0.0,0.0,99,Clear skies,Clear skies,12-11-2015 2:00,2015-11-12,763.62
1.0,283.04,0.0,0.0,98,Clear skies,Clear skies,12-11-2015 3:00,2015-11-12,868.92
1.0,283.14,0.0,0.0,98,Clear skies,Clear skies,12-11-2015 4:00,2015-11-12,1418.82
1.0,283.64,0.0,0.0,98,Clear skies,Clear skies,12-11-2015 5:00,2015-11-12,3636.62
1.0,283.24,0.0,0.0,99,Clear skies,Clear skies,12-11-2015 6:00,2015-11-12,7233.72
1.0,274.8,0.0,0.0,100,Clear skies,Clear skies,12-11-2015 7:00,2015-11-12,7435.22
1.0,274.4,0.0,0.0,99,Clear skies,Clear skies,12-11-2015 8:00,2015-11-12,3056.82
1.0,274.4,0.0,0.0,99,Clear skies,Clear skies,12-11-2015 9:00,2015-11-12,3143.92
1.0,273.32,0.0,0.0,90,Cloudy skies,Full cloud cover,12-11-2015 10:00,2015-11-12,4181.32
1.0,272.19,0.0,0.0,90,Snowfall,Deep snow,12-11-2015 11:00,2015-11-12,5949.32
1.0,272.64,0.0,0.0,90,Snowfall,Deep snow,12-11-2015 12:00,2015-11-12,5819.32
1.0,272.15,0.0,0.0,90,Cloudy skies,Full cloud cover,12-11-2015 13:00,2015-11-12,6091.02
1.0,272.1,0.0,0.0,90,Cloudy skies,Full cloud cover,12-11-2015 14:00,2015-11-12,6435.52
1.0,272.25,0.0,0.0,90,Cloudy skies,Full cloud cover,12-11-2015 15:00,2015-11-12,6601.92
1.0,271.4,0.0,0.0,90,Cloudy skies,Full cloud cover,12-11-2015 16:00,2015-11-12,7168.72
1.0,270.87,0.0,0.0,90,Cloudy skies,Full cloud cover,12-11-2015 17:00,2015-11-12,7160.92
1.0,270.46,0.0,0.0,90,Cloudy skies,Full cloud cover,12-11-2015 18:00,2015-11-12,5431.92
1.0,270.71,0.0,0.0,90,Cloudy skies,Full cloud cover,12-11-2015 19:00,2015-11-12,3862.82
1.0,269.89,0.0,0.0,90,Snowfall,Deep snow,12-11-2015 20:00,2015-11-12,3310.32
1.0,269.01,0.0,0.0,91,Snowfall,Deep snow,12-11-2015 21:00,2015-11-12,2946.32
1.0,269.29,0.0,0.0,90,Snowfall,Deep snow,12-11-2015 22:00,2015-11-12,2289.82
1.0,268.17,0.0,0.0,90,Snowfall,Deep snow,12-11-2015 23:00,2015-11-12,3558.62
0.0,267.25,0.0,0.0,90,Snowfall,Deep snow,13-11-2015 00:00,2015-11-13,1596.92
0.0,267.14,0.0,0.0,90,Cloudy skies,Full cloud cover,13-11-2015 01:00,2015-11-13,897.52
0.0,267.48,0.0,0.0,90,Snowfall,Deep snow,13-11-2015 02:00,2015-11-13,802.62
0.0,266.82,0.0,0.0,75,Cloudy skies,Fragmented clouds,13-11-2015 03:00,2015-11-13,840.32
0.0,266.83,0.0,0.0,90,Cloudy skies,Full cloud cover,13-11-2015 04:00,2015-11-13,1438.32
0.0,267.05,0.0,0.0,21,Snowfall,Deep snow,13-11-2015 05:00,2015-11-13,3769.22
0.0,267.12,0.0,0.0,75,Snowfall,Deep snow,13-11-2015 06:00,2015-11-13,7630.22
0.0,267.05,0.0,0.0,90,Snowfall,Deep snow,13-11-2015 07:00,2015-11-13,8906.82
0.0,267.86,0.0,0.0,90,Snowfall,Deep snow,13-11-2015 08:00,2015-11-13,8545.42
0.0,267.15,0.0,0.0,75,Snowfall,Deep snow,13-11-2015 09:00,2015-11-13,7492.42
0.0,268.41,0.0,0.0,76,Snowfall,Deep snow,13-11-2015 10:00,2015-11-13,6478.42
0.0,268.65,0.0,0.0,90,Snowfall,Deep snow,13-11-2015 11:00,2015-11-13,6612.32
0.0,269.07,0.0,0.0,90,Snowfall,Deep snow,13-11-2015 12:00,2015-11-13,6852.82
0.0,269.64,0.0,0.0,90,Cloudy skies,Full cloud cover,13-11-2015 13:00,2015-11-13,6825.52
0.0,269.43,0.0,0.0,91,Cloudy skies,Full cloud cover,13-11-2015 14:00,2015-11-13,7457.32
0.0,270.01,0.0,0.0,75,Cloudy skies,Fragmented clouds,13-11-2015 15:00,2015-11-13,7786.22
0.0,269.44,0.0,0.0,90,Cloudy skies,Full cloud cover,13-11-2015 16:00,2015-11-13,8796.32
0.0,269.66,0.0,0.0,90,Cloudy skies,Full cloud cover,13-11-2015 17:00,2015-11-13,8503.82
0.0,269.15,0.0,0.0,90,Cloudy skies,Full cloud cover,13-11-2015 18:00,2015-11-13,6040.32
0.0,268.36,0.0,0.0,90,Cloudy skies,Full cloud cover,13-11-2015 19:00,2015-11-13,4261.92
0.0,268.41,0.0,0.0,76,Cloudy skies,Fragmented clouds,13-11-2015 20:00,2015-11-13,3810.82
0.0,268.11,0.0,0.0,21,Cloudy skies,Scattered clouds,13-11-2015 21:00,2015-11-13,3277.82
0.0,268.15,0.0,0.0,2,Clear skies,Clear skies,13-11-2015 22:00,2015-11-13,2460.12
0.0,267.45,0.0,0.0,20,Cloudy skies,Scattered clouds,13-11-2015 23:00,2015-11-13,2176.72
0.0,267.23,0.0,0.0,20,Cloudy skies,Scattered clouds,14-11-2015 00:00,2015-11-14,1121.12
0.0,266.39,0.0,0.0,1,Clear skies,Clear skies,14-11-2015 01:00,2015-11-14,850.72
0.0,266.24,0.0,0.0,1,Clear skies,Clear skies,14-11-2015 02:00,2015-11-14,750.62
0.0,265.84,0.0,0.0,2,Clear skies,Clear skies,14-11-2015 03:00,2015-11-14,898.82
0.0,265.31,0.0,0.0,2,Clear skies,Clear skies,14-11-2015 04:00,2015-11-14,1461.72
0.0,265.37,0.0,0.0,1,Clear skies,Clear skies,14-11-2015 05:00,2015-11-14,3830.32
0.0,265.42,0.0,0.0,2,Clear skies,Clear skies,14-11-2015 06:00,2015-11-14,7878.52
0.0,265.5,0.0,0.0,1,Clear skies,Clear skies,14-11-2015 07:00,2015-11-14,9260.42
0.0,267.2,0.0,0.0,1,Clear skies,Clear skies,14-11-2015 08:00,2015-11-14,8483.02
0.0,269.75,0.0,0.0,1,Clear skies,Clear skies,14-11-2015 09:00,2015-11-14,7202.52
0.0,271.99,0.0,0.0,40,Cloudy skies,Partly cloudy skies,14-11-2015 10:00,2015-11-14,6742.32
0.0,273.67,0.0,0.0,1,Clear skies,Clear skies,14-11-2015 11:00,2015-11-14,7548.32
0.0,275.1,0.0,0.0,2,Clear skies,Clear skies,14-11-2015 12:00,2015-11-14,7777.12
0.0,278.09,0.0,0.0,2,Clear skies,Clear skies,14-11-2015 13:00,2015-11-14,7917.52
0.0,278.82,0.0,0.0,1,Clear skies,Clear skies,14-11-2015 14:00,2015-11-14,8397.22
0.0,279.95,0.0,0.0,75,Cloudy skies,Fragmented clouds,14-11-2015 15:00,2015-11-14,8765.12
0.0,278.92,0.0,0.0,75,Cloudy skies,Fragmented clouds,14-11-2015 16:00,2015-11-14,9767.42
0.0,277.5,0.0,0.0,75,Cloudy skies,Fragmented clouds,14-11-2015 17:00,2015-11-14,9480.12
0.0,276.58,0.0,0.0,90,Cloudy skies,Full cloud cover,14-11-2015 18:00,2015-11-14,7160.92
0.0,276.28,0.0,0.0,91,Cloudy skies,Full cloud cover,14-11-2015 19:00,2015-11-14,5025.02
0.0,276.98,0.0,0.0,90,Cloudy skies,Full cloud cover,14-11-2015 20:00,2015-11-14,4386.72
0.0,276.73,0.0,0.0,90,Cloudy skies,Full cloud cover,14-11-2015 21:00,2015-11-14,3891.42
0.0,276.93,0.0,0.0,90,Cloudy skies,Full cloud cover,14-11-2015 22:00,2015-11-14,3084.12
0.0,277.13,0.0,0.0,90,Cloudy skies,Full cloud cover,14-11-2015 23:00,2015-11-14,2815.02
0.0,277.18,0.0,0.0,90,Cloudy skies,Full cloud cover,15-11-2015 00:00,2015-11-15,1167.92
0.0,276.86,0.0,0.0,91,Cloudy skies,Full cloud cover,15-11-2015 01:00,2015-11-15,841.62
0.0,276.92,0.0,0.0,91,Cloudy skies,Full cloud cover,15-11-2015 02:00,2015-11-15,809.12
0.0,276.87,0.0,0.0,90,Cloudy skies,Full cloud cover,15-11-2015 03:00,2015-11-15,907.92
0.0,275.67,0.0,0.0,91,Cloudy skies,Full cloud cover,15-11-2015 04:00,2015-11-15,1491.62
0.0,275.91,0.0,0.0,90,Cloudy skies,Full cloud cover,15-11-2015 05:00,2015-11-15,3873.22
0.0,274.54,0.0,0.0,90,Cloudy skies,Full cloud cover,15-11-2015 06:00,2015-11-15,7985.12
0.0,274.31,0.0,0.0,76,Cloudy skies,Fragmented clouds,15-11-2015 07:00,2015-11-15,9209.72
0.0,274.26,0.0,0.0,40,Cloudy skies,Partly cloudy skies,15-11-2015 08:00,2015-11-15,8441.42
0.0,276.94,0.0,0.0,21,Cloudy skies,Scattered clouds,15-11-2015 09:00,2015-11-15,7428.72
0.0,278.73,0.0,0.0,40,Cloudy skies,Partly cloudy skies,15-11-2015 10:00,2015-11-15,6539.52
0.0,279.43,0.0,0.0,1,Clear skies,Clear skies,15-11-2015 11:00,2015-11-15,6685.12
0.0,280.91,0.0,0.0,1,Clear skies,Clear skies,15-11-2015 12:00,2015-11-15,7079.02
0.0,283.56,0.0,0.0,41,Cloudy skies,Partly cloudy skies,15-11-2015 13:00,2015-11-15,7067.32
0.0,284.6,0.0,0.0,75,Cloudy skies,Fragmented clouds,15-11-2015 14:00,2015-11-15,7705.62
0.0,283.39,0.0,0.0,75,Cloudy skies,Fragmented clouds,15-11-2015 15:00,2015-11-15,7972.12
0.0,282.52,0.0,0.0,75,Cloudy skies,Fragmented clouds,15-11-2015 16:00,2015-11-15,8965.32
0.0,280.63,0.0,0.0,75,Cloudy skies,Fragmented clouds,15-11-2015 17:00,2015-11-15,8735.22
0.0,279.67,0.0,0.0,90,Cloudy skies,Full cloud cover,15-11-2015 18:00,2015-11-15,6553.82
0.0,279.34,0.0,0.0,90,Cloudy skies,Full cloud cover,15-11-2015 19:00,2015-11-15,4837.82
0.0,279.02,0.0,0.0,90,Cloudy skies,Full cloud cover,15-11-2015 20:00,2015-11-15,4666.22
0.0,278.15,0.0,0.0,91,Cloudy skies,Full cloud cover,15-11-2015 21:00,2015-11-15,3905.72
0.0,280.5,0.0,0.0,91,Cloudy skies,Full cloud cover,15-11-2015 23:00,2015-11-15,2198.82
0.0,279.9,0.0,0.0,91,Cloudy skies,Full cloud cover,16-11-2015 00:00,2015-11-16,1287.52
0.0,277.4,0.0,0.0,99,Rainfall,Soft rain,16-11-2015 01:00,2015-11-16,988.52
0.0,277.4,0.0,0.0,99,Rainfall,Soft rain,16-11-2015 02:00,2015-11-16,854.62
0.0,278.1,0.0,0.0,99,Rainfall,Soft rain,16-11-2015 03:00,2015-11-16,931.32
0.0,277.7,0.0,0.0,99,Rainfall,Soft rain,16-11-2015 04:00,2015-11-16,1346.02
0.0,277.5,0.0,0.0,99,Rainfall,Soft rain,16-11-2015 05:00,2015-11-16,3643.12
0.0,277.3,0.0,0.0,99,Rainfall,Soft rain,16-11-2015 06:00,2015-11-16,7609.42
0.0,277.0,0.0,0.0,0,Clear skies,Clear skies,16-11-2015 07:00,2015-11-16,8893.82
0.0,277.4,0.0,0.0,0,Clear skies,Clear skies,16-11-2015 08:00,2015-11-16,7387.12
0.0,277.8,0.0,0.0,0,Clear skies,Clear skies,16-11-2015 09:00,2015-11-16,7160.92
0.0,277.2,0.0,0.0,0,Clear skies,Clear skies,16-11-2015 10:00,2015-11-16,6483.62
0.0,277.1,0.0,0.0,0,Clear skies,Clear skies,16-11-2015 11:00,2015-11-16,7097.22
0.0,277.3,0.0,0.0,0,Clear skies,Clear skies,16-11-2015 12:00,2015-11-16,7348.12
0.0,277.0,0.0,0.0,0,Clear skies,Clear skies,16-11-2015 13:00,2015-11-16,7558.72
0.0,279.54,0.0,0.0,1,Clear skies,Clear skies,16-11-2015 14:00,2015-11-16,7566.52
0.0,279.54,0.0,0.0,1,Clear skies,Clear skies,16-11-2015 15:00,2015-11-16,8004.62
0.0,279.64,0.0,0.0,1,Clear skies,Clear skies,16-11-2015 16:00,2015-11-16,8785.92
0.0,279.54,0.0,0.0,1,Clear skies,Clear skies,16-11-2015 17:00,2015-11-16,8343.92
0.0,279.74,0.0,0.0,1,Clear skies,Clear skies,16-11-2015 18:00,2015-11-16,7015.32
0.0,279.54,0.0,0.0,1,Clear skies,Clear skies,16-11-2015 19:00,2015-11-16,5009.42
0.0,279.54,0.0,0.0,1,Clear skies,Clear skies,16-11-2015 20:00,2015-11-16,4091.62
0.0,280.14,0.0,0.0,1,Clear skies,Clear skies,16-11-2015 21:00,2015-11-16,4073.42
0.0,279.74,0.0,0.0,1,Clear skies,Clear skies,16-11-2015 22:00,2015-11-16,3849.82
0.0,280.04,0.0,0.0,1,Clear skies,Clear skies,16-11-2015 23:00,2015-11-16,2718.82
0.0,279.94,0.0,0.0,1,Clear skies,Clear skies,17-11-2015 00:00,2015-11-17,1838.72
0.0,271.14,0.0,0.0,0,Clear skies,Clear skies,17-11-2015 01:00,2015-11-17,1381.12
0.0,271.44,0.0,0.0,0,Clear skies,Clear skies,17-11-2015 02:00,2015-11-17,1264.12
0.0,271.14,0.0,0.0,0,Clear skies,Clear skies,17-11-2015 03:00,2015-11-17,953.42
0.0,271.74,0.0,0.0,0,Clear skies,Clear skies,17-11-2015 04:00,2015-11-17,956.02
0.0,267.63,0.0,0.0,2,Clear skies,Clear skies,17-11-2015 05:00,2015-11-17,1404.52
0.0,266.67,0.0,0.0,1,Clear skies,Clear skies,17-11-2015 06:00,2015-11-17,2220.92
0.0,266.91,0.0,0.0,1,Clear skies,Clear skies,17-11-2015 07:00,2015-11-17,3085.42
0.0,268.03,0.0,0.0,20,Cloudy skies,Scattered clouds,17-11-2015 08:00,2015-11-17,4359.42
0.0,271.82,0.0,0.0,20,Cloudy skies,Scattered clouds,17-11-2015 09:00,2015-11-17,5416.32
0.0,274.35,0.0,0.0,20,Cloudy skies,Scattered clouds,17-11-2015 10:00,2015-11-17,5927.22
0.0,276.45,0.0,0.0,20,Cloudy skies,Scattered clouds,17-11-2015 11:00,2015-11-17,6161.22
0.0,278.61,0.0,0.0,20,Cloudy skies,Scattered clouds,17-11-2015 12:00,2015-11-17,6605.82
0.0,279.64,0.0,0.0,40,Cloudy skies,Partly cloudy skies,17-11-2015 13:00,2015-11-17,6308.12
0.0,279.54,0.0,0.0,40,Cloudy skies,Partly cloudy skies,17-11-2015 14:00,2015-11-17,6445.92
0.0,280.19,0.0,0.0,41,Cloudy skies,Partly cloudy skies,17-11-2015 15:00,2015-11-17,6332.82
0.0,279.23,0.0,0.0,40,Cloudy skies,Partly cloudy skies,17-11-2015 16:00,2015-11-17,6291.22
0.0,276.9,0.0,0.0,40,Cloudy skies,Partly cloudy skies,17-11-2015 17:00,2015-11-17,6227.52
0.0,275.03,0.0,0.0,20,Cloudy skies,Scattered clouds,17-11-2015 19:00,2015-11-17,4675.32
0.0,275.33,0.0,0.0,20,Cloudy skies,Scattered clouds,17-11-2015 20:00,2015-11-17,3813.42
0.0,274.65,0.0,0.0,21,Cloudy skies,Scattered clouds,17-11-2015 21:00,2015-11-17,4022.72
0.0,275.1,0.0,0.0,2,Clear skies,Clear skies,17-11-2015 22:00,2015-11-17,3882.32
0.0,275.38,0.0,0.0,1,Clear skies,Clear skies,17-11-2015 23:00,2015-11-17,3279.12
0.0,276.15,0.0,0.0,2,Clear skies,Clear skies,18-11-2015 00:00,2015-11-18,2109.12
0.0,275.75,0.0,0.0,1,Clear skies,Clear skies,18-11-2015 01:00,2015-11-18,1544.92
0.0,275.72,0.0,0.0,2,Clear skies,Clear skies,18-11-2015 02:00,2015-11-18,1264.12
0.0,276.29,0.0,0.0,1,Airborne particles,Smoky air,18-11-2015 03:00,2015-11-18,901.42
0.0,277.16,0.0,0.0,1,Airborne particles,Smoky air,18-11-2015 04:00,2015-11-18,805.22
0.0,276.49,0.0,0.0,1,Clear skies,Clear skies,18-11-2015 05:00,2015-11-18,1047.02
0.0,276.34,0.0,0.0,1,Clear skies,Clear skies,18-11-2015 06:00,2015-11-18,1433.12
0.0,276.4,0.0,0.0,20,Cloudy skies,Scattered clouds,18-11-2015 07:00,2015-11-18,1790.62
0.0,277.28,0.0,0.0,75,Airborne particles,Smoky air,18-11-2015 08:00,2015-11-18,2661.62
0.0,279.6,0.0,0.0,75,Airborne particles,Smoky air,18-11-2015 09:00,2015-11-18,3756.22
0.0,281.8,0.0,0.0,75,Cloudy skies,Fragmented clouds,18-11-2015 10:00,2015-11-18,4625.92
0.0,284.09,0.0,0.0,75,Cloudy skies,Fragmented clouds,18-11-2015 11:00,2015-11-18,5138.12
0.0,286.53,0.0,0.0,90,Cloudy skies,Full cloud cover,18-11-2015 12:00,2015-11-18,5625.62
0.0,286.26,0.0,0.0,75,Cloudy skies,Fragmented clouds,18-11-2015 13:00,2015-11-18,5728.32
0.0,286.85,0.0,0.0,75,Cloudy skies,Fragmented clouds,18-11-2015 14:00,2015-11-18,5574.92
0.0,285.85,0.0,0.0,76,Cloudy skies,Fragmented clouds,18-11-2015 15:00,2015-11-18,5732.22
0.0,285.65,0.0,0.0,75,Cloudy skies,Fragmented clouds,18-11-2015 16:00,2015-11-18,5990.92
0.0,285.11,0.0,0.0,76,Cloudy skies,Fragmented clouds,18-11-2015 17:00,2015-11-18,6100.12
0.0,285.17,0.0,0.0,90,Cloudy skies,Full cloud cover,18-11-2015 18:00,2015-11-18,4975.62
0.0,284.37,0.0,0.0,90,Cloudy skies,Full cloud cover,18-11-2015 19:00,2015-11-18,5066.62
0.0,285.17,0.0,0.0,90,Cloudy skies,Full cloud cover,18-11-2015 20:00,2015-11-18,3934.32
0.0,284.44,0.0,0.0,90,Cloudy skies,Full cloud cover,18-11-2015 21:00,2015-11-18,3030.82
0.0,284.45,0.0,0.0,91,Cloudy skies,Full cloud cover,18-11-2015 22:00,2015-11-18,2384.72
0.0,284.45,0.0,0.0,91,Cloudy skies,Full cloud cover,18-11-2015 23:00,2015-11-18,1671.02
0.0,283.41,0.0,0.0,90,Cloudy skies,Full cloud cover,19-11-2015 00:00,2015-11-19,1040.52
0.0,283.54,0.0,0.0,90,Cloudy skies,Full cloud cover,19-11-2015 01:00,2015-11-19,827.32
0.0,282.65,0.0,0.0,91,Cloudy skies,Full cloud cover,19-11-2015 02:00,2015-11-19,772.72
0.0,282.32,0.0,0.0,91,Cloudy skies,Full cloud cover,19-11-2015 03:00,2015-11-19,892.32
0.0,282.8,0.0,0.0,90,Cloudy skies,Full cloud cover,19-11-2015 04:00,2015-11-19,1451.32
0.0,281.86,0.0,0.0,91,Cloudy skies,Full cloud cover,19-11-2015 05:00,2015-11-19,3778.32
0.0,281.0,0.0,0.0,40,Cloudy skies,Partly cloudy skies,19-11-2015 06:00,2015-11-19,7640.62
0.0,280.23,0.0,0.0,40,Cloudy skies,Partly cloudy skies,19-11-2015 07:00,2015-11-19,9307.22
0.0,280.8,0.0,0.0,40,Cloudy skies,Partly cloudy skies,19-11-2015 08:00,2015-11-19,8072.22
0.0,281.58,0.0,0.0,40,Cloudy skies,Partly cloudy skies,19-11-2015 09:00,2015-11-19,7099.82
0.0,283.15,0.0,0.0,75,Cloudy skies,Fragmented clouds,19-11-2015 10:00,2015-11-19,6300.32
0.0,284.63,0.0,0.0,40,Cloudy skies,Partly cloudy skies,19-11-2015 11:00,2015-11-19,6362.72
0.0,286.1,0.0,0.0,1,Clear skies,Clear skies,19-11-2015 12:00,2015-11-19,6832.02
0.0,287.23,0.0,0.0,1,Clear skies,Clear skies,19-11-2015 13:00,2015-11-19,6754.02
0.0,288.18,0.0,0.0,21,Cloudy skies,Scattered clouds,19-11-2015 14:00,2015-11-19,7075.12
0.0,287.08,0.0,0.0,41,Cloudy skies,Partly cloudy skies,19-11-2015 15:00,2015-11-19,7541.82
0.0,286.22,0.0,0.0,75,Cloudy skies,Fragmented clouds,19-11-2015 16:00,2015-11-19,8587.02
0.0,284.65,0.0,0.0,40,Cloudy skies,Partly cloudy skies,19-11-2015 17:00,2015-11-19,8108.62
0.0,285.04,0.0,0.0,40,Cloudy skies,Partly cloudy skies,19-11-2015 18:00,2015-11-19,5937.62
0.0,284.94,0.0,0.0,75,Cloudy skies,Fragmented clouds,19-11-2015 19:00,2015-11-19,4339.92
0.0,284.44,0.0,0.0,75,Cloudy skies,Fragmented clouds,19-11-2015 20:00,2015-11-19,3861.52
0.0,283.8,0.0,0.0,76,Cloudy skies,Fragmented clouds,19-11-2015 21:00,2015-11-19,3214.12
0.0,283.86,0.0,0.0,75,Cloudy skies,Fragmented clouds,19-11-2015 22:00,2015-11-19,2426.32
0.0,282.98,0.0,0.0,40,Cloudy skies,Partly cloudy skies,19-11-2015 23:00,2015-11-19,1691.82
0.0,282.99,0.0,0.0,75,Cloudy skies,Fragmented clouds,20-11-2015 00:00,2015-11-20,1083.42
0.0,282.67,0.0,0.0,76,Cloudy skies,Fragmented clouds,20-11-2015 01:00,2015-11-20,848.12
0.0,282.85,0.0,0.0,76,Cloudy skies,Fragmented clouds,20-11-2015 02:00,2015-11-20,755.82
0.0,282.96,0.0,0.0,75,Cloudy skies,Fragmented clouds,20-11-2015 03:00,2015-11-20,876.72
0.0,282.67,0.0,0.0,76,Cloudy skies,Fragmented clouds,20-11-2015 04:00,2015-11-20,1431.82
0.0,283.12,0.0,0.0,76,Cloudy skies,Fragmented clouds,20-11-2015 05:00,2015-11-20,3767.92
0.0,283.03,0.0,0.0,90,Cloudy skies,Full cloud cover,20-11-2015 06:00,2015-11-20,7760.22
0.0,282.31,0.0,0.0,75,Cloudy skies,Fragmented clouds,20-11-2015 07:00,2015-11-20,9295.52
0.0,282.63,0.0,0.0,75,Cloudy skies,Fragmented clouds,20-11-2015 08:00,2015-11-20,8210.02
0.0,283.18,0.0,0.0,75,Cloudy skies,Fragmented clouds,20-11-2015 09:00,2015-11-20,7465.12
0.0,283.93,0.0,0.0,40,Cloudy skies,Partly cloudy skies,20-11-2015 10:00,2015-11-20,6694.22
0.0,286.34,0.0,0.0,40,Cloudy skies,Partly cloudy skies,20-11-2015 11:00,2015-11-20,6933.42
0.0,287.27,0.0,0.0,40,Cloudy skies,Partly cloudy skies,20-11-2015 12:00,2015-11-20,7055.62
0.0,287.91,0.0,0.0,40,Cloudy skies,Partly cloudy skies,20-11-2015 13:00,2015-11-20,7270.12
0.0,288.04,0.0,0.0,40,Cloudy skies,Partly cloudy skies,20-11-2015 14:00,2015-11-20,7648.42
0.0,288.73,0.0,0.0,41,Cloudy skies,Partly cloudy skies,20-11-2015 15:00,2015-11-20,7861.62
0.0,286.93,0.0,0.0,41,Cloudy skies,Partly cloudy skies,20-11-2015 16:00,2015-11-20,8906.82
0.0,284.85,0.0,0.0,40,Cloudy skies,Partly cloudy skies,20-11-2015 17:00,2015-11-20,8247.72
0.0,282.37,0.0,0.0,20,Cloudy skies,Scattered clouds,20-11-2015 18:00,2015-11-20,6309.42
0.0,280.64,0.0,0.0,1,Clear skies,Clear skies,20-11-2015 19:00,2015-11-20,4824.82
0.0,279.31,0.0,0.0,1,Clear skies,Clear skies,20-11-2015 20:00,2015-11-20,4324.32
0.0,278.84,0.0,0.0,1,Clear skies,Clear skies,20-11-2015 21:00,2015-11-20,3860.22
0.0,278.69,0.0,0.0,2,Clear skies,Clear skies,20-11-2015 22:00,2015-11-20,3084.12
0.0,278.6,0.0,0.0,2,Airborne particles,Smoky air,20-11-2015 23:00,2015-11-20,1993.42
0.0,277.84,0.0,0.0,20,Light fog,Fine fog,21-11-2015 00:00,2015-11-21,1292.72
0.0,277.43,0.0,0.0,1,Light fog,Fine fog,21-11-2015 01:00,2015-11-21,939.12
0.0,277.19,0.0,0.0,1,Clear skies,Clear skies,21-11-2015 02:00,2015-11-21,771.42
0.0,276.65,0.0,0.0,1,Clear skies,Clear skies,21-11-2015 03:00,2015-11-21,956.02
0.0,275.76,0.0,0.0,1,Light fog,Fine fog,21-11-2015 04:00,2015-11-21,1400.62
0.0,274.89,0.0,0.0,2,Light fog,Fine fog,21-11-2015 05:00,2015-11-21,3658.72
0.0,274.0,0.0,0.0,2,Light fog,Fine fog,21-11-2015 06:00,2015-11-21,7368.92
0.0,273.14,0.0,0.0,1,Light fog,Fine fog,21-11-2015 07:00,2015-11-21,8398.52
0.0,273.21,0.0,0.0,1,Airborne particles,Smoky air,21-11-2015 08:00,2015-11-21,7458.62
0.0,275.26,0.0,0.0,1,Light fog,Fine fog,21-11-2015 09:00,2015-11-21,6980.22
0.0,277.37,0.0,0.0,1,Airborne particles,Smoky air,21-11-2015 10:00,2015-11-21,6757.92
0.0,279.61,0.0,0.0,1,Light fog,Fine fog,21-11-2015 11:00,2015-11-21,7272.72
0.0,281.05,0.0,0.0,20,Cloudy skies,Scattered clouds,21-11-2015 12:00,2015-11-21,7774.52
0.0,283.53,0.0,0.0,20,Cloudy skies,Scattered clouds,21-11-2015 13:00,2015-11-21,7648.42
0.0,284.71,0.0,0.0,20,Cloudy skies,Scattered clouds,21-11-2015 14:00,2015-11-21,8177.52
0.0,284.42,0.0,0.0,20,Cloudy skies,Scattered clouds,21-11-2015 15:00,2015-11-21,8129.42
0.0,282.86,0.0,0.0,40,Cloudy skies,Partly cloudy skies,21-11-2015 16:00,2015-11-21,7878.52
0.0,280.33,0.0,0.0,40,Cloudy skies,Partly cloudy skies,21-11-2015 17:00,2015-11-21,6876.22
0.0,279.03,0.0,0.0,40,Cloudy skies,Partly cloudy skies,21-11-2015 18:00,2015-11-21,5858.32
0.0,277.46,0.0,0.0,40,Cloudy skies,Partly cloudy skies,21-11-2015 19:00,2015-11-21,4674.02
0.0,277.48,0.0,0.0,91,Cloudy skies,Full cloud cover,21-11-2015 20:00,2015-11-21,4046.12
0.0,278.32,0.0,0.0,91,Cloudy skies,Full cloud cover,21-11-2015 21:00,2015-11-21,3587.22
0.0,279.13,0.0,0.0,75,Cloudy skies,Fragmented clouds,21-11-2015 22:00,2015-11-21,2984.02
0.0,278.79,0.0,0.0,21,Cloudy skies,Scattered clouds,21-11-2015 23:00,2015-11-21,2239.12
